" This was my dream car.  In purchasing","5"
" We got this little toyota 99 le 4 door from a party that had got it from a salvage yard. At 72k miles it got hit on the pass. quarter panel, trunk, and rear bumper. It was repaired, you can't even tell it was ever in an accident. It drives like a dream, and don't have to tell you that 30+ mpg is excellent these days. So not only is it a great car, but it can take a hit. Esp. since it has side and front air bags in the le model...Go for it, Toyota !!1","1"
"gas mileage, looks, sun/moon roof/ air condition.It Has Style","4"
"more leg room in rear.","5"
" This bare-bones car runs and runs. Although the styling, road noise, and freeway handling leave a lot to be desired; the fuel economy, peppy street performance, and reliability are excellent.","1"
"Red color, cruise control, and reliability.","5"
" Well, I owned a 99 corolla from new until 2005 when I sold it for 4 grand. At that point it had a little over 315K miles on it, didn't burn oil, no lights, and everything that was in it worked.","1"
"I had to replace oil every 3k miles, but that is about it. It handled better then a civic, got better mpg, and was faster off the line, not to mention cheaper to insure.","1"
"I would love to get my hands on a 99 corolla with a blown motor with the options I had in mine, it is a perfect candidate for a 2zz swap.","4"
"I have owned over 18 cars in my life, and nothing on the planet will take a beating like a Toyota. Not Honda, and nothing American can come close.","2"
" This was my dream car.  In purchasing","5"
" overall toyota has done an outstanding","4"
"innovation to its landcruiser while","5"
"many people may perfer the sequioa","5"
"becasue of the cheaper tag the","5"
"landcruiser is well wroth the price it","5"
" This is my first 4x4 i have had a lot","5"
"of fun driving it up and down 100 meter","5"
"high sand dunes in the UAE then going","4"
"out of the sand and inflate the tyres","5"
"and drive at 100 MPH for hours, and few","4"
" If you purchase the Land Cruiser for its intended use it cannot be beat. For low maintenance and off road, on road ability it cannot be beat in the long run. It is not intended to be a grocery getter. All are built in Japan and intended to last 300k miles. They are shipped all over the world for tough off road conditions. Enjoy your Cruisers. I have owned 5 throughout the years. Do your research and you will not be disappointed. Look at the vehicles diplomats are escorted in dangerous situations around the world and you will notice a large majority are the Cruisers.","1"
"Durability and ruggedness with civility.","5"
"The newer versions have addressed the issues of on road ability.","4"
" Look anyone who owned or currently owns Landcruisers should be fairly well-versed with them. Everyone knows of their reliability & craftsmanship, areas where they are 2nd to none. No doubt they are huge and ponderous to drive and like any other large SUV are big boxes in the wind that return poor gas mileage. However, for pure reliability and comfort, toyota comes thru. This is a pricey vehicle, no doubt, and you would expect memory seats and a more appointed interior, but a true toyota buyer does his homework thoroughly up front and knows their strength is in the fact that you will own this vehicle for years to come and when you move on, most likely your loyalty will remain with toyota","1"
"Nav, nav, nav. Rear camera.","4"
" Forget about the hype from other","5"
"manufacturers who claim to be the","4"
"best, the original, 'professional","5"
"grade', etc.  The Toyota Landcruiser","4"
"is the best built, most durable, full-","5"
" Hi all, just wanted to voice my","5"
"opinion.  I just purchased a 2002","5"
"Landcruiser, this after owning a 2001","5"
"vehicle until I purchased a 96","4"
"Landcruiser. FJ80 as the more avid","5"
"Landcruiser Owner would call it,","4"
"Knowing that you have a tank like","5"
" I purchased this vehicle used in 1998 with 38000 miles. I bought my first Land Cruiser, an FJ40, in 1976 and my first wagon in 1978. You cannot beat the durability and reliability of this vehicle. It handles very well, rides smooth and quiet on road, and will go just about anywhere offroad when needed. It will never leave you stranded.","1"
"Solid construction and 'go anywhere' capability. The straight six has tons of torque and is absolutely reliable.","3"
"Fuel economy is around 12mpg overall.  Like to see a little more legroom up front.","2"
" Bought the Land Cruiser because I heard of its great reliability.  Its been a good car, able to haul kids up skiing and having no trouble with snow.  My problem is maintenance.  It goes through brake pads and rotors.  Second set of rotors in 80,000 miles.  Also had the head gasket blow out in Vail, which was extremely expensive.  Spent far more on maintenance on this car than any other I've owned, including my Fords.  I leave it in the garage except to haul kids skiing.  Think I got the LC Lemon.","1"
" After 9K miles in four months, I am","4"
" I've had my LC for 7 years and the only things I've had to replace are tires and brakes.  The car is bulletproof not just in toughness but also styling and functionality.  Surfing out of the way spots is a piece of cake.  Driving in snowdrifts -  no problem.  Pulling up to the finest restaurants - you feel totally comfortable and stylish.  This car will be used for years to come and will never be sold...","1"
"Visibility, looks, toughness, simple functionality, spaciousness and reliability.","4"
"more cupholders, side mirrors aren't motorized (although the mirrors within are).","5"
" A little surprised at the maintenance","4"
"costs. Bought this vehicle used at 78k","4"
" I spent my formative years in Papua New","5"
"Guinea, where, if you wanted to get","3"
"someplace, you drove a Cruiser.  Not","4"
"much has changed.  I visit Hoduras,","5"
" if you are talking Build Quality and","3"
"Reliability then throw in excellent","5"
"ride, comfort  and the best damn air","5"
"conditioner in a vehicle then the L.C.","4"
"is the best suv on the planet. i have","5"
" with a week, I used this suv and got","4"
"sick of playing inside this because it","5"
"works ploddingly in gear down and","5"
"noisily. I got a bad feeling in turning","4"
"left or right from highway","4"
" So, I researched all the large SUVs  and decided to make a good sound decision and go with the 2002 Land Cruiser.  So far this machine exceeds all of my expectations.  The comfort is unbelievable and the body is a timeless. If you have the pleasure of owning this car, you know the name  and its history stands alone in its own class.  Why buy anything else when you can own a Land Cruiser.","1"
"Fuel economy could be better.  Vented seats would have been a nice touch.","4"
" Great SUV... second Cruiser I currently own. Other is a 1994.  Came off of an Audi Allroad (01) nothing but problems with the Audi it was  about $1000 a month in repairs the 1994 Cruiser averaged 0.  Live back a long gravel road it was tearing the Audi to pieces.  Cruiser has gas mileage but a small price to pay (although its getting larger).  Would recommend this car to anyone.  I will never own anything else. Except maybe the new FJ Cruiser.","1"
"Soundness and reliability","5"
"second row seats that fold up to the sides like the third row - that way you can sleep in the back while camping","2"
" Nice car overall.  Cons include difficulty accessing","5"
"CD changer and understanding how to use the DVD","4"
"player.","5"
"4 wheel drive.  smooth ride.  low key demeanor.","4"
" I have a 2002 Landcruiser and absolutely love it. Traded my 2000 4 Runner for a2005 BMW X5. Turned in under the lemon law...fuel gauge never worked properly and it just stopped one day...BMW gave me a 2006 version but I could never get comfortable with it and kept watching to see if it would light up...check engine soon.  After only 3,000 miles, I went back to Toyota and another Landcruiser. It is great on long trips, handles like a dream and have had absolutely no problems with my 2002 model.  Reliability is number one to me being a single female.","1"
"Everything about it.  It is a wonderful vehicle","5"
"None except maybe better gas mileage but that probably is not possible","4"
" Refined, quite, smooth and powerful.  Supberb fit and finish. Excellent on interstate or pot holes. Confidence inspiring brakes and excelleration. I have owned 4-wheel Ford Exploirer and all-time-4 Range Rover.  They were both older and both may be technically superior today, but I cannot imagine loving any vehicle like my Cruiser","1"
"87 octane gas. Suspension (and adjustments), brakes, steering, transmission, firm adjustible seats, adjustible height control, a real tailgate etc. Quality!","1"
" Overall generally pleased with this vehicle and hope it is as reliable as everyone says, but...   After driving for a few months I am disappointed in the lack of some basic features one would expect in a $60K luxury SUV.  Very basic and bland vehicle and becoming extremely dated in its offering. I have nicknamed it the dinosaur.","1"
"Comfortable, smooth and reasonably powerful with good off road capability, solid build.","3"
"No memory seats, no rain sensing or one touch wipers, interior lighting poor and not controllable from dash, no high intenstiy self leveling head lamps, JBL sounds system poor at best, no third row heat vent?, seat backs and lumbar area do not heat, climate control system struggles.","1"
" I purchased the long bodied 8-seater and although this car is no beauty to look at, it is the best car I've ever owned, and most certainly the best of my SUVs.  Because it is a diesel powered car, the fuel consumption is much better than the gas models. It has great stability and efficiently corrects any tendency to sway in speedy curves.  Design is extremely sturdy and strong but heavy acceleration is remarkably good.  Service prices are quite reasonable. Rational design allows for very fast service and time/mileage between required service is highly competitive.","1"
"Performance, both on and off road. Reliability, all body, motor and transmission elements are sturdy and seem built to last. Comfort is excellent except for air conditioning. Road holding is excellent. Sound isolation is excellent and allows full enjoyment of radio and CD  player.","1"
" This my 5th Land Cruiser.  I was going to switch to the LX 470, but decided that my 4 and 7 year old boys could spill milkshakes and ketchup in a Land Cruiser just as easy as in a Lexus!  Great vehicle.  I bought this one sight unseen at the end of the year and didn't get the exact interior package that I wanted, but that's not big deal.","1"
"Reliability","5"
"More power.  Paint side bumpers to match vehicle like on Lexus LX 470.","5"
" I don't think there is a better SUV on the market. Looks, quality, performance, capability and reliability are unmatched. While not inexpensive, worth every penny.","1"
"NAV is great. Ability to perform in the snow unbelieveable. Plenty of room. Easy to handle in the city. Great on the highway.","3"
" My family has owned six (6!) Land Cruisers over the years, but I was the black sheep who strayed and purchased a Range Rover. The Rover was gorgeous, and a very able 4x4, but the thing was incredibly unreliable. When repairs were needed (which was often) the bills were frequently more than $1000-$2000.","1"
"Long story short, I wised up, sold the Rover and bought an '06 Land Cruiser.","4"
"There's a reason the UN owns 12,000 Land Cruisers: you can't kill 'em. This vehicle is, by far, the most reliable & able SUV in the world. I am the prodigal son who returned, and the LC is where I'm going to stay.","1"
"After all, my Mom's '99 LC just hit 300,000 miles; she's shooting for 1,000,000. Stay tuned.","4"
"Marvelous suspension, classic styling, reliability, confidence that I can go anywhere, anytime, in as safe a manner as possible. I trust the Land Cruiser (and its side curtain airbags) with my family.","1"
" We purchased it in the summer of 2005 and have taken it on cross country trip, over endless NYC potholes and off road. It is smooth, refined, has great visibility and extremely comfortable front row seating.  The engine, the shifting and all other mechanical features appear flawless.","1"
"Never had a single problem with it. Nothing.  NB, I looked at Range Rovers (then $25k more) and the LX 470 (then $9k more). Looking now, used car value of the Range Rover is the same as the Land Cruiser and the LX 470 is only $2k more - so the extra cash would have virtually evaporated over time.","1"
"memory seats; more intuitive climate and audio controls. The GPS software seems to be lost more frequently than I'd like - but I haven't updated the software.","1"
" We bought our LC in the winter of 2005 and had Toyota not made the new ones look like overgrown Highlanders we would have bought a new one.  This is the single best vehicle I have ever owned.  I have driven it as a commuter, on long road trips, and even camped in it and it has exceeded expectations in every scenario.  I also love the interior appointments, and the stateliness of the exterior styling, and think of it as everything the Range Rover should be without the constant trips to the shop. With more than 5 years of ownership the only times it has been in the shop have been to repair body damaged caused by my wife's impatience, and routine maintenance.","1"
"Soft leather interior, back-up camera, removable third row, and ample storage.","3"
" I have owned 8 other SUV's.  Fords,","5"
"Chevys, Nissans, and Toyotas.  This is","5"
"the finest SUV, by far that I have ever","5"
"owned.  NIce styling, great ride and","5"
"comfort, with superb dependability!","5"
" Traded In 2004 BMW X5 for first Toyota Landcruiser and could not be happier.  The Landcruiser is much bigger and roomier.  Interior room is spacious and comfortable and build quality is excellent.  Fuel economy is fair, but this is expected with a vehicle of this size and weight.  The Landcruiser rides and handles exceptionally well for a large SUV.  The ride is smooth and comfortable and even more enjoyable on long trips.  The cabin is full of driver amenities and the vehicle is built with quality and Toyota reliability.  The 275 HP engine is smooth and responsive.  Love the Bluetooth capability.  Satellite radio is an option that should come standard for the price of this SUV. The best SUV.","1"
"Bluetooth, DVD, AWD and passenger room.","5"
"Satellite radio should be standard not an option.","4"
" Initally had a 2000 LC, went to several other cars and SUV's including Escalade, MDX, RL, etc.  This new 2006 Cruiser is simply fantastic, and I am sure I will never sell it.  I have driven and owned nearly everything else, and as a whole package nothing comes close.  Secure, quiet, comfortable, safe, and you know when you get in you WILL make it to your destination.","1"
"Air suspension, ride height control, navigation/DVD, side passenger airbags, and superior ride, fit, finish. VVTi additional HP.","3"
" I can bring it anywhere i need to go","4"
"with anyone i need to bring with me all","5"
"with the comfort and luxury in mind.","5"
"The extra gas money is worth it if you","3"
"really use the car for its intended","5"
" this is my 5th landcruiser and my next","5"
"car will be a landcruiser.","5"
" Picked up the car from the dealership when purchased and the car was making a ear piercing noise coming from the wheels.","3"
"Ended up being the brake shields rubbing the brake rotors.","4"
" The car is not that good looking to begin with, but it comes in any color you want as long as its white, black, 50 shades of grey, or Christmas tree ornament blue or red, very boring.  You get what you pay for, but surprisingly  for the price the fit and finish are very good.. The interior does seem to contain a lot of shiny cheap plastic.  They also put a lot of emphasis on back seat legroom, but they didn't leave any upfront and that makes the car uncomfortable on a long trip.  I have already stopped to stretch my legs so as not to get a DVT.","1"
"My major complaint is the CV transmission.  I'm sure this may be an adequate transmission is a state that is flat, or in a snowmobile; but where I live It is very hilly and there is the problem.   First it is noisy under acceleration and that acceleration is very poor.  It is slower that the 4 speed automatic it replaced and a snail when compared to a manual shift. The engine races when accelerating, and  it seems you are always waiting for the transmission to catch up.  The RPM are all over the place, and passing can take a long time and be dangerous.  Toyota put phony shift points in a transmission that doesn't shift; this is very irritating and it is one more thing to go wrong.  I wonder what Toyota was thinking?  Has anyone asked why the 2018 Camry started with a clean sheet of paper and they didn't put a CVT in that car?  My theory is that this transmission is light duty only.","1"
"Instead of gears there is a belt between two drums, and unlike a gear that meshes, the belts probably need a high coefficient of friction to function and friction  spells wear.  I was going to purchase this car until a friend, who is a transmission technician , suggested I lease it because in about 60k-70k miles there is a good chance of transmission failure. Visits to various websites appears to bear that out.  If the factory has all this confidence with this gum band transmission why don't they offer a longer FACTORY warranty to give the buyer peace of mind? If there are a lot of problems model wide, resale will suffer.  Before you buy one insist on an overnight test drive to see if you can live with it.  Why can't Toyota give us options like a 6 speed auto, 5 speed manual, or a dual clutch auto?","1"
"There really is no alternative except Kia, Hyundai, or Mazda since the Honda civic, Nissan Sentra, and Nissan Altima also have CVTs.  I realize that auto companies are being forced into this with CAFE averages, but I'm not happy with this transmission and a potential of a $4500+ replacement charge, when it is out of warranty, so they can meet the CAFE and be able to sell a Tundra. This is just my opinion, but if you are buying for the long term maybe you should research CVTs on some websites","1"
"Other complaints are lack of road feel, visibility is poor, and one has no idea where the front bumper is (maybe they need an upfront camera too), too much pedal travel in the brake, and difficulty getting in and out","1"
" After doing my research on the 2017 Corolla I bought the XSE with Nav. So far I like the car for what it is drives nice ok power fairly comfortable. So after a week of ownership I needed foglights being told by sale staff that the did have them guess what it dose not. So long story short i'm stuck Toyota needs to pull there heads out and equip these cars correctly no fog lights how much could they cost really.Other than that i'm pretty happy with the car.But I won't but abother Toyota product bad customer service both corp and dealers.","1"
" I have only had this car a little over a day.  I drive 45-60 minutes one way to work everyday.  So a total of 1 1/2 hours to 2 hours a day in my car.  If you do any kind of long distance driving, beware, the seats are extremely uncomfortable.  There is zero support.   Also, hard to get in and out of unless you are young in age and or in great shape.   I wish I would have paid more attention before I leased it.","1"
" Really happy with my new Corolla. I replaced my 10 year-old Matrix with this fully-loaded version. So far I'm more than happy. If it serves me as well as did my Matrix, I couldn't recommend it too highly.","1"
" I have been a Toyota fan since I bought my first one in the 1960's, I haven't owned any other brand and I was never disappointed until 2016. I was extremely happy with my 2004 and never would have given it up(it only had 48,000 mi.) if it wasn't totaled by another driver. At low speeds(30mph) the car hesitates as if I am continually touching the brake. At highway speed (60mph) the car does not hold the road and drifts, so I am constantly steering to hold the car steady. At my six month checkup they told me the car was performing normally and this was backed up by a case manager at Toyota headquarters. I have the temperature set at 66 degrees, but the air always seems too hot or too cold. I am short and I find the visibility poor. I am also over 65 so I am not a fan of having to program everything,but that's my problem, not the car's. Well, that's enough complaining for now. I have gotten used to the car so it's not as bad as when I first got it. One good thing is that the hesitation has stopped, but it took a year.","1"
" First, there is a lot of things right with this car.  Fit and Finish are great, and there are no squeaks or rattles, and the price (with discounts) make it a better deal than a Honda.  If everything else after that was just average I would be satisfied, BUT.  The transmission is horrible.  The CVT works great in snowmobile, but does it belong in a car?  The engine is always revving to a high rpm range when you accelerate, and you wait for the transmission to catch up.  It is dangerous when you try to pass or merge from an on ramp.  This creates a lot of noise in the cabin.  I know now why the salesman went with me on the test drive, picked the route (city streets), and never stopped talking.  It was so I wouldn't notice how bad the noise or tranny was.  I took the car on a 100 mile trip to my parents house and my back hurt and I'm young, skinny, and a runner.  when you take a test drive leave the salesman at the dealer.  If they insist on going along, walk away.  Drive onto a highway, try merging with traffic, try to pass, and you won't buy it. The car is so slow and hesitant that it is almost dangerous.  I am going to trade this car on a Honda or Nissan next year, take the bath, and never look back .   What we need is a law that you can return the car in 48 hours and I bet that a lot of people will.","1"
" My family has enjoyed the use of a 1998 Corolla that was purchased new. For the past eighteen years and more than 235,00 miles, problem free driving was ours with only routine scheduled maintenance. Two weeks ago we decided to purchase a new Corolla. We test drove the 2017 Corolla. The lack of comfort and the level of road noise in "that cabin", as compared to what we had become accustomed to in our 1998 model was no small matter. The noise especially, was so annoying that we decided to purchase a Camry after giving one a test drive that very same day. I had learned from the sales manager that a lot of owners of our generation Corolla had decided to upgrade to a new Camry instead of repeating their purchase of a new Corolla after test driving the new Corolla. The manager also mentioned that Toyota made certain design changes between the model years that probably contributed to the issues we had with the new Corolla.","1"
" I read all the reviews before purchase and I am really happy with this car. It is a great value. The safety features that come standard are awesome. I like the radar-responsive cruise control for highway commuting, as well as the lane alert. The design of the car is such that there are very few blind spots. The seat is very comfortable, and it is just comfortable to drive. The turning radius is great and it is very responsive. I live in a city with hills and I love the hill assist feature--no rolling back! It is also great for city parking. The temperature control and sound system are wonderful. The gas mileage is fantastic! And this is a car which holds its value and comes with years of mainteance support, keeping the mainteance costs lows. The only two areas that could be improved are consistent with what the fancy car reviewers say: 1) it could go from 0 to 60 a little faster. That being said, it is consistent with other value cars that I have driven. No better but no worse. 2) The gear shifts in lower gears are a little louder than they could be. There are quieter cars out there. But overall this is car is a great value! I needed a car at a good price, that would hold its value, had great fuel efficiency, high safety standards and low maintenance costs. This car wins in all those categories. And it is fun to drive. The bonus for us is that the trunk is big enough to take the two kids camping, and the 60/40 split means one person can sit in the back seat and we can still haul longer items. Very pleased!","1"
" Pros: Superb headlights with every even and bright illumination; tight fit and finish, very solid construction; low operating cost.  Cons: If you want to know what it feels like driving a coffin this is it! Very dark claustrophobic interior, poor outward visibility; noisy at speed; poor straight line stability; persistent and irritating understeer. Boring exterior design.  Some very hard and sharp plastic in the wrong spots that really will hurt you.","1"
" We have it for about one month. So far we like it. As a family car it is great. The thing I like most is, the Adaptive cruise control and line departure alert. Also LED lights great when driving in dark","1"
