comments,
"Hello, thank you for reaching out to us at American Honda. We appreciate your interest in the Honda brand. Any new release information can be found on automobiles.honda.com or hondanew.com   Feel free to contact us with any questions. Thank you. ^CV","Honda ·   Hello, thank you for reaching out to us at American Honda. We appreciate your interest in the Honda brand. Any new release information can be found on automobiles.honda.com or hondanew.com   Feel free to contact us with any questions. Thank you. ^CVHonda Cars - New and Certified Pre-Owned Vehicles from American HondaHonda Cars - Home of information on the latest Honda cars and SUV models, Certified Pre-Owned Vehicles. Photos, videos, technical specs and dealer locations for all car models from American Honda.automobiles.honda.com2 · 3 November 2016 at 06:29Remove"
Any news on the sport touring hatchback release date?,Levi Blank · 0:00  Any news on the sport touring hatchback release date?1 · 1 November 2016 at 10:08Remove
"Hello, thank you for reaching out to us at American Honda. We appreciate your interest in the Honda brand. Any new release information can be found on automobiles.honda.com or hondanew.com    Feel free to contact us with any questions. Thank you. ^CV","Honda ·   Hello, thank you for reaching out to us at American Honda. We appreciate your interest in the Honda brand. Any new release information can be found on automobiles.honda.com or hondanew.com    Feel free to contact us with any questions. Thank you. ^CVHonda Cars - New and Certified Pre-Owned Vehicles from American HondaHonda Cars - Home of information on the latest Honda cars and SUV models, Certified Pre-Owned Vehicles. Photos, videos, technical specs and dealer locations for all car models from American Honda.automobiles.honda.com2 · 2 November 2016 at 14:05Remove"
Went to the Ridgeline training in Texas I hope they do the same for the Type R,Ron Restuccio · 1:37  Went to the Ridgeline training in Texas I hope they do the same for the Type R3 · 1 November 2016 at 09:13Remove
"Shout out from christchurch l, New Zealand...go the type R! Lol","Taina Kahutia Tawhitopou Connell · 2:10  Shout out from christchurch l, New Zealand...go the type R! Lol1 · 1 November 2016 at 09:14Remove"
"Honda needs to bring back the Element. I've been looking at the CR-V which are nice but I'm just not fond of the rear end style. I love the new Pilot but they're expensive, and out of my price range. I'm torn because I've been a Honda owner but some ...See more","Veronica Jefferson  Honda needs to bring back the Element. I've been looking at the CR-V which are nice but I'm just not fond of the rear end style. I love the new Pilot but they're expensive, and out of my price range. I'm torn because I've been a Honda owner but some ...See more9 · 14 July 2016 at 21:35Remove"
"Hello, thank you for contacting us. We appreciate your feedback. It is very important to us and it will be properly documented. ^DR","Honda  Hello, thank you for contacting us. We appreciate your feedback. It is very important to us and it will be properly documented. ^DR4 · 15 July 2016 at 09:00Remove"
"I had given my car for sevice an warranty repair at Rajkot, Gujarat, India service centre on last saturday dated 13 Aug, 2016. It is still not given back to me. Car no. GJ 03 ER 0073. Hope for good response thanks.","Parth Sejpal  I had given my car for sevice an warranty repair at Rajkot, Gujarat, India service centre on last saturday dated 13 Aug, 2016. It is still not given back to me. Car no. GJ 03 ER 0073. Hope for good response thanks.4 · 21 August 2016 at 09:15Remove"
Thank you for contacting us. We are with American Honda Motor Co. and deal mainly with Honda vehicles made for sale and use within the United States. Please try contacting  http://honda.us/bAY  We hope this helps. ^CV,Honda  Thank you for contacting us. We are with American Honda Motor Co. and deal mainly with Honda vehicles made for sale and use within the United States. Please try contacting  http://honda.us/bAY  We hope this helps. ^CV22 August 2016 at 06:52Remove
"I'm wanting to buy a minivan. Would be nice if I could buy a Honda with a military discount. I'm a veteran, so it would be nice if veterans were included in on the deals.","Joanna Sees  I'm wanting to buy a minivan. Would be nice if I could buy a Honda with a military discount. I'm a veteran, so it would be nice if veterans were included in on the deals.8 · 7 July 2016 at 06:26Remove"
"Joanna, thank you for your service. We would recommend looking into our Military Appreciation Offer. You can find out more about it here: http://honda.us/u4d","Honda  Joanna, thank you for your service. We would recommend looking into our Military Appreciation Offer. You can find out more about it here: http://honda.us/u4dHonda Cars Offers & Leases Detail - Official WebsiteGet full details on the latest special offers for Honda vehicles in your area.automobiles.honda.com4 · 7 July 2016 at 15:11Remove"
"Honda is really playing us, and disregard our safety, their system is a mess, not professional at all!!! I received the airbag replacement letter about my honda accord few months back, then about 3 months ago, i make an appointment and bring my car to ...See more","Song Yun  Honda is really playing us, and disregard our safety, their system is a mess, not professional at all!!! I received the airbag replacement letter about my honda accord few months back, then about 3 months ago, i make an appointment and bring my car to ...See more1 · 28 September 2016 at 21:46Remove"
Respected. Sir I'm request u to help me. I purchased new Honda hornet160r before 4 month from prabh honda akola but from first day of buy many problem in bike. I complete to dealer @ many problem in that bike. But dealer says wait upto first servicing...See more,Uzair Karim  Respected. Sir I'm request u to help me. I purchased new Honda hornet160r before 4 month from prabh honda akola but from first day of buy many problem in bike. I complete to dealer @ many problem in that bike. But dealer says wait upto first servicing...See more3 · 29 September 2016 at 11:39Remove
Thank you for contacting us.  We are with American Honda Motor Co. and deal mainly with Honda vehicles made for sale and use within the United States. Please check out  http://honda.us/dBr. ^SP,Honda  Thank you for contacting us.  We are with American Honda Motor Co. and deal mainly with Honda vehicles made for sale and use within the United States. Please check out  http://honda.us/dBr. ^SPHonda Car India | Honda Amaze | Honda City | All New JazzLeading premium car manufacturer in India…hondacarindia.com29 September 2016 at 12:22Remove
Why was Honda US and most likely Honda Corp Japan was also sued too by Malaysian with Us citizenship?Looking at how incompetent handling of Honda Malaysia handle issue and inability to even write an official letter to customer....See more,Tang Weng Kit  Why was Honda US and most likely Honda Corp Japan was also sued too by Malaysian with Us citizenship?Looking at how incompetent handling of Honda Malaysia handle issue and inability to even write an official letter to customer....See more4 July 2016 at 14:57Remove
"1. Owner’s manual, pg 48, references power folding mirrors *if so equipped.  I do not see these as an option anywhere………..2. Locking tailgate – in the spec sheet (link below), it mentions “power door and tailgate locks”...See more","Jeff Bebout  1. Owner’s manual, pg 48, references power folding mirrors *if so equipped.  I do not see these as an option anywhere………..2. Locking tailgate – in the spec sheet (link below), it mentions “power door and tailgate locks”...See more8 · 6 July 2016 at 11:13 · EditedRemove"
"Good afternoon, thank you for reaching out to us. The tailgate in the 2017 Honda Ridgeline is not designed to lock it self. However, the trunk/cooler (in-bed trunk) does lock. ^ND","Honda  Good afternoon, thank you for reaching out to us. The tailgate in the 2017 Honda Ridgeline is not designed to lock it self. However, the trunk/cooler (in-bed trunk) does lock. ^ND4 · 6 July 2016 at 14:48Remove"
"My Ridgeline is just over a month old. Took it to the 4X4 Outer Banks NC where you can only drive on the beach, no roads. Family vacation. This truck is everything you say it is. Had a ball 4 wheeling in the sand. Photo of all 12 of us in the truck, even the 1 year old in a car seat. Great vehicle!","Bryce Lane  My Ridgeline is just over a month old. Took it to the 4X4 Outer Banks NC where you can only drive on the beach, no roads. Family vacation. This truck is everything you say it is. Had a ball 4 wheeling in the sand. Photo of all 12 of us in the truck, even the 1 year old in a car seat. Great vehicle!12 · 27 August 2016 at 06:37 · EditedRemove"
"Dear Honda. As a Malaysian, I would love to apologize that you have to deal with these failure of Malaysians. Apparently Nasi Lemak's sambal isnt salty enough for certain Malaysians.","Hitoru Kiyo  Dear Honda. As a Malaysian, I would love to apologize that you have to deal with these failure of Malaysians. Apparently Nasi Lemak's sambal isnt salty enough for certain Malaysians.16 · 27 June 2016 at 01:10Remove"
Thank you for contacting us. We are with American Honda Motor Co. and deal mainly with Honda vehicles made for sale and use within the United States. Please try contacting http://honda.us/a9S thank you for contacting us.  We hope this helps. ^CV,Honda  Thank you for contacting us. We are with American Honda Motor Co. and deal mainly with Honda vehicles made for sale and use within the United States. Please try contacting http://honda.us/a9S thank you for contacting us.  We hope this helps. ^CV4 · 27 June 2016 at 07:58Remove
Why was Honda US and most likely Honda Corp Japan was also sued too by Malaysian with Us citizenship?Looking at how incompetent handling of Honda Malaysia handle issue and inability to even write an official letter to customer....See more,Tang Weng Kit  Why was Honda US and most likely Honda Corp Japan was also sued too by Malaysian with Us citizenship?Looking at how incompetent handling of Honda Malaysia handle issue and inability to even write an official letter to customer....See more6 · 4 July 2016 at 14:57Remove
Thank you for contacting us.  We are with American Honda Motor Co. and deal mainly with Honda vehicles made for sale and use within the United States. Please check out  http://honda.us/w3v. ^SP,Honda  Thank you for contacting us.  We are with American Honda Motor Co. and deal mainly with Honda vehicles made for sale and use within the United States. Please check out  http://honda.us/w3v. ^SPRequest Rejectedhonda.com.my1 · 5 July 2016 at 07:41Remove
"Its a shame that people are expressing their hateful views here and elsewhere when innocent people have died. Hate the sin, not the sinner if you must.With that being said, the LGBT community certainly appreciates your support❤️💛💚💙💜","Alicia Artz  Its a shame that people are expressing their hateful views here and elsewhere when innocent people have died. Hate the sin, not the sinner if you must.With that being said, the LGBT community certainly appreciates your support❤️💛💚💙💜24 · 13 June 2016 at 12:45Remove"
"Uma pena Honda que os funcionários que te representam no facebook querem que as leis islâmicas que torturam e matam homossexuais em países de maioria muçulmana sejam implementadas aqui no Brasil para matar e torturar os homossexuais brasileiros, o que desanima muito de consumir um produto que passa pela mão de pessoas que desejam a morte de muitos brasileiros e deseja que milhares de famílias sejam destruídas.","Nando Lacerda  Uma pena Honda que os funcionários que te representam no facebook querem que as leis islâmicas que torturam e matam homossexuais em países de maioria muçulmana sejam implementadas aqui no Brasil para matar e torturar os homossexuais brasileiros, o que desanima muito de consumir um produto que passa pela mão de pessoas que desejam a morte de muitos brasileiros e deseja que milhares de famílias sejam destruídas.12 · 17 June 2016 at 13:01Remove"
"This is to file a complaint against Agency Honda Ciudad Juarez, Chihuahua.Because in cahoots with insurer GNP. even today 27 June 2016. I have repaired my car Honda City 2014, for an event hailstone on 06 October 2015. RAZON was presented by which I e...See more","Socky Morales  This is to file a complaint against Agency Honda Ciudad Juarez, Chihuahua.Because in cahoots with insurer GNP. even today 27 June 2016. I have repaired my car Honda City 2014, for an event hailstone on 06 October 2015. RAZON was presented by which I e...See more27 June 2016 at 14:33Remove"
"Thank you for contacting us.  We are with American Honda Motor Co., and deal mainly with Honda vehicles made for sale and used within the United States. Please check out http://honda.us/a9X to find the contact of the Honda corporate office in your country.  We hope this information helps. ^RR","Honda  Thank you for contacting us.  We are with American Honda Motor Co., and deal mainly with Honda vehicles made for sale and used within the United States. Please check out http://honda.us/a9X to find the contact of the Honda corporate office in your country.  We hope this information helps. ^RRHonda World LinksHonda World Links - Visit Honda’s and Affliated Sites Worldwideworld.honda.com3 · 27 June 2016 at 14:34Remove"
hello. I have honda crv 2007. I do small a traffic accident. But Turkey distributor he moved not replacement part buy. They are says this is situation 10-15 days. I very very angry :((,Fatih Güneş  hello. I have honda crv 2007. I do small a traffic accident. But Turkey distributor he moved not replacement part buy. They are says this is situation 10-15 days. I very very angry :((3 · 8 June 2016 at 04:26Remove
"Thank you for contacting us.  We are with American Honda Motor Co., and deal mainly with Honda vehicles made for sale and used within the United States. Please check out http://honda.us/x3a to find the contact of the Honda corporate office in your country.  We hope this information helps. ^RR","Honda  Thank you for contacting us.  We are with American Honda Motor Co., and deal mainly with Honda vehicles made for sale and used within the United States. Please check out http://honda.us/x3a to find the contact of the Honda corporate office in your country.  We hope this information helps. ^RRHonda World LinksHonda World Links - Visit Honda’s and Affliated Sites Worldwideworld.honda.com8 June 2016 at 08:38Remove"
"Ok, but why is it not possible to choose fabric seats? I'm vegan and leather is a no-no. Me and my fiancé were in love with the Honda Pilot Touring and just came back from the local dealer in Doha (Domasco), but it's absurd that we cannot choose someth...See more","Kenia Melo  Ok, but why is it not possible to choose fabric seats? I'm vegan and leather is a no-no. Me and my fiancé were in love with the Honda Pilot Touring and just came back from the local dealer in Doha (Domasco), but it's absurd that we cannot choose someth...See more4 · 14 May 2016 at 09:06Remove"
"Hello, we certainly appreciate your feedback and we will certainly document your comments on file for all area's of our company to have access to. Thank you ^CV","Honda  Hello, we certainly appreciate your feedback and we will certainly document your comments on file for all area's of our company to have access to. Thank you ^CV3 · 16 May 2016 at 09:36Remove"
"Hi... Can anyone help me on my concern. Last April, I have been wanting to get HRV and Gerogina Mateo of Honda Taytay assisted me on my concern. She immediately asked for Php5k for reservation and telling me that it will be processed soon. 2 weeks had ...See more","Ren Gaanan Santos  Hi... Can anyone help me on my concern. Last April, I have been wanting to get HRV and Gerogina Mateo of Honda Taytay assisted me on my concern. She immediately asked for Php5k for reservation and telling me that it will be processed soon. 2 weeks had ...See more1 · 1 June 2016 at 23:31Remove"
"Mr. Santos, thank you for reaching out to us. We are sorry to learn of this issue with your local Honda dealership. Have you spoken with the General Manager at that particular dealership? Please private message us to further discuss this matter. ^ND","Honda  Mr. Santos, thank you for reaching out to us. We are sorry to learn of this issue with your local Honda dealership. Have you spoken with the General Manager at that particular dealership? Please private message us to further discuss this matter. ^ND3 · 2 June 2016 at 08:42Remove"
I remember competing at this tournament 3 of the 4 years I was in college!!! This was one of my favorite college memories!!!,Ashley Haynes  I remember competing at this tournament 3 of the 4 years I was in college!!! This was one of my favorite college memories!!!14 · 15 April 2016 at 12:04Remove
Why not just use our student genius and build an African American owned auto business again. Like Frederick Patterson of the early 1900's.,Shihan Redd  Why not just use our student genius and build an African American owned auto business again. Like Frederick Patterson of the early 1900's.9 · 16 April 2016 at 07:39Remove
Hondas are great cars....as long as you do not mind your air bag exploding and sending shrapnel into you and your loved ones faces! My wife and I have been on the phone with multiple dealerships as well as the Honda corporate offices over the past few ...See more,David Dubravetz  Hondas are great cars....as long as you do not mind your air bag exploding and sending shrapnel into you and your loved ones faces! My wife and I have been on the phone with multiple dealerships as well as the Honda corporate offices over the past few ...See more2 · 27 July 2016 at 09:06Remove
"Good morning Mr. Dubravetz, thank you for reaching out to us. We're sorry to learn of your dissatisfaction and the customer service you've experienced. We'd like the opportunity to review your case & forward your concerns to our Recalls/Campaigns department. Please provide us w/ your full name, address, phone #, VIN, & name of Honda dealership. Thank you. ^ND","Honda  Good morning Mr. Dubravetz, thank you for reaching out to us. We're sorry to learn of your dissatisfaction and the customer service you've experienced. We'd like the opportunity to review your case & forward your concerns to our Recalls/Campaigns department. Please provide us w/ your full name, address, phone #, VIN, & name of Honda dealership. Thank you. ^ND27 July 2016 at 09:20Remove"
Fix those dam air bags,Joe Whitfieldsr  Fix those dam air bags11 · 8 April 2016 at 11:51Remove
"Hello, thank you for contacting us. We recommend contacting http://honda.us/e6F for further assistance. ^DR","Honda  Hello, thank you for contacting us. We recommend contacting http://honda.us/e6F for further assistance. ^DR4 · 11 April 2016 at 16:17Remove"
"We sincerely apologize for the inconvenience and understand your frustration. Due to the high call volume from customers in response to this error, AHFC has been unable to speak with each customer in a timely manner. Updates are being provided via social media and hondafinancialservices.com in an effort to reassure customers. ^GR","Honda  We sincerely apologize for the inconvenience and understand your frustration. Due to the high call volume from customers in response to this error, AHFC has been unable to speak with each customer in a timely manner. Updates are being provided via social media and hondafinancialservices.com in an effort to reassure customers. ^GRHonda Financial Services Browser DetectYour information may be at risk while browsing the Internet, especially if using an unsecured network. For increased security and better web performance, we strongly recommend you do not access hondafinancialservices.com using your current browser. Please download the most recent version of this bro…hondafinancialservices.com2 · 7 April 2016 at 13:55Remove"
It's unacceptable to be informed through social media. We should have been contacted directly. No mention of rectifying any bank charges that were incurred because of their mistake. Don't think I will ever use Honda financial services in the future.,Christina Ducharme  It's unacceptable to be informed through social media. We should have been contacted directly. No mention of rectifying any bank charges that were incurred because of their mistake. Don't think I will ever use Honda financial services in the future.36 · 6 April 2016 at 17:24Remove
"We apologize for any inconvenience that AHFC payment processing errors caused. Working urgently to make it right. Customers should start to receive refunds beginning Thursday, April 7, 2016. Any fees caused by this error will be waived or reimbursed, and we will assist customers with credit concerns.","Honda  We apologize for any inconvenience that AHFC payment processing errors caused. Working urgently to make it right. Customers should start to receive refunds beginning Thursday, April 7, 2016. Any fees caused by this error will be waived or reimbursed, and we will assist customers with credit concerns.3 · 6 April 2016 at 20:21Remove"
Does make it right mean you're putting my money back and paying my $30.00 overdraft fee????,Laura Woods Stinney  Does make it right mean you're putting my money back and paying my $30.00 overdraft fee????2 · 6 April 2016 at 17:09Remove
"Hello, Honda Financial Services is working to resolve the payment processing issue some customers are experiencing. Updates will be provided. Any fees caused by this error will be waived or reimbursed, and we will assist customers with credit concerns.  We apologize for this experience and appreciate your patience. ^RR","Honda  Hello, Honda Financial Services is working to resolve the payment processing issue some customers are experiencing. Updates will be provided. Any fees caused by this error will be waived or reimbursed, and we will assist customers with credit concerns.  We apologize for this experience and appreciate your patience. ^RR7 April 2016 at 10:20Remove"
"How are you going to make it right for those who had mortgage checks bounce, accounts overdrawn, or for parents who have to tell their children equipment for soccer can't be bought this week because of your screw up? Help us to understand what your really doing rather than giving some veiled answer that is nearly meaningless.","Valorie Dubovsky-Boukal  How are you going to make it right for those who had mortgage checks bounce, accounts overdrawn, or for parents who have to tell their children equipment for soccer can't be bought this week because of your screw up? Help us to understand what your really doing rather than giving some veiled answer that is nearly meaningless.5 · 6 April 2016 at 16:44 · EditedRemove"
"Hello, thank you for reaching out.  Honda Financial Services is working to resolve the payment processing issue some customers are experiencing. Updates will be provided.  We sincerely apologize for the inconvenience this may have caused.  Thank you for your patience. ^RR","Honda  Hello, thank you for reaching out.  Honda Financial Services is working to resolve the payment processing issue some customers are experiencing. Updates will be provided.  We sincerely apologize for the inconvenience this may have caused.  Thank you for your patience. ^RR7 April 2016 at 09:05Remove"
Hello and thank you for reaching out. We apologize for the inconvenience this may have caused you. Has this concern been addressed at your local Honda dealership's service center? ^GR,Honda · 0:00  Hello and thank you for reaching out. We apologize for the inconvenience this may have caused you. Has this concern been addressed at your local Honda dealership's service center? ^GR10 · 31 March 2016 at 11:23Remove
I had a honda they told me to not wear seatbelt to put it behind me when in car thats allsume but i think its illegal in my state go honda but go out of Michigan,David Phillips · 0:00  I had a honda they told me to not wear seatbelt to put it behind me when in car thats allsume but i think its illegal in my state go honda but go out of Michigan31 March 2016 at 06:47Remove
Thank you for contacting us.  Please PM us more information regarding your concern and who you spoke with.  We would like to look further into this.  Thank you. ^RR,Honda ·   Thank you for contacting us.  Please PM us more information regarding your concern and who you spoke with.  We would like to look further into this.  Thank you. ^RR31 March 2016 at 13:58Remove
"So they showed us the hatchback prototype that was first shown a couple weeks ago, a global rally cross car that no one cares about, and now a civic tour car that no one cares about. How about an actual new car??","Robert May · 20:33  So they showed us the hatchback prototype that was first shown a couple weeks ago, a global rally cross car that no one cares about, and now a civic tour car that no one cares about. How about an actual new car??7 · 22 March 2016 at 11:40Remove"
That civic type r motor will be nice on that hatch,Mike Hidalgo · 5:00  That civic type r motor will be nice on that hatch6 · 22 March 2016 at 11:25Remove
"Please,i need code for my Honda Pilot Navigation System with serial no: B20944339B. Thanks for your assistance.","Innocent Nwagbo · 0:00  Please,i need code for my Honda Pilot Navigation System with serial no: B20944339B. Thanks for your assistance.3 April 2016 at 14:17Remove"
