comments,
"Dear Honda? Where is my car? HONDA HRV medium spec? my bank loan already been approved.I've already waited for two month, before raya celeberation, no, before my birthday, no.. if no response from you,  I will not even wanted to buy honda car again.","Alif Firdaus  Dear Honda? Where is my car? HONDA HRV medium spec? my bank loan already been approved.I've already waited for two month, before raya celeberation, no, before my birthday, no.. if no response from you,  I will not even wanted to buy honda car again.Yesterday at 02:22Remove"
Thank you for contacting us. We are with American Honda Motor Co. and deal mainly with Honda vehicles made for sale and use within the United States. Please try contacting http://www.honda.com.my/ or https://www.facebook.com/hondamalaysia/. We hope this helps. ^CB,"Honda  Thank you for contacting us. We are with American Honda Motor Co. and deal mainly with Honda vehicles made for sale and use within the United States. Please try contacting http://www.honda.com.my/ or https://www.facebook.com/hondamalaysia/. We hope this helps. ^CBThe Official Home of Honda MalaysiaWelcome to Honda Malaysia. Browse the latest Honda Models, Book Test Drives, Compare Vehicles & More. Logon To Honda Malaysia Today.honda.com.my13 hrsRemove"
"I bought a 2017 Honda Civic EX this April. I really like it. But just a few days ago, it malfunctioned in the middle of a  hi-way drive.  The engine died, check engine flashed, and the dash monitor showed a lot of crap saying everything has error.","Christian Pangan  I bought a 2017 Honda Civic EX this April. I really like it. But just a few days ago, it malfunctioned in the middle of a  hi-way drive.  The engine died, check engine flashed, and the dash monitor showed a lot of crap saying everything has error.1 · 28 July at 09:22Remove"
"Hello,Christian, we are sorry to hear that your vehicle is having issues. We would like to review your concern further. Please private message your name, address, phone #, VIN, mileage, the dealership name, and a copy of the repair order. Thank you. ^CB","Honda  Hello,Christian, we are sorry to hear that your vehicle is having issues. We would like to review your concern further. Please private message your name, address, phone #, VIN, mileage, the dealership name, and a copy of the repair order. Thank you. ^CB28 July at 12:29Remove"
"Dear mam / sir,I have tried my best to make them understand my concerned issuesTo vidhata honda Ludhiana but they understand the issue and commitment made by them ...See more","Manpreet Gujral  Dear mam / sir,I have tried my best to make them understand my concerned issuesTo vidhata honda Ludhiana but they understand the issue and commitment made by them ...See more6 July at 00:04Remove"
"Thank you for reaching out, Manpreet. We deal primarily with vehicles within the United States. To find the correct avenue of assistance please visit the following link http://world.honda.com/group/ ^DG","Honda  Thank you for reaching out, Manpreet. We deal primarily with vehicles within the United States. To find the correct avenue of assistance please visit the following link http://world.honda.com/group/ ^DGHonda World LinksHonda World Links - Visit Honda’s and Affliated Sites Worldwideworld.honda.com6 July at 07:26Remove"
Will be some software update to have apple car play in my hr-v?,Omar CA  Will be some software update to have apple car play in my hr-v?20 July at 21:20Remove
"Hello Omar, thank you for reaching out to us with your inquiry. Apple CarPlay is a feature that must be available from the factory. At this time, there are no plans to release a software update to bring this feature to non-compatible vehicles. Thank you. ^CB","Honda  Hello Omar, thank you for reaching out to us with your inquiry. Apple CarPlay is a feature that must be available from the factory. At this time, there are no plans to release a software update to bring this feature to non-compatible vehicles. Thank you. ^CB21 July at 08:23Remove"
Mental harassment we have to go through just 13 days after buying honda jazz. Pathetic reply from customer care. I have to open up my engine now and get parts replaced. I NEED MY CAR REPLACED.,વિવેક કડેચા · 0:00  Mental harassment we have to go through just 13 days after buying honda jazz. Pathetic reply from customer care. I have to open up my engine now and get parts replaced. I NEED MY CAR REPLACED.4 · 26 April at 11:48Remove
"We apologize for the new car purchase experience. We are with American Honda Motor Co., Inc. and deal mainly with Honda vehicles made for sale and use within the United States. Please try contacting https://www.hondacarindia.com/ or https://www.facebook.com/HondaCarIndia. We hope this helps. ^AD","Honda ·   We apologize for the new car purchase experience. We are with American Honda Motor Co., Inc. and deal mainly with Honda vehicles made for sale and use within the United States. Please try contacting https://www.hondacarindia.com/ or https://www.facebook.com/HondaCarIndia. We hope this helps. ^ADHonda Cars India: Hatchback, Sedan, MPV & SUV ManufacturerHonda Cars India Ltd (HCIL) is a subsidiary of Honda, a leading premium car manufacturer and exporter in India. Honda offers Sedan, Hatchback, MPV, SUV, and luxury car models.m.hondacarindia.com26 April at 12:22Remove"
"Don't go for Honda Cars, I bought Jazz before 10 days in India and it has an engine fault. Service centre said we have to replace Engine piston set, connecting rod set & Bearing set in 10 day old car. I asked for replacement of car, they denied. Pathet...See more","વિવેક કડેચા · 1:16  Don't go for Honda Cars, I bought Jazz before 10 days in India and it has an engine fault. Service centre said we have to replace Engine piston set, connecting rod set & Bearing set in 10 day old car. I asked for replacement of car, they denied. Pathet...See more2 · 20 April at 02:10Remove"
"Thank you for contacting us. We are with American Honda Motor Co., Inc. and deal mainly with Honda vehicles made for sale and use within the United States. Please try contacting https://www.hondacarindia.com/ or https://www.facebook.com/HondaCarIndia. We hope this helps. ^AD","Honda ·   Thank you for contacting us. We are with American Honda Motor Co., Inc. and deal mainly with Honda vehicles made for sale and use within the United States. Please try contacting https://www.hondacarindia.com/ or https://www.facebook.com/HondaCarIndia. We hope this helps. ^ADHonda Cars India: Hatchback, Sedan, MPV & SUV ManufacturerHonda Cars India Ltd (HCIL) is a subsidiary of Honda, a leading premium car manufacturer and exporter in India. Honda offers Sedan, Hatchback, MPV, SUV, and luxury car models.m.hondacarindia.com20 April at 09:13Remove"
I own a Honda ballade 1984! It moves like a plane!,Dinesh Gyaneshwar · 0:00  I own a Honda ballade 1984! It moves like a plane!3 · 12 April at 09:59Remove
Thank you for being a part of the Honda family. #HondaLove,Honda ·   Thank you for being a part of the Honda family. #HondaLove12 April at 11:13Remove
"Hello. I am from Turkey. I own a New civic sedan. Recently, in our country we have a problem about the our cars. Although we have reported, The authourities did not return to us. Hundreds of People have the same problem. Our problem is that: There is a dent(s) on the rear right and/or left window of our cars. I demand that the subject be resolved. Best regards...","Yaşar Şahinbaş · 7:26  Hello. I am from Turkey. I own a New civic sedan. Recently, in our country we have a problem about the our cars. Although we have reported, The authourities did not return to us. Hundreds of People have the same problem. Our problem is that: There is a dent(s) on the rear right and/or left window of our cars. I demand that the subject be resolved. Best regards...14 July at 10:52Remove"
Thank you for contacting us. We are with American Honda Motor Co. Inc. and deal mainly with Honda vehicles made for sale and use within the United States. Please try contacting  \https://www.facebook.com/HondaTR .  We hope this helps. ^CB,"Honda ·   Thank you for contacting us. We are with American Honda Motor Co. Inc. and deal mainly with Honda vehicles made for sale and use within the United States. Please try contacting  \https://www.facebook.com/HondaTR .  We hope this helps. ^CBHonda TürkiyeCars1,760,666 people like this14 July at 14:21Remove"
"HONDA!!! Look at my profile pic! Isn't that a great representation of one of your paint problems that you will do nothing about?? 4,000,000 plus Honda followers: Look what you are getting into!","Stephen Smith · 30:18  HONDA!!! Look at my profile pic! Isn't that a great representation of one of your paint problems that you will do nothing about?? 4,000,000 plus Honda followers: Look what you are getting into!2 · 12 April at 09:47Remove"
"Hello Stephen, we are sorry to hear that your vehicle is having paint issues. We would like to review your concern further. Please private message your name, address, phone #, VIN, mileage, the dealership name, and a copy of the repair order. Thank you. ^RB","Honda ·   Hello Stephen, we are sorry to hear that your vehicle is having paint issues. We would like to review your concern further. Please private message your name, address, phone #, VIN, mileage, the dealership name, and a copy of the repair order. Thank you. ^RB1 · 12 April at 13:27Remove"
"This is important. Yeah the style isn't the best currently, but it will get better. When you're buying a clarity, its for altruistic reasons","Michael Silvia · 49:13  This is important. Yeah the style isn't the best currently, but it will get better. When you're buying a clarity, its for altruistic reasons12 April at 08:34Remove"
Thank you for contacting us. We are with American Honda Motor Co. and deal mainly with Honda vehicles made for sale and use within the United States. Please try contacting http://www.honda.com.pk/index.html.  We hope this helps. ^RB,Honda  Thank you for contacting us. We are with American Honda Motor Co. and deal mainly with Honda vehicles made for sale and use within the United States. Please try contacting http://www.honda.com.pk/index.html.  We hope this helps. ^RBHonda Pakistan Website - ErrorHonda Atlas Cars (Pakistan) Limited -Visit the official Honda Pakistan web site and find information on all…honda.com.pk4 · 3 March at 10:18Remove
"I have a 2015 Honda Odyssey.  I lost one of the key fobs and now im totally confused if thr fobs have a key inside, a battery, how do you replace it without going to the dealer bevause i dont have the money.  Any info would be appreciated","Patricia Henderson  I have a 2015 Honda Odyssey.  I lost one of the key fobs and now im totally confused if thr fobs have a key inside, a battery, how do you replace it without going to the dealer bevause i dont have the money.  Any info would be appreciated3 · 10 April at 22:33Remove"
Good Morning Patricia and thank you for reaching out to us. Could you please clarify if you need to replace a key or just the battery in the key/remote? ^AD,Honda  Good Morning Patricia and thank you for reaching out to us. Could you please clarify if you need to replace a key or just the battery in the key/remote? ^AD11 April at 07:20Remove
Car goes for servicing next day the fuel pump is spoilt. My 2 year old honda city has run for 3500 km's. Is this a joke. Complaint id is 1-6339957063.From honda 121,Anurodh Sharma  Car goes for servicing next day the fuel pump is spoilt. My 2 year old honda city has run for 3500 km's. Is this a joke. Complaint id is 1-6339957063.From honda 1211 · 9 February at 08:52Remove
Thank you for reaching out to us. Can you please verify what country you are in? Thank you. ^RB,Honda  Thank you for reaching out to us. Can you please verify what country you are in? Thank you. ^RB9 February at 09:17Remove
"Hello Honda team, I am having the worst car experience in my life with the brand new Accord Coupe that I bough few days ago in UAE. I wanted to reach the head office to make a complaint but I could not! Looking forward your feedback and to explain the problem. Thanks.","Amr Daoud  Hello Honda team, I am having the worst car experience in my life with the brand new Accord Coupe that I bough few days ago in UAE. I wanted to reach the head office to make a complaint but I could not! Looking forward your feedback and to explain the problem. Thanks.1 · 17 November 2016 at 22:28Remove"
Thank you for contacting us.  We are with American Honda Motor Co. and deal mainly with Honda vehicles made for sale and use within the United States. Please check out http://honda.us/u7w. ^SP,Honda  Thank you for contacting us.  We are with American Honda Motor Co. and deal mainly with Honda vehicles made for sale and use within the United States. Please check out http://honda.us/u7w. ^SP2 · 18 November 2016 at 07:07Remove
"My 16 y/o daughter called to tell me she had rear ended another car with her 99 Accord. I couldn't get any answers out of her for at least a minute because she kept saying ""I lost the H off the front of my car"". After I finally assured her it could be replaced, she informed me that no one was hurt, where she was, car was drivable, etc.","Patricia Melton  My 16 y/o daughter called to tell me she had rear ended another car with her 99 Accord. I couldn't get any answers out of her for at least a minute because she kept saying ""I lost the H off the front of my car"". After I finally assured her it could be replaced, she informed me that no one was hurt, where she was, car was drivable, etc.2 · 3 February at 07:06Remove"
"Hello, thank you for contacting us.  We are sorry to hear about your daughter's accident but glad to hear she is okay.  We’d like to formally document the incident for internal review in our office.  Please send her name, address, phone #, VIN, mileage, and the name of your Honda dealer in a secure private message. Thank you and we look forward to your reply. ^RR","Honda  Hello, thank you for contacting us.  We are sorry to hear about your daughter's accident but glad to hear she is okay.  We’d like to formally document the incident for internal review in our office.  Please send her name, address, phone #, VIN, mileage, and the name of your Honda dealer in a secure private message. Thank you and we look forward to your reply. ^RR1 · 3 February at 08:24Remove"
"My first Honda was a 1979 Honda Civic. 1200cc engine, 2 speed automatic that you had to shift with a manual choke and 12"" tires.","Gregory L Davis  My first Honda was a 1979 Honda Civic. 1200cc engine, 2 speed automatic that you had to shift with a manual choke and 12"" tires.8 · 2 February at 17:28Remove"
"Hello and thank you for reaching out to us. You are welcome to share your story with us at http://automobiles.honda.com/I-love-my-honda/, our Honda owner's loyalty hub. Thank you. ^RB","Honda  Hello and thank you for reaching out to us. You are welcome to share your story with us at http://automobiles.honda.com/I-love-my-honda/, our Honda owner's loyalty hub. Thank you. ^RB4 · 2 February at 13:26Remove"
"Love my 2016 Honda Pilot.  The only complaint so far is it has 3 rows of seats. Honda decides as a cost cutting measure to omit floor mats for the 3rd row, only comes on touring and touring elite models.  What the crap is next? I bet next year they will start charging for seat belts unless you go high end.","Michael D Baines  Love my 2016 Honda Pilot.  The only complaint so far is it has 3 rows of seats. Honda decides as a cost cutting measure to omit floor mats for the 3rd row, only comes on touring and touring elite models.  What the crap is next? I bet next year they will start charging for seat belts unless you go high end.2 · 2 February at 17:00 · EditedRemove"
"Hello, thank you for reaching out to us at American Honda. We certainly appreciate your feedback and will certainly document your concerns on file for all areas of our company to have access to. Feel free to reach out to us with any questions. Thank you.  ^CV","Honda  Hello, thank you for reaching out to us at American Honda. We certainly appreciate your feedback and will certainly document your concerns on file for all areas of our company to have access to. Feel free to reach out to us with any questions. Thank you.  ^CV1 · 3 February at 06:22Remove"
Can you just fix my Bluetooth in my 2015 so it doesn't have a 4 second delay.,Donald Morris · 39:08  Can you just fix my Bluetooth in my 2015 so it doesn't have a 4 second delay.8 · 9 January at 09:30Remove
"Hello, we are sorry to hear that your vehicle is having issues. We recommend calling the Tech Support Department at 888-528-7876. Thank you. ^SP","Honda ·   Hello, we are sorry to hear that your vehicle is having issues. We recommend calling the Tech Support Department at 888-528-7876. Thank you. ^SP3 · 9 January at 13:54Remove"
Does the 2018 Odyssey have the ability to play Blue Ray DVDs?,Nicholas Jungovic · 39:17  Does the 2018 Odyssey have the ability to play Blue Ray DVDs?1 · 10 January at 11:07Remove
We don't have that specific information yet but we will keep you updated when we know more.,Honda ·   We don't have that specific information yet but we will keep you updated when we know more.4 · 10 January at 11:39Remove
"Introducing the, bread box! It's all electric, square as the person who will be driving it and screams I can't get laid and never will driving this thing. Anybody down for some toast?","Don Bolin · 0:00  Introducing the, bread box! It's all electric, square as the person who will be driving it and screams I can't get laid and never will driving this thing. Anybody down for some toast?2 · 6 January at 03:25Remove"
"The UK desperately needs an odyssey (not the bloated USA version,  sorry guys)  it's the best people mover in Oz so why not bring it here to plug the gap since the old frv passed away ?","Gaz J Mills · 3:49  The UK desperately needs an odyssey (not the bloated USA version,  sorry guys)  it's the best people mover in Oz so why not bring it here to plug the gap since the old frv passed away ?4 · 5 January at 15:20Remove"
"Where's the Type R for North America we've been promised? Yeah, that's right","Tyler Mason · 0:55  Where's the Type R for North America we've been promised? Yeah, that's right2 · 5 January at 13:07Remove"
Honda mean technology... but when it comes to car...THE COMPANY  lack,Tushar N Rashmi Patel · 4:53  Honda mean technology... but when it comes to car...THE COMPANY  lack2 · 6 January at 03:41Remove
Honda updated software in my 2015 CRV and the vibration problem that I was having has been fixed.,John VanOveren · 22:24  Honda updated software in my 2015 CRV and the vibration problem that I was having has been fixed.2 · 5 January at 14:51Remove
"Hello, thank you for contacting us.  We are glad to hear the vibration issue has been resolved with your vehicle.  We appreciate your feedback as it is very important to us! ^RR","Honda ·   Hello, thank you for contacting us.  We are glad to hear the vibration issue has been resolved with your vehicle.  We appreciate your feedback as it is very important to us! ^RR2 · 5 January at 15:01Remove"
Well Honda while you are dreaming up the future please remember us in the past that bought the 2015 CRV that has a vibration when idling . Why are you not doing something about this? We Honda customers are pretty loyal to your products. I just wish you...See more,Don White · 11:27  Well Honda while you are dreaming up the future please remember us in the past that bought the 2015 CRV that has a vibration when idling . Why are you not doing something about this? We Honda customers are pretty loyal to your products. I just wish you...See more7 · 5 January at 11:11Remove
"Hello, thank you for contacting us.  We are sorry to hear about the issue you are experiencing with your vehicle.  Please Pm us your VIN and advise if you had an opportunity to have the issue diagnosed with your Honda dealer. ^RR","Honda ·   Hello, thank you for contacting us.  We are sorry to hear about the issue you are experiencing with your vehicle.  Please Pm us your VIN and advise if you had an opportunity to have the issue diagnosed with your Honda dealer. ^RR1 · 5 January at 11:30Remove"
"Hello. I am from Turkey. I own a New civic sedan. Recently, in our country we have a problem about the our cars. Although we have reported, The authourities did not return to us. Hundreds of People have the same problem. Our problem is that: There is a dent(s) on the rear right and/or left window of our cars. I demand that the subject be resolved. Best regards...","Yasin Bolbol · 0:00  Hello. I am from Turkey. I own a New civic sedan. Recently, in our country we have a problem about the our cars. Although we have reported, The authourities did not return to us. Hundreds of People have the same problem. Our problem is that: There is a dent(s) on the rear right and/or left window of our cars. I demand that the subject be resolved. Best regards...1 · 14 July at 11:10Remove"
Thank you for contacting us. We are with American Honda Motor Co. Inc. and deal mainly with Honda vehicles made for sale and use within the United States. Please try contacting  \https://www.facebook.com/HondaTR .  We hope this helps. ^CB,"Honda ·   Thank you for contacting us. We are with American Honda Motor Co. Inc. and deal mainly with Honda vehicles made for sale and use within the United States. Please try contacting  \https://www.facebook.com/HondaTR .  We hope this helps. ^CBHonda TürkiyeCars1,760,666 people like this1 · 14 July at 14:20Remove"
"Hello. I am from Turkey. I own a New civic sedan. Recently, in our country we have a problem about the our cars. Although we have reported, The authourities did not return to us. Hundreds of People have the same problem. Our problem is that: There is a dent(s) on the rear right and/or left window of our cars. I demand that the subject be resolved. Best regards...","Erdal Ertosun · 0:00  Hello. I am from Turkey. I own a New civic sedan. Recently, in our country we have a problem about the our cars. Although we have reported, The authourities did not return to us. Hundreds of People have the same problem. Our problem is that: There is a dent(s) on the rear right and/or left window of our cars. I demand that the subject be resolved. Best regards...1 · 14 July at 11:04Remove"
Thank you for contacting us. We are with American Honda Motor Co. Inc. and deal mainly with Honda vehicles made for sale and use within the United States. Please try contacting  \https://www.facebook.com/HondaTR .  We hope this helps. ^CB,"Honda ·   Thank you for contacting us. We are with American Honda Motor Co. Inc. and deal mainly with Honda vehicles made for sale and use within the United States. Please try contacting  \https://www.facebook.com/HondaTR .  We hope this helps. ^CBHonda TürkiyeCars1,760,666 people like this14 July at 14:21Remove"
Are they going to talk about horsepower specs on the type r? Or will that be next year?,Josh Tonelli · 19:14  Are they going to talk about horsepower specs on the type r? Or will that be next year?2 · 1 November 2016 at 12:09Remove
"Hello, thank you for reaching out to us at American Honda. We appreciate your interest in the Honda brand. Any new model information can be found on automobiles.honda.com or hondanew.com    Feel free to contact us with any questions. Thank you. ^CV","Honda ·   Hello, thank you for reaching out to us at American Honda. We appreciate your interest in the Honda brand. Any new model information can be found on automobiles.honda.com or hondanew.com    Feel free to contact us with any questions. Thank you. ^CVHonda Cars - New and Certified Pre-Owned Vehicles from American HondaHonda Cars - Home of information on the latest Honda cars and SUV models, Certified Pre-Owned Vehicles. Photos, videos, technical specs and dealer locations for all car models from American Honda.automobiles.honda.com1 · 1 November 2016 at 12:11Remove"
Still waiting for my Takata airbag replacement,Gary Ehmke · 0:22  Still waiting for my Takata airbag replacement12 · 1 November 2016 at 16:38Remove
"Hello, thank you for reaching out to us. We're sorry for the inconvenience and frustration the Takata Airbag Inflator Recall has caused. As soon as parts become available to address the recall, American Honda will notify its affected customers. If you have any questions or concerns, feel free to contact our Recall/Campaigns Department at (800)999-1009 option #4. We thank you for your patience and understanding. ^RR","Honda ·   Hello, thank you for reaching out to us. We're sorry for the inconvenience and frustration the Takata Airbag Inflator Recall has caused. As soon as parts become available to address the recall, American Honda will notify its affected customers. If you have any questions or concerns, feel free to contact our Recall/Campaigns Department at (800)999-1009 option #4. We thank you for your patience and understanding. ^RR3 · 1 November 2016 at 16:54Remove"
I work at a Honda dealership when should we expect it to hit the stores?,Omri Wilson · 1:09  I work at a Honda dealership when should we expect it to hit the stores?5 · 3 November 2016 at 06:02Remove
