year,date,qtr,Vader Sentiment,Normal rating,review
2012,05-03-2012,,0,4.125," I looked at everything & mean everything! It came down to the Dodge Durango Jeep GC Toyota 4Runner & Acadia. I rented a Durango and Jeep for a couple of days. Both of them had driving positions that didnt allow me to read the gauges because the steering wheel blocked it. In the Jeep the A Pillar is way to wide & the roof line to low to be comfortable. With the rear seats down the Durangos load floor was so high that my dog was breathing down my neck and could be pitched out the side window. The 4runner was nice but the rear air vents were blocked when rear seat was folded flat the passenger seat sits very high and is not adjustable plus no sunroof delete available in my state(Im 6'3"")."
2012,13-03-2012,,0,4.125,My 2012 Acadia has revised my opinion of American quality. A very sophisticated work of engineering...very much on a par with the German product as well as the Japanese...and at a more realistic purchase price ...and very much more reasonable service charges.
2012,08-04-2012,,-0.7177,5, I rate this vehicle very high.
2012,08-07-2012,,0.6557,4.875,Problem is that the Denali mode does not allow for snow chains...ever.
2012,16-07-2012,,0,3.875, We have driven Japanese vehicles for the last 15 years we have a 2010 pilot right now as the wife's car and they have all been stellar.
2012,02-08-2012,,0,4.875,We live in the Pacific Northwest so AWD is great for the rain.
2012,25-08-2012,,-0.5213,3.875,This was never told to us at the dealership and now we feel pretty stupid for not asking up front but it did not occur to us.
2012,30-09-2012,,-0.9565,4.125, When I was a kid we had Packards ( Ask the man who owns one ) ...after that we drove Chevys & Cadillacs. In the 80's we switched to German iron since all the US auto makers fell flat on quality.
2012,06-12-2012,,-0.0258,4.625,Don't know if models with smaller rims might accommodate chains but don't upgrade to the Denali model is you want to spend any time in the snow.
2012,20-12-2012,,0.4201,3.75,The build quality seems on pr with the Hondas the material quality is a step below the pilot.
2012,30-12-2012,,0.1508,4.625,"I liked the more utilitarian styling of the SLE model. Its not ""blinged"" out and looks more like a traditional GMC should. I didn't want my SUV to look like a car. I like the power-liftgate off switch. If you own a dog or in a low garage/parking structure you will too! Besides I don't have the patience to wait for it to open/close nor risk my dog deciding he wants to escape when its going down. Drives really smooth and don't agree with edmunds review of it being bland to drive or hard to maneuver due to its size. I like the heft and substantial feel..doesn't feel like a car but its also not as clumsy or porky feeling as piloting a Yukon/Tahoe. Finally the 4 rear A/C vents are great!"
2012,26-01-2013,,0.3612,4.5, Bought this SUV as a family hauler.
2012,04-05-2013,,0.1154,3.75, Decent ride a bit underpowered but MPG ok. Very comfortable and tons of room even with three kids in the back. Seats take awhile to heat up.
2012,11-01-2014,,0.6249,4.125,Diesel version? Stop trying to poison our family! or at least have a clue on how to fix it.
2012,20-12-2014,,0.8576,4.625,The interior is very plastic looking but not much different from the 2009 GMC Sierra Crew Cab pickup I had (fyi-the 2013 interior is revised). Its early but its a bit of a gas pig. However its a 2.5 ton vehicle w/AWD so I expected to pay more at the pump. The driver seat is way to soft..I have already built up the seat foam using a professional auto upholstery shop. The head rests are terrible and can hit some people in the neck/shoulders and having to have them shaved down as well. Its a shame GMC has ruined resale by using these as rental vehicles. I two year leased mine knowing the used car market is flooded with the Acadia/Traverse. Found it difficult to find low optioned AWD SLE's .
2012,02-02-2016,,0.3818,4, We really like the way that it drives and looks.
2012,20-01-2017,,0,4,I have been admiring the Acadia for some time.
2013,15-12-2012,,0,5, I've had my 2013 Acadia for about 4 weeks.
2013,13-02-2013,,0.6249,3.5, Downsizing from driving Yukon XL Denalis since 2003 I was excited to see the Denali trim in the medium sized Acadia.
2013,26-02-2013,,0,3.25,My Yukons never let me down so I was a little bias'd toward the GMC line.
2013,24-05-2013,,0,4.25, We previously drove a Buick Enclave for 5 years so we knew what to expect with the Lambda platform which is shared between the Chevy Traverse GMC Acadia and Buick Enclave.
2013,15-06-2013,,0.9477,3.125,We traded back a 6 month old Durango Citadel to go back to a GM 7/8 passenger CUV (Buick to GMC). Overall the GMC Acadia is light years better with fit and finish and luxury touches though there are a handful of items that the Acadia lacks for $50k+ that should be corrected sooner than later. A digital speedometer and gauge is expected at this price point (appears to be limited to existing gauge cluster). So is keyless ignition and collision avoidance at least as an option. The other notable difference is realizing how good the Dodge's Mercedes based drivetrain is compared to the aging Lambda platform. The Acadia is heavy and took a little getting used to after coming out of the Dodge.
2013,27-06-2013,,0.8583,4.625,Overall one of the best values for the content and quality that GM now offers in this segment.
2013,28-06-2013,,0,3,The Acadia is a very nice looking cross-over but as they say beauty is only skin deep.
2013,03-04-2015,,0.34,3.875,I tossed between the Benz 350 Nissan Pathfinder Infiniti XJ and the Acadia.
2013,11-04-2015,,0.7845,5,"The look of the GMC with refreshed front and year. LED headlamps are striking and similar to CUV's costing much more. The Denali trim is much improved with panels being better integrated with the body less chrome and better options for 20"" wheels with machined alloys that support the GMC brand as advertised. Interior fit and finish with stitched dash and wood trim detail make for pleasing trips to the mall or a trip to the beach. The Acadia is large and can accommodate a large amount of gear."
2013,10-05-2015,,0.34,4,The refresh has given this CUV what we consider a more truck like presence which appeals to both the male and female driver in our family. Fit and finish is what one would expect from GM with improvements made to the transmission in the Acadia (no more searching for gears up hills) less flashy wheel offerings and better integrated telematics (bluetooth nav DVD).
2013,14-07-2016,,0.8045,4,I have driven it 1000 miles and all I can say is shame on you GMC.
2013,04-04-2017,,0,2,Great car.
2017,22-10-2016,,0.5617,5, Loved my '08 Acadia and I felt no need to change horses when it came time for replacement. So far I have driven this only in good weather so I can't comment at all on rain/snow driving. This model seems noticeably quieter than my 08 and seems a bit more peppy. Driving is smooth I can't think of a thing to criticize in a major way but I have some  quibbles. The Infotainment system may have some improvements over my old system but it doesn't seem as intuitive. For one thing I can't figure out how to mark the location where I am sitting and if it's in the manual show me where!  The feature was drop-dead easy in my old Acadia. The manual by the way is poorly thought out and lacking detail. The electronics are great! Blind spot alert feature is very helpful and a must-have. Backup camera as well. Color we chose was Sparkling silver and it's gorgeous!
2017,06-01-2017,,0.9323,5, I owned a 2014 Acadia Denali before but after purchasing the 2017 Acadia Limited I find it to be every bit as good if not better than it's predecessor.  The only thing I miss is the power tilt and telescope steering wheel. But the manually adjusted function in the 2017 Limited is easy to adjust and I'm sure it will not be any problem in the near future. The up grades to the 2017 Limited are really amazing. Wish they would have been available in the 2014 Denali but that is the difference in 3 years of technology upgrades. I prefer the size of the Limited  as opposed to the new smaller 2017 Acadia. My wife and I just purchased our new Limited in March and drove to St Louis and back to Vero Beach FL averaging 23 mpg. We are pleased!
2017,04-12-2017,,0.9844,5, I have only owned an Acaidia for a short time we purchased a 2015 certified pre owned which we love.  It needed service and we received a loaner which was a 2017 Acaidia Limited.  Both cars are amazing.  I hope that GMC doesn't  stop production of the larger size SUV.
2017,07-12-2017,,0.8976,5," Have been driving it for two weeks and absolutely love it.  Acceleration is peppy - handling is wonderful road noise is low and love that it is 7"" shorter than our Buick Enclave.  Apple car play is handy."
,,,0,,
