twitter_hashtag_ToyotaGB,https://twitter.com/ToyotaGB/status/855426419769221120,,7:22 AM - 21 Apr 2017,"['Meet:95', 'World:71']",Meet the World Green Car of the Year    #PriusPlugInpic twitter com   XwxHlWPP,,
twitter_hashtag_ToyotaGB,https://twitter.com/ToyotaGB/status/855357213619044352,,2:47 AM - 21 Apr 2017,"['By:6', 'Toyota:3']",By the time you ve watched this  a new Toyota will have joined the family pic twitter com s ZPfR bav,,
twitter_hashtag_ToyotaGB,https://twitter.com/ToyotaGB/status/855123178653437953,,11:17 AM - 20 Apr 2017,"['World:3', 'Green:6']",World Green Car of the Year  #PriusPlugInpic twitter com VO BYu cXE,,
twitter_hashtag_ToyotaGB,https://twitter.com/ToyotaGB/status/855091716772159488,,9:12 AM - 20 Apr 2017,['A:7'],A unique #Avensis returns to the factory where its life started   pic twitter com  VAnhETuvt,,
twitter_hashtag_ToyotaGB,https://twitter.com/ToyotaGB/status/855066648130224128,,7:32 AM - 20 Apr 2017,"['Toyota:2', 'Gazoo:7', 'Racing:7']",Toyota Gazoo Racing welcomes  EsapekkaLappi to its WRC team   pic twitter com np STXqzY ,,
twitter_hashtag_ToyotaGB,https://twitter.com/ToyotaGB/status/855030059844939777,,5:07 AM - 20 Apr 2017,"['Want:5', 'Toyota:5']",Want a #ToyotaCHR that stands out even more  Check out our limited edition model   pic twitter com biTX o iqY,,
twitter_hashtag_ToyotaGB,https://twitter.com/ToyotaGB/status/854994824432418817,,2:47 AM - 20 Apr 2017,"['It:10', 'Yaris:5', 'Here:7', 'Xg:7']",It s the best #Yaris yet  Here are    reasons why   pic twitter com  UrYMf NB ,,
twitter_hashtag_ToyotaGB,https://twitter.com/ToyotaGB/status/854759543212998661,,11:12 AM - 19 Apr 2017,"['The:0', 'Prius:1']",The first  the best  #PriusPluginpic twitter com bh cM Jvzo,,
twitter_hashtag_ToyotaGB,https://twitter.com/ToyotaGB/status/854730586417659905,,9:17 AM - 19 Apr 2017,"['There:100', 'Limited:9', 'Edition:2']",There are only     examples of this Limited Edition #ToyotaCHR  What makes it different     pic twitter com uqxATR k L,,
twitter_hashtag_ToyotaGB,https://twitter.com/vossenwheels/status/854665826431107072,,4:59 AM - 19 Apr 2017,"['My:10', 'Speedhunters:7']",My goodness   Speedhunters  VOSSEN JAPAN #Lexon #VFS    ToyotaGB  Toyota  ToyotaPRpic twitter com aTt nAZfqF,,
twitter_hashtag_ToyotaGB,https://twitter.com/ToyotaGB/status/854699127715667968,,7:12 AM - 19 Apr 2017,['Ten:67'],Ten reasons why the latest #Yaris is the best yet   pic twitter com tC  qredVZ,,
twitter_hashtag_ToyotaGB,https://twitter.com/ToyotaGB/status/854667420602171392,,5:06 AM - 19 Apr 2017,"['Modern:4', 'The:0', 'FT:85', 'X:22']",Modern history  The #FT X Concept  inspired by the classic FJ Cruiser   pic twitter com z H  gy  z,,
twitter_hashtag_ToyotaGB,https://twitter.com/ToyotaGB/status/854632440417136640,,2:47 AM - 19 Apr 2017,"['The:9', 'This:8']",The truck made for big kids everywhere  This is the #HiluxTonka   pic twitter com  mqkV NssF,,
twitter_hashtag_ToyotaGB,https://twitter.com/ToyotaGB/status/854390846745169920,,10:47 AM - 18 Apr 2017,"['Read:4', 'Dunlop:6', 'BTCC:7']",Read our race report from rounds     of the  DunlopBTCC at  DoningtonParkUK   pic twitter com qcwvWLrQs ,,
twitter_hashtag_ToyotaGB,https://twitter.com/ToyotaGB/status/854336512133128193,,7:11 AM - 18 Apr 2017,"['A:4', 'This:1']",A concept for city dwellers who love the outdoors This is the Toyota #FT X   pic twitter com XocL kfXnp,,
twitter_hashtag_ToyotaGB,https://twitter.com/ToyotaGB/status/854300251750113280,,4:47 AM - 18 Apr 2017,"['Toyota:6', 'Gazoo:3', 'Racing:47']",Toyota Gazoo Racing claims dramatic victory in the # HoursofSilverstone   pic twitter com Bwc itj  t,,
twitter_hashtag_ToyotaGB,https://twitter.com/ToyotaGB/status/853695254997770240,,12:43 PM - 16 Apr 2017,"['Watching:86', 'BBC:02', 'Top:9', 'Gear:9']",Watching  BBC TopGear and wondering how to get a #GT   ready for the track  Find out here   pic twitter com   Vsjlo g ,,
twitter_hashtag_ToyotaGB,https://twitter.com/Toyota_Hybrid/status/853654447007858690,,10:00 AM - 16 Apr 2017,"['Victory:6', 'Silverstone:4', 'What:9']",Victory at Silverstone  What an amazing race and brilliant result  Thanks to  Porsche Team for the great fight   FIAWEC # hSilverstonepic twitter com WvUE jdlh ,,
twitter_hashtag_ToyotaGB,https://twitter.com/ToyotaGB/status/853550040182173700,,3:06 AM - 16 Apr 2017,"['Every:80', 'Avensis:2']",Every #Avensis is built in our UK factory Even  TomIngram   s  SpeedworksMS #BTCC Avensis pic twitter com yTdmQdNb w,,
twitter_hashtag_ToyotaGB,https://twitter.com/ToyotaGB/status/853258398015606784,,7:47 AM - 15 Apr 2017,"['A:86', 'GT:9']", A fun little number    riddlemagazine on #GT     pic twitter com nZx nUEnAy,,
twitter_hashtag_ToyotaGB,https://twitter.com/ToyotaGB/status/853217097345675266,,5:03 AM - 15 Apr 2017,['Every:374'],Every #Avensis is built in our UK factory Even this one pic twitter com zf   YSfno,,
twitter_hashtag_ToyotaGB,https://twitter.com/ToyotaGB/status/853186942737022976,,3:03 AM - 15 Apr 2017,"['New:10', 'Yaris:96', 'Here:2', 'GG:9']",New #Yaris is better than ever  Here are    reasons why   pic twitter com H  fUYI q ,,
twitter_hashtag_ToyotaGB,https://twitter.com/ToyotaGB/status/852809404898451456,,2:03 AM - 14 Apr 2017,['Every:3'],Every #Avensis is built in our UK factory Even this one pic twitter com nvSjo TdIA,,
twitter_hashtag_ToyotaGB,https://twitter.com/ToyotaGB/status/852586453351747584,,11:17 AM - 13 Apr 2017,['Toyota:3'],Toyota Gazoo Racing all set for  FIAWEC at  SilverstoneUK     Toyota Hybridpic twitter com LOfu gBhXg,,
twitter_hashtag_ToyotaGB,https://twitter.com/ToyotaGB/status/852555008495296513,,9:12 AM - 13 Apr 2017,"['Better:74', 'The:9']",Better than ever The new #Yaris pic twitter com i  NFKxm Y,,
twitter_hashtag_ToyotaGB,https://twitter.com/ToyotaGB/status/852524808952741888,,7:12 AM - 13 Apr 2017,"['The:6', 'Dunlop:7', 'BTCC:6']",The  DunlopBTCC heads to  DoningtonParkUK this weekend  Here s our preview   pic twitter com  O aKdaHjM,,
twitter_hashtag_ToyotaGB,https://twitter.com/ToyotaGB/status/852494625684287488,,5:12 AM - 13 Apr 2017,"['This:4', 'Toyota:1']",This is the Toyota #FT X  a concept for city dwellers who love the outdoors    What do you think pic twitter com RmzuOL YUP,,
twitter_hashtag_ToyotaGB,https://twitter.com/ToyotaGB/status/852458090263789568,,2:47 AM - 13 Apr 2017,[],Intelligent  innovative and nearly here  This is the new #Yarispic twitter com pqHyVkvbwu,,
twitter_hashtag_ToyotaGB,https://twitter.com/ToyotaGB/status/852225331490693130,,11:22 AM - 12 Apr 2017,"['Toyota:6', 'Gazoo:9', 'Racing:7']",Toyota Gazoo Racing fight hard in spectacular  OfficialWRC Tour de Corse   pic twitter com FNQhY Kn y,,
twitter_hashtag_ToyotaGB,https://twitter.com/ToyotaGB/status/852190598165659649,,9:04 AM - 12 Apr 2017,"['Everything:6', 'Yaris:65', 'Dk:92']",Everything you need to know about the new #Yaris price and spec   pic twitter com V  zhNqf  ,,
twitter_hashtag_ToyotaGB,https://twitter.com/ToyotaGB/status/852160382135263232,,7:04 AM - 12 Apr 2017,['Take:5'],Take a closer look at the new #Yaris pic twitter com SCG Bybfws,,
twitter_hashtag_ToyotaGB,https://twitter.com/ToyotaGB/status/852095717166526465,,2:47 AM - 12 Apr 2017,['New:18'],New car  New season  Toyota Gazoo Racing are back with a vengeance pic twitter com KL  HBsDSV,,
twitter_hashtag_ToyotaGB,https://twitter.com/ToyotaGB/status/851862174830133251,,11:19 AM - 11 Apr 2017,['Intelligent:0'],Intelligent and innovative  #Yarispic twitter com uiNieSifO ,,
twitter_hashtag_ToyotaGB,https://twitter.com/ToyotaGB/status/851830226732580864,,9:12 AM - 11 Apr 2017,"['Want:6', 'Yaris:62', 'Full:2']",Want to know more about the new #Yaris Full details here   pic twitter com yq  Q WYXn,,
twitter_hashtag_ToyotaGB,https://twitter.com/ToyotaGB/status/851798767091175426,,7:07 AM - 11 Apr 2017,[],The new #Yaris is nearly here  Can you guess where the press launch is taking place this week pic twitter com yWVhNAHUTq,,
twitter_hashtag_ToyotaGB,https://twitter.com/ToyotaGB/status/851733839055597568,,2:49 AM - 11 Apr 2017,"['Better:8', 'The:06']",Better than ever The new #Yaris pic twitter com AmjJa xG  ,,
twitter_hashtag_ToyotaGB,https://twitter.com/ToyotaGB/status/851440230280331267,,7:22 AM - 10 Apr 2017,['Here:15'],Here s our round up of the  OfficialWRC Tour de Corse     TGR WRCpic twitter com   JMIRwaPi,,
twitter_hashtag_ToyotaGB,https://twitter.com/ToyotaGB/status/851408929602928640,,5:18 AM - 10 Apr 2017,"['Watch:2', 'Toyota:3']",Watch Toyota team up with  TamiyaUK for an epic challenge  #Hiluxpic twitter com  eCpwetM X,,
twitter_hashtag_ToyotaGB,https://twitter.com/ToyotaGB/status/851374977496559618,,3:03 AM - 10 Apr 2017,[],More than a simple hot hatch   pic twitter com jUtpTYaVvw,,
twitter_hashtag_ToyotaGB,https://twitter.com/ToyotaGB/status/851072745479778305,,7:02 AM - 9 Apr 2017,[],More than a simple hot hatch  #YarisGRMNpic twitter com JkwtYPrvsM,,
twitter_hashtag_ToyotaGB,https://twitter.com/ToyotaGB/status/851029941839966208,,4:12 AM - 9 Apr 2017,['New:050'],New car  New season  Same ambition  to win  #TS   pic twitter com MDKVXVbwsr,,
twitter_hashtag_ToyotaGB,https://twitter.com/ToyotaGB/status/851008561832312832,,2:47 AM - 9 Apr 2017,"['By:6', 'UK:1']",By the time you ve watched this  our UK factory will have built a new #Toyota pic twitter com c kjeCUGS ,,
twitter_hashtag_ToyotaGB,https://twitter.com/ToyotaGB/status/850718166032494592,,7:33 AM - 8 Apr 2017,"['The:10', 'TGR:000', 'WRC:6']",The latest action from  TGR WRC at the  Rally of        Corners   #WRC #Yarispic twitter com szm ISYfbr,,
twitter_hashtag_ToyotaGB,https://twitter.com/ToyotaGB/status/850680187872301056,,5:02 AM - 8 Apr 2017,['The:6'],The #HiluxTonka Toyota Australia s present to big kids everywhere   pic twitter com QhIoJV Cjv,,
twitter_hashtag_ToyotaGB,https://twitter.com/ToyotaGB/status/850652444803571712,,3:12 AM - 8 Apr 2017,['Urban:48'],Urban flow  captured  #ToyotaCHRpic twitter com fCnXVNkJ  ,,
twitter_hashtag_ToyotaGB,https://twitter.com/ToyotaGB/status/850413388123574274,,11:22 AM - 7 Apr 2017,"['The:050', 'TS:2017', 'Introducing:6', 'Toyota:1']",The #TS    is back with a vengeance  Introducing  Toyota Hybrid s       FIAWEC challenger   pic twitter com yY F vRbiR,,
twitter_hashtag_ToyotaGB,https://twitter.com/ToyotaGB/status/850379413694885888,,9:07 AM - 7 Apr 2017,"['The:2', 'Yaris:6', 'V:1']",The new #Yaris is better than ever   pic twitter com v eDdlr y ,,
twitter_hashtag_ToyotaGB,https://twitter.com/Tomingram80/status/850323408902660096,,5:24 AM - 7 Apr 2017,[],Massive thanks to  ToyotaGB  ToyotaPR for my all new C HR  What a fantastic piece of kit   Thanks so much guys   pic twitter com gpfbrfNPDt,,
twitter_hashtag_ToyotaGB,https://twitter.com/ToyotaGB/status/850348205829050369,,7:03 AM - 7 Apr 2017,"['Sports:83', 'DNA:5']",Sports cars are in our DNA pic twitter com rFY  o wyc,,
twitter_hashtag_ToyotaGB,https://twitter.com/ToyotaGB/status/850317755266076673,,5:02 AM - 7 Apr 2017,"['My:4', 'Finance:2']",My Finance is the app designed to help you keep track of your #Toyota finance  Here s how   pic twitter com hxAlfRjR z,,
twitter_hashtag_ToyotaGB,https://twitter.com/ToyotaGB/status/850063600878309377,,12:12 PM - 6 Apr 2017,['Meet:5'],Meet the #HiluxTonka Concept by  Toyota Aus   pic twitter com i xnbzkvTw,,
twitter_hashtag_ToyotaGB,https://twitter.com/ToyotaGB/status/850027080154611712,,9:47 AM - 6 Apr 2017,"['Power:10', 'TGR:000', 'WRC:2']",Power up   TGR WRC are ready ahead of the Rally of        Corners pic twitter com  SKijncLDr,,
twitter_hashtag_ToyotaGB,https://twitter.com/ToyotaGB/status/849994626421403649,,7:38 AM - 6 Apr 2017,"['It:2', 'Zc:0']",It s more than a simple hot hatch pic twitter com  qZcCUw Vl,,
twitter_hashtag_ToyotaGB,https://twitter.com/ToyotaGB/status/849959122946609152,,5:17 AM - 6 Apr 2017,[],Five world first innovations of the cutting edge #PriusPlugIn pic twitter com QCugnnizwN,,
twitter_hashtag_ToyotaGB,https://twitter.com/ToyotaGB/status/849926418276302848,,3:07 AM - 6 Apr 2017,"['Everything:4', 'Rally:0']",Everything you need to know about Rally France    #WRCpic twitter com ZCwHQWu dP,,
twitter_hashtag_ToyotaGB,https://twitter.com/ToyotaGB/status/849687364385611777,,11:17 AM - 5 Apr 2017,"['The:1', 'Yaris:4', 'SG:8']",The new #Yaris is better than ever   pic twitter com enliJN gj ,,
twitter_hashtag_ToyotaGB,https://twitter.com/ToyotaGB/status/849656897737076736,,9:16 AM - 5 Apr 2017,"['By:7', 'UK:9', 'Toyota:4']",By the time you ve watched this  our UK factory will have built a new #Toyota pic twitter com  Ic EhY hU,,
twitter_hashtag_ToyotaGB,https://twitter.com/ToyotaGB/status/849625695382667265,,7:12 AM - 5 Apr 2017,['Toyota:4'],Toyota presents  The Bluffer s Guide to Rally France    #WRCpic twitter com skVdKBvpCd,,
twitter_hashtag_ToyotaGB,https://twitter.com/ToyotaGB/status/849595476902985728,,5:12 AM - 5 Apr 2017,"['Why:0', 'PUDg:4']",Why do we race pic twitter com  PUDgFTY Y,,
twitter_hashtag_ToyotaGB,https://twitter.com/ToyotaGB/status/849562781821149185,,3:02 AM - 5 Apr 2017,[],My Finance is the app designed to help you keep track of your #Toyota finance  Here s how   pic twitter com AxiKNlwhhu,,
twitter_hashtag_ToyotaGB,https://twitter.com/ToyotaGB/status/849322934195957760,,11:09 AM - 4 Apr 2017,"['Aspiring:7', 'Find:7']",Aspiring automotive writers  we want to work with you  Find out how   pic twitter com na Nk PDbA,,
twitter_hashtag_ToyotaGB,https://twitter.com/ToyotaGB/status/849290989860782080,,9:02 AM - 4 Apr 2017,['My:5'],My Finance is the app designed to help you keep track of your #Toyota finance  Here s how   pic twitter com FB VXgfeQN,,
twitter_hashtag_ToyotaGB,https://twitter.com/ToyotaGB/status/849271344424300544,,7:44 AM - 4 Apr 2017,['Why:1'],Why do we race pic twitter com  WUqbObQHr,,
twitter_hashtag_ToyotaGB,https://twitter.com/ToyotaGB/status/849233092191469568,,5:12 AM - 4 Apr 2017,"['What:2', 'Hilux:0']",What happened when the #Hilux met its diminutive  TamiyaUK counterparts pic twitter com  KwKEKjH Z,,
twitter_hashtag_ToyotaGB,https://twitter.com/ToyotaGB/status/849202895346171904,,3:12 AM - 4 Apr 2017,[],Farm girl Joanne Marsden joins the #ToyotaTuesday Club with her dependable #Hilux  You can join here   pic twitter com qGZUOQXpZb,,
twitter_hashtag_ToyotaGB,https://twitter.com/ToyotaGB/status/848898923683098626,,7:04 AM - 3 Apr 2017,['A:4'],A strong start for the #Avensis and  SpeedworksMS at the opening rounds of the  DunlopBTCC  pic twitter com hIwtJO aIQ,,
twitter_hashtag_ToyotaGB,https://twitter.com/ToyotaGB/status/848868203967262721,,5:02 AM - 3 Apr 2017,"['My:3', 'Finance:09']",My Finance is the app designed to help you keep track of your #Toyota finance  Here s how   pic twitter com po  BlFrri,,
twitter_hashtag_ToyotaGB,https://twitter.com/ToyotaGB/status/848854374386458624,,4:07 AM - 3 Apr 2017,['New:050'],New car  New season  Same ambition  to win  #TS   pic twitter com CHPQMtpDaZ,,
twitter_hashtag_ToyotaGB,https://twitter.com/ToyotaGB/status/848625918776152064,,12:59 PM - 2 Apr 2017,"['It:45', 'Sir:54', 'Top:4']",It s gold for Sir  chrishoy on #TopGear this evening  Well done pic twitter com   Sg  C sU,,
twitter_hashtag_ToyotaGB,https://twitter.com/ToyotaGB/status/848612017678073857,,12:04 PM - 2 Apr 2017,"['How:86', 'GT:3']",How do you get a #GT   ready for  BBC TopGear Find out here   pic twitter com zm YEphxNV,,
twitter_hashtag_ToyotaGB,https://twitter.com/ToyotaGB/status/848539790509297664,,7:17 AM - 2 Apr 2017,[],The #HiluxTonka Toyota Australia s present to big kids everywhere   pic twitter com ZMkHPmrFun,,
twitter_hashtag_ToyotaGB,https://twitter.com/ToyotaGB/status/848538228344934401,,7:10 AM - 2 Apr 2017,"['P:3', 'Tomingram:80', 'Speedworks:9', 'MS:6']",P  for  Tomingram   and  SpeedworksMS in race two of the #BTTC  Well done pic twitter com Wrzvy Pu q,,
twitter_hashtag_ToyotaGB,https://twitter.com/ToyotaGB/status/848490742498643968,,4:02 AM - 2 Apr 2017,"['Congratulations:80', 'Tomingram:1']",Congratulations  Tomingram    First place in the first race of the #btcc season pic twitter com EMa waBUtU,,
twitter_hashtag_ToyotaGB,https://twitter.com/SpeedworksMS/status/848208798993047552,,9:21 AM - 1 Apr 2017,"['A:80', 'Tomingram:2', 'P:7497', 'Brands:32']",A fantastic day for  Tomingram   qualifying P  here at  Brands Hatchpic twitter com o    zs  D,,
twitter_hashtag_ToyotaGB,https://twitter.com/ToyotaGB/status/848133358060060672,,4:22 AM - 1 Apr 2017,"['What:4', 'Hilux:5']",What happened when #Hilux met  TamiyaUK s Bruiser   pic twitter com rZHXVuD P ,,
twitter_hashtag_ToyotaGB,https://twitter.com/ToyotaGB/status/848103149512515585,,2:22 AM - 1 Apr 2017,['By:87'],By the time you ve watched this  our UK factory will have built a new Toyota pic twitter com TvzhMBl  t,,
twitter_hashtag_ToyotaGB,https://twitter.com/ToyotaGB/status/848072966537478144,,12:22 AM - 1 Apr 2017,"['Still:1', 'The:9']",Still or sparkling  The car that only emits water now offers both  #Miraipic twitter com RFXdVO x P,,
twitter_hashtag_ToyotaGB,https://twitter.com/ToyotaGB/status/847879424141910016,,11:33 AM - 31 Mar 2017,['The:8'],The weekend is here Time to go find the best driving roads  with some old friends pic twitter com ohKZ UvcaO,,
twitter_hashtag_ToyotaGB,https://twitter.com/ToyotaGB/status/847849252474769409,,9:33 AM - 31 Mar 2017,"['The:0', 'Dunlop:86']",The  DunlopBTCC is back  Get the inside track   pic twitter com  Vubby  dY,,
twitter_hashtag_ToyotaGB,https://twitter.com/ToyotaGB/status/847816258032730112,,7:22 AM - 31 Mar 2017,"['We:16', 'More:4']",We re proud to announce  guidedogs as our new national charity partner  More here   pic twitter com Q  GtBWmU ,,
twitter_hashtag_ToyotaGB,https://twitter.com/ToyotaGB/status/847785815761498112,,5:21 AM - 31 Mar 2017,"['A:66', 'Toyota:8', 'Here:2']",A new #Toyota every    seconds Here s how our UK factory does it   pic twitter com UnYaTSX zR,,
twitter_hashtag_ToyotaGB,https://twitter.com/ToyotaGB/status/847756382732304384,,3:24 AM - 31 Mar 2017,"['When:6', 'Hiluxpic:6']",When little met large  #Hiluxpic twitter com  tyVpu qZQ,,
twitter_hashtag_ToyotaGB,https://twitter.com/ToyotaGB/status/847729493187846144,,1:37 AM - 31 Mar 2017,"['Introducing:2017', 'Toyota:050', 'Hybrid:7', 'FIAWEC:2']",Introducing  Toyota Hybrid s       FIAWEC challenger    #TS   pic twitter com U MpNhPp Z,,
twitter_hashtag_ToyotaGB,https://twitter.com/ToyotaGB/status/847520584728793088,,11:47 AM - 30 Mar 2017,['This:0'],This is the #ToyotaiTril Concept  The next step in our EV journey pic twitter com  VOWPGToTd,,
twitter_hashtag_ToyotaGB,https://twitter.com/ToyotaGB/status/847487846323593217,,9:37 AM - 30 Mar 2017,"['Creating:0', 'Hilux:9']",Creating a little #Hilux legend pic twitter com kjML DJ Uc,,
twitter_hashtag_ToyotaGB,https://twitter.com/ToyotaGB/status/847437521680084997,,6:17 AM - 30 Mar 2017,[],By the time you ve watched this  our UK factory will have built a new #Toyota pic twitter com WMGdUtCBHf,,
twitter_hashtag_ToyotaGB,https://twitter.com/ToyotaGB/status/847405349443215360,,4:09 AM - 30 Mar 2017,"['Out:5', 'VJ:0', 'Hilux:789']",Out of the sand pit and onto the road    #HiluxTonkapic twitter com l Jl   DMC,,
twitter_hashtag_ToyotaGB,https://twitter.com/ToyotaGB/status/847368844519669761,,1:44 AM - 30 Mar 2017,['More:6'],More than a simple hot hatch pic twitter com  TdKoAlwhc,,
twitter_hashtag_ToyotaGB,https://twitter.com/ToyotaGB/status/847158177691045888,,11:47 AM - 29 Mar 2017,"['Milltek:86', 'Sport:0']",  MilltekSport #GT   triumphs at the Nürburgring   pic twitter com Irc bjrRDC,,
twitter_hashtag_ToyotaGB,https://twitter.com/ToyotaGB/status/847116225473921025,,9:00 AM - 29 Mar 2017,"['Created:0', 'Toyota:1']",Created by  Toyota Aus for big kids everywhere The amazing #HiluxTonka Concept   pic twitter com GdfiwtL q ,,
twitter_hashtag_ToyotaGB,https://twitter.com/ToyotaGB/status/847086702661283840,,7:03 AM - 29 Mar 2017,['When:7'],When little met large  #Hiluxpic twitter com WlbPmu XVH,,
twitter_hashtag_ToyotaGB,https://twitter.com/ToyotaGB/status/847062546834173952,,5:27 AM - 29 Mar 2017,"['Toyota:9', 'Japan:6']",Toyota Japan takes #ToyotaCHR on a tour of the  StreetFighter universe   pic twitter com b AoqcT nm,,
twitter_hashtag_ToyotaGB,https://twitter.com/mygreenpod/status/846338025164562432,,5:28 AM - 27 Mar 2017,"['Toyota:2', 'VFZx:4']",Toyota launches  eco billboards  fitted with tech that purifies the #air   #Mirai #Hydrogen  Toyotapic twitter com GPcoEEid K,,
twitter_hashtag_ToyotaGB,https://twitter.com/ToyotaGB/status/847002169358344194,,1:27 AM - 29 Mar 2017,"['New:9', 'Yaris:5']",New #Yaris  Better than ever pic twitter com eIJ CUdY a,,
twitter_hashtag_ToyotaGB,https://twitter.com/ToyotaGB/status/846792008953991169,,11:32 AM - 28 Mar 2017,"['From:68', 'Toyota:3']", From the word go the winner was quite clear  #ToyotaCHR wins tough  ParkersNews crossover group test   pic twitter com Z  DLvr Wt,,
twitter_hashtag_ToyotaGB,https://twitter.com/ToyotaGB/status/846755481121148929,,9:06 AM - 28 Mar 2017,"['When:5', 'Hiluxpic:8', 'Yv:2']",When little met large  #Hiluxpic twitter com  q nqYvCt ,,
twitter_hashtag_ToyotaGB,https://twitter.com/ToyotaGB/status/846726575429058560,,7:12 AM - 28 Mar 2017,[],Always innovating Here are five outstanding firsts of the new #PriusPlugIn   pic twitter com QUqmtMVVVc,,
twitter_hashtag_ToyotaGB,https://twitter.com/ToyotaGB/status/846671460928307200,,3:33 AM - 28 Mar 2017,"['Driver:2017', 'Toyota:3']",Driver line up confirmed for Toyota Gazoo Racing s      World Endurance Championship challenge   pic twitter com nAKsqQ KPK,,
twitter_hashtag_ToyotaGB,https://twitter.com/ToyotaGB/status/846634740547371009,,1:07 AM - 28 Mar 2017,"['Go:0', 'Hilux:6']",Go behind the scenes of our #Hilux Little and Large films pic twitter com  nf deYOXz,,
twitter_hashtag_ToyotaGB,https://twitter.com/ToyotaGB/status/846373006620278785,,7:47 AM - 27 Mar 2017,['Watch:0'],Watch as a  TamiyaUK #Hilux goes diving to keep up with its real life namesake pic twitter com SjyJX paHq,,
twitter_hashtag_ToyotaGB,https://twitter.com/ToyotaGB/status/846338268224372736,,5:29 AM - 27 Mar 2017,"['How:6', 'Tamiya:0', 'UK:9', 'Hilux:3']",How did we make a  TamiyaUK Hilux drive underwater Our Instagram Story takes you behind the scenes   pic twitter com PDE br i I,,
twitter_hashtag_ToyotaGB,https://twitter.com/ToyotaGB/status/846303071189766144,,3:09 AM - 27 Mar 2017,"['How:5', 'Hilux:61']",How to clean a car  #Hilux style   pic twitter com JGFr p  Zj,,
twitter_hashtag_ToyotaGB,https://twitter.com/ToyotaGB/status/846082600166862848,,12:33 PM - 26 Mar 2017,"['Here:86', 'Top:7']",Here s how the #TopGear #GT   was prepared for the famous test track   pic twitter com AjcHLNPyHr,,
twitter_hashtag_ToyotaGB,https://twitter.com/ToyotaGB/status/846007369503068161,,7:34 AM - 26 Mar 2017,"['The:687', 'Tamiya:0']",The  TamiyaUK and Toyota #Hilux take on a river in Wade   pic twitter com f   T fpvB,,
twitter_hashtag_ToyotaGB,https://twitter.com/ToyotaGB/status/845978150131544065,,5:38 AM - 26 Mar 2017,"['Did:4', 'Tamiya:9']",Did a  TamiyaUK #Hilux really drive underwater Yes  Here s how we did it   pic twitter com b ggVVH Fs,,
twitter_hashtag_ToyotaGB,https://twitter.com/ToyotaGB/status/845940149921898496,,3:07 AM - 26 Mar 2017,['Have:34'],Have you remembered to set your clocks forward today    pic twitter com TCjNEe  XX,,
twitter_hashtag_ToyotaGB,https://twitter.com/ToyotaGB/status/845922296988483584,,1:56 AM - 26 Mar 2017,['Watch:6'],Watch #Hilux make a splash with its small yet mighty Tamiya UK friend pic twitter com ANMeYLzV u,,
twitter_hashtag_ToyotaGB,https://twitter.com/ToyotaGB/status/845665840569761793,,8:57 AM - 25 Mar 2017,['Tomorrow:3'],Tomorrow   #Hiluxpic twitter com cnhytY NBE,,
twitter_hashtag_ToyotaGB,https://twitter.com/ToyotaGB/status/845631124940349440,,6:39 AM - 25 Mar 2017,['Tow:0'],Tow s company in this high stakes #Hilux face off   pic twitter com x IXnjPhGg,,
twitter_hashtag_ToyotaGB,https://twitter.com/ToyotaGB/status/845591854758281217,,4:03 AM - 25 Mar 2017,[],Want to know how we made Little and Large compete in a tow off Follow us on Instagram   pic twitter com qpDaEGYnKy,,
twitter_hashtag_ToyotaGB,https://twitter.com/ToyotaGB/status/845359067132391424,,12:38 PM - 24 Mar 2017,"['Our:0', 'Little:0']",Our Little and Large #Hilux models go tow to tow   pic twitter com cXdWcH i A,,
twitter_hashtag_ToyotaGB,https://twitter.com/ToyotaGB/status/845297672948932608,,8:34 AM - 24 Mar 2017,['A:3'],A head to head towing challenge unlike any other But who won     pic twitter com Z JmASbqiY,,
twitter_hashtag_ToyotaGB,https://twitter.com/ToyotaGB/status/845260948915064832,,6:08 AM - 24 Mar 2017,['Tow:4'],Tow s company  #Hiluxpic twitter com jhijafxk r,,
twitter_hashtag_ToyotaGB,https://twitter.com/TamiyaUK/status/845232394491846657,,4:14 AM - 24 Mar 2017,"['TOYota:15', 'Story:4', 'Tamiya:2017', 'Bruisers:03', 'Toyota:7']",TOYota Story see how    Tamiya Bruisers were prepared for   unique  ToyotaGB videos #hilux  …pic twitter com dXh ZkGYNI,,
twitter_hashtag_ToyotaGB,https://twitter.com/ToyotaGB/status/845178106725871617,,12:38 AM - 24 Mar 2017,['Watch:3'],Watch a #Hilux go tow to tow with  TamiyaUK in this unique challenge pic twitter com mPUsIyF gv,,
twitter_hashtag_ToyotaGB,https://twitter.com/ToyotaGB/status/845018824659349504,,2:06 PM - 23 Mar 2017,"['Tomorrow:7', 'Hiluxpic:8']",Tomorrow   #Hiluxpic twitter com d AnyJIR R,,
twitter_hashtag_ToyotaGB,https://twitter.com/ToyotaGB/status/844990660667199491,,12:14 PM - 23 Mar 2017,"['Avensis:2017', 'Dunlop:4', 'BTCC:0']",#Avensis sets the pace ahead of       DunlopBTCC   pic twitter com is p SxgeA,,
twitter_hashtag_ToyotaGB,https://twitter.com/ToyotaGB/status/844960445798596608,,10:14 AM - 23 Mar 2017,"['Mud:5', 'Hiluxpic:8']",Mud  glorious mud  #Hiluxpic twitter com ImrMO zF p,,
