twitter_hashtag_ToyotaGB,https://twitter.com/ToyotaGB/status/844932509318205441,,8:23 AM - 23 Mar 2017,['Follow:5'],Follow Toyota on Instagram to go behind the scenes of Mud    #Hiluxpic twitter com JfCGmS PhX,,
twitter_hashtag_ToyotaGB,https://twitter.com/ToyotaGB/status/844897564453416966,,6:04 AM - 23 Mar 2017,['Get:4'],Get the inside story on how Little and Large tackled the UK s toughest off road course   pic twitter com hyukTPeW A,,
twitter_hashtag_ToyotaGB,https://twitter.com/ToyotaGB/status/844869336758071301,,4:12 AM - 23 Mar 2017,['Toyota:0'],Toyota returns as vehicle sponsor to  TeamRaleighGAC cycling team   pic twitter com CFl NSmMee,,
twitter_hashtag_ToyotaGB,https://twitter.com/ToyotaGB/status/844839143528017923,,2:12 AM - 23 Mar 2017,"['Mud:749', 'No:7']",Mud  rain  sleet  snow and gale force winds No problem for the #Hilux twins   pic twitter com b   fVTBh ,,
twitter_hashtag_ToyotaGB,https://twitter.com/ToyotaGB/status/844508741240344576,,4:19 AM - 22 Mar 2017,"['Mud:1', 'Hiluxpic:0']",Mud  glorious mud  #Hiluxpic twitter com si Sh Jldt,,
twitter_hashtag_ToyotaGB,https://twitter.com/ToyotaGB/status/844451858152275968,,12:33 AM - 22 Mar 2017,[],The #Hilux twins take the ultimate mud bath pic twitter com plsUQwPUFW,,
twitter_hashtag_ToyotaGB,https://twitter.com/ToyotaGB/status/844293047844265987,,2:02 PM - 21 Mar 2017,"['Tomorrow:09', 'Hiluxpic:0']",Tomorrow   #Hiluxpic twitter com p  l uz ht,,
twitter_hashtag_ToyotaGB,https://twitter.com/ToyotaGB/status/844271688690909184,,12:37 PM - 21 Mar 2017,['Putting:5'],Putting the Toy in Toyota  #Hiluxpic twitter com bg xOZusFG,,
twitter_hashtag_ToyotaGB,https://twitter.com/ToyotaGB/status/844238977771225088,,10:27 AM - 21 Mar 2017,"['From:1', 'Toyota:5', 'CHR:1']", From the word go the winner was quite clear  #ToyotaCHR wins tough  ParkersNews crossover group test   pic twitter com  hRgBZP W ,,
twitter_hashtag_ToyotaGB,https://twitter.com/ToyotaGB/status/844205221337223168,,8:13 AM - 21 Mar 2017,"['Tamiya:15', 'UK:3', 'One:2', 'Toyota:5']",    TamiyaUK remote control models One     tonne Toyota #Hilux The ultimate pulling challenge pic twitter com S rLTKmiev,,
twitter_hashtag_ToyotaGB,https://twitter.com/ToyotaGB/status/844174514141478912,,6:11 AM - 21 Mar 2017,['Follow:2'],Follow #Toyota on Instagram to go behind the scenes of our latest film    #Hiluxpic twitter com UBHpFaU iK,,
twitter_hashtag_ToyotaGB,https://twitter.com/ToyotaGB/status/844143052780388352,,4:06 AM - 21 Mar 2017,"['Calling:43', 'Here:1', 'Toyota:9', 'GT:6']",Calling all aspiring motor journalists Here s your chance to write for the #Toyota blog   pic twitter com   l aM E C,,
twitter_hashtag_ToyotaGB,https://twitter.com/ToyotaGB/status/844114381814161408,,2:12 AM - 21 Mar 2017,['Meet:6'],Meet the  TamiyaUK stars that pulled a real #Hilux   pic twitter com uKA xkAaTm,,
twitter_hashtag_ToyotaGB,https://twitter.com/ToyotaGB/status/843840593667260417,,8:04 AM - 20 Mar 2017,['Meet:4'],Meet the  TamiyaUK stars that pulled a real #Hilux pic twitter com PcsYBXZDn ,,
twitter_hashtag_ToyotaGB,https://twitter.com/ToyotaGB/status/843811123895836672,,6:07 AM - 20 Mar 2017,['They:1'],They couldn t  could they  #Hiluxpic twitter com RvOvymwB M,,
twitter_hashtag_ToyotaGB,https://twitter.com/ToyotaGB/status/843784388676599808,,4:20 AM - 20 Mar 2017,['Watch:93'],Watch Toyota team up with  TamiyaUK for an awesome achievement  #Hiluxpic twitter com Cw  nCyPmM,,
twitter_hashtag_ToyotaGB,https://twitter.com/ToyotaGB/status/843781450919034880,,4:09 AM - 20 Mar 2017,"['When:1', 'Hiluxpic:0']",When little met large  #Hiluxpic twitter com  FzdJ vrYK,,
twitter_hashtag_ToyotaGB,https://twitter.com/ToyotaGB/status/843554434047266817,,1:07 PM - 19 Mar 2017,['How:86'],How do you get a #GT   ready for  BBC TopGear Find out here   pic twitter com kNKxqTOatu,,
twitter_hashtag_ToyotaGB,https://twitter.com/ToyotaGB/status/843488995732537345,,8:47 AM - 19 Mar 2017,"['When:4', 'Coming:5']",When little met large  Coming soon  #Hiluxpic twitter com XJMF UGnO ,,
twitter_hashtag_ToyotaGB,https://twitter.com/ToyotaGB/status/843450046972596225,,6:12 AM - 19 Mar 2017,['New:5'],New  DunlopBTCC season  new #Avensis  SpeedworksMS are looking good pic twitter com  fAZEIosFT,,
twitter_hashtag_ToyotaGB,https://twitter.com/ToyotaGB/status/843413500936568833,,3:47 AM - 19 Mar 2017,"['Go:4', 'YA:0']",Go find the best driving roads  with some old friends pic twitter com  YA BDKcVN,,
twitter_hashtag_ToyotaGB,https://twitter.com/ToyotaGB/status/843126606013063170,,8:47 AM - 18 Mar 2017,"['EXG:10', 'N:27', 'XVg:6']",   million hybrid sales and counting   pic twitter com   N XVgPXN,,
twitter_hashtag_ToyotaGB,https://twitter.com/ToyotaGB/status/843087633865723904,,6:12 AM - 18 Mar 2017,"['Thoroughbred:5', 'Yaris:1']",Thoroughbred performance  #YarisGRMNpic twitter com zgC GfGX G,,
twitter_hashtag_ToyotaGB,https://twitter.com/ToyotaGB/status/843051112802349056,,3:47 AM - 18 Mar 2017,['Originator:61'],Originator and innovator Five groundbreaking firsts of the new #PriusPlugIn pic twitter com HSsjhf  yS,,
twitter_hashtag_ToyotaGB,https://twitter.com/ToyotaGB/status/842824645078343684,,12:47 PM - 17 Mar 2017,['New:4'],New  DunlopBTCC season  new #Avensis  SpeedworksMS are looking good pic twitter com PWgWNt nkB,,
twitter_hashtag_ToyotaGB,https://twitter.com/ToyotaGB/status/842788432313237505,,10:23 AM - 17 Mar 2017,"['A:9', 'Toyotai:67', 'Trilpic:3']",A glimpse of the future  #ToyotaiTrilpic twitter com E qM  b zw,,
twitter_hashtag_ToyotaGB,https://twitter.com/trent_dan/status/842768331199467522,,9:03 AM - 17 Mar 2017,"['My:86', 'GT:200', 'Toyota:29', 'GB:90']",My response to those who think a GT   can t be fun because it only has    hp   ToyotaGB  BlytonParkDC …,,
twitter_hashtag_ToyotaGB,https://twitter.com/ToyotaGB/status/842755161948852225,,8:11 AM - 17 Mar 2017,"['Happy:9', 'St:2']",Happy #StPatricksDay to all our followers pic twitter com LgvCxzp U ,,
twitter_hashtag_ToyotaGB,https://twitter.com/ToyotaGB/status/842722443399696385,,6:01 AM - 17 Mar 2017,"['Toyota:2', 'Hilux:9', 'Bay:6']",Toyota #Hilux gets stuck in with  BaySARteam   pic twitter com  vRqwXPA b,,
twitter_hashtag_ToyotaGB,https://twitter.com/ToyotaGB/status/842692765477715968,,4:03 AM - 17 Mar 2017,['Style:0'],Style out your #ToyotaCHR   pic twitter com rmB CxTJQg,,
twitter_hashtag_ToyotaGB,https://twitter.com/ToyotaGB/status/842664081563750401,,2:09 AM - 17 Mar 2017,['Better:3'],Better than ever  The new #Yaris   pic twitter com dGKiCWewBF,,
twitter_hashtag_ToyotaGB,https://twitter.com/ToyotaGB/status/842468535980941313,,1:12 PM - 16 Mar 2017,"['An:7', 'EV:1']",An EV unlike any other This is the #ToyotaiTril Concept   pic twitter com nNbfC t TA,,
twitter_hashtag_ToyotaGB,https://twitter.com/ToyotaGB/status/842432062476939264,,10:47 AM - 16 Mar 2017,['Pure:86'],Pure driving pleasure  #GT  pic twitter com aunznqORcr,,
twitter_hashtag_ToyotaGB,https://twitter.com/ToyotaGB/status/842396835746598914,,8:27 AM - 16 Mar 2017,"['More:2', 'Yaris:0', 'GRMNpic:2', 'KBN:6']",More than a simple hot hatch    #YarisGRMNpic twitter com zwh KBN dS,,
twitter_hashtag_ToyotaGB,https://twitter.com/ToyotaGB/status/842362902132719619,,6:12 AM - 16 Mar 2017,"['We:2017', 'Donington:6']",We re at  DoningtonParkUK for the launch of the       DunlopBTCC and  SpeedworksMS #Avensis pic twitter com foBNkn kSw,,
twitter_hashtag_ToyotaGB,https://twitter.com/ToyotaGB/status/842310804888264704,,2:45 AM - 16 Mar 2017,"['Toyota:2', 'UK:18']",Toyota announces new investment in its UK car plant   pic twitter com KIZ  TNHDi,,
twitter_hashtag_ToyotaGB,https://twitter.com/ToyotaGB/status/842104884212064256,,1:07 PM - 15 Mar 2017,"['Originator:6', 'Five:8']",Originator and innovator  Five groundbreaking firsts of the new #PriusPlugIn pic twitter com JOSyX e Zp,,
twitter_hashtag_ToyotaGB,https://twitter.com/ToyotaGB/status/842070586293661700,,10:50 AM - 15 Mar 2017,['BBCTwo:841638062895558656'],ToyotaGB Retweeted BBC Two,,
twitter_hashtag_ToyotaGB,https://twitter.com/ToyotaGB/status/842060119189925889,,10:09 AM - 15 Mar 2017,"['Toyota:2017', 'Yaris:2', 'NP:1', 'Kf:7']",     Toyota #Yaris price and specifications announced   pic twitter com  KfLsxdjb ,,
twitter_hashtag_ToyotaGB,https://twitter.com/ToyotaGB/status/842029879537336320,,8:09 AM - 15 Mar 2017,['Aspiring:8'],Aspiring automotive writers  we want to work with you  Find out why   pic twitter com MtnGYjtnGr,,
twitter_hashtag_ToyotaGB,https://twitter.com/ToyotaGB/status/841999717580083201,,6:09 AM - 15 Mar 2017,"['Perfectly:0', 'Versopic:5']",Perfectly equipped for family adventures  #Versopic twitter com PkgEBw tK ,,
twitter_hashtag_ToyotaGB,https://twitter.com/ToyotaGB/status/841969261031616514,,4:08 AM - 15 Mar 2017,['Practical:9'],Practical and versatile  #Proace pic twitter com Lp vtOWrAq,,
twitter_hashtag_ToyotaGB,https://twitter.com/ToyotaGB/status/841938879938727936,,2:07 AM - 15 Mar 2017,"['All:0', 'Rally:1']",All the action from Rally Mexico   pic twitter com xIXuk zm a,,
twitter_hashtag_ToyotaGB,https://twitter.com/ToyotaGB/status/841727147031031808,,12:06 PM - 14 Mar 2017,[],From roof rack to tech pack  reflect your personality with the new #ToyotaCHR   pic twitter com BKlMzCNTPW,,
twitter_hashtag_ToyotaGB,https://twitter.com/ToyotaGB/status/841703496755871745,,10:32 AM - 14 Mar 2017,['Sophisticated:8'],Sophisticated styling and packed with technology  #Avensispic twitter com CXAb VzYnh,,
twitter_hashtag_ToyotaGB,https://twitter.com/ToyotaGB/status/841673284278190080,,8:32 AM - 14 Mar 2017,['Jamie:05'],Jamie Lee joins the #ToyotaTuesday club with this glorious snap You can join here   pic twitter com   QoBGDvnE,,
twitter_hashtag_ToyotaGB,https://twitter.com/ToyotaGB/status/841645669991497729,,6:42 AM - 14 Mar 2017,"['Here:1', 'Toyota:4']",Here s the best of the rest from Toyota s Geneva motor show   pic twitter com ZuDGvmG zC,,
twitter_hashtag_ToyotaGB,https://twitter.com/ToyotaGB/status/841615459581612032,,4:42 AM - 14 Mar 2017,"['More:9', 'Yaris:66']",More than a simple hot hatch  #YarisGRMN pic twitter com Soz AjUz  ,,
twitter_hashtag_ToyotaGB,https://twitter.com/ToyotaGB/status/841585476465242113,,2:43 AM - 14 Mar 2017,"['Aygo:3', 'Make:0', 'BH:2']",#Aygo  Make it yours   pic twitter com jV YZomH k,,
twitter_hashtag_ToyotaGB,https://twitter.com/ToyotaGB/status/841314714865008640,,8:47 AM - 13 Mar 2017,['What:6'],What happened at  OfficialWRC  RallyMexico Our review has all the details   pic twitter com NDumwekN l,,
twitter_hashtag_ToyotaGB,https://twitter.com/BBC_TopGear/status/841292814923231233,,7:20 AM - 13 Mar 2017,"['Both:5', 'Which:86', 'Mazda:25', 'MX:8', 'RF:309', 'Toyota:0', 'GT:5']",Both reasonably fast and joyously old school  Which is best  Mazda MX   RF vs Toyota GT    a £  k sports car battle  pic twitter com S kCluDl o,,
twitter_hashtag_ToyotaGB,https://twitter.com/ToyotaGB/status/841279475526565891,,6:27 AM - 13 Mar 2017,"['The:14', 'Toyota:8']",The next step in Toyota s EV journey  #ToyotaiTrilpic twitter com SmIyH  Df ,,
twitter_hashtag_ToyotaGB,https://twitter.com/ToyotaGB/status/841239167002632192,,3:47 AM - 13 Mar 2017,"['Aspiring:8', 'Find:2', 'K:0']",Aspiring automotive writers  we want to work with you  Find out why   pic twitter com yM UiH MFb,,
twitter_hashtag_ToyotaGB,https://twitter.com/ToyotaGB/status/841027957263106048,,1:47 PM - 12 Mar 2017,"['That:86', 'Who:7']",That s the way Who do it  We reckon David Tennant has joined the broad church of drivers who have fallen in love with the #GT    #TopGearpic twitter com qcJR FAHbf,,
twitter_hashtag_ToyotaGB,https://twitter.com/ToyotaGB/status/840956776245805065,,9:04 AM - 12 Mar 2017,[],Another tough day  RallyMexico for  TGR WRC   Considering everything  I am happy with how the rally has gone so far     Tommi Mäkinen #WRCpic twitter com WipGiGqnhn,,
twitter_hashtag_ToyotaGB,https://twitter.com/ToyotaGB/status/840904733296480256,,5:38 AM - 12 Mar 2017,"['This:96', 'MO:2']",This is why we race   pic twitter com sgeMO  WD ,,
twitter_hashtag_ToyotaGB,https://twitter.com/ToyotaGB/status/840853906745905154,,1:16 AM - 12 Mar 2017,"['More:2', 'The:95', 'Yaris:79']",More than just a simple hot hatch The #YarisGRMN is coming   pic twitter com  OeX  ID  ,,
twitter_hashtag_ToyotaGB,https://twitter.com/ToyotaGB/status/840589170275962880,,7:44 AM - 11 Mar 2017,['The:6'],The latest action from  TGR WRC at  RallyMexico  #WRCpic twitter com eOf eXxYUh,,
twitter_hashtag_ToyotaGB,https://twitter.com/ToyotaGB/status/840554665045458945,,5:27 AM - 11 Mar 2017,[],This is why we race   pic twitter com qbiMgYtUpL,,
twitter_hashtag_ToyotaGB,https://twitter.com/ToyotaGB/status/840491528795615232,,1:16 AM - 11 Mar 2017,"['The:8', 'Geneva:1', 'Motor:03']",The best of the rest at #GenevaMotorShow   pic twitter com z yUnmm  d,,
twitter_hashtag_ToyotaGB,https://twitter.com/ToyotaGB/status/840287165271724032,,11:44 AM - 10 Mar 2017,"['Introducing:8', 'Yaris:0']",Introducing the #YarisGRMN  A thoroughbred performance model     pic twitter com ufrkvQEaLJ,,
twitter_hashtag_ToyotaGB,https://twitter.com/ToyotaGB/status/840220992052051968,,7:21 AM - 10 Mar 2017,"['The:86', 'What:5']",The first true gravel round of the year has begun  What s in store for Toyota at #RallyMexico     pic twitter com WsPe uuwlj,,
twitter_hashtag_ToyotaGB,https://twitter.com/ToyotaGB/status/840170931507068929,,4:02 AM - 10 Mar 2017,[],Better than ever  The new #Yaris at #ToyotaGeneva   pic twitter com FMmkXTNCKt,,
twitter_hashtag_ToyotaGB,https://twitter.com/ToyotaGB/status/840127106499534848,,1:08 AM - 10 Mar 2017,"['It:1', 'National:2017', 'Apprenticeship:2']",It s National Apprenticeship Week  Want to join the #Toyota family  We have apprenticeships available here    #NAW    pic twitter com gPW GyCULt,,
twitter_hashtag_ToyotaGB,https://twitter.com/ToyotaGB/status/839925533882253312,,11:47 AM - 9 Mar 2017,[],A glimpse of the future    #ToyotaiTrilpic twitter com QzHVRSsqjK,,
twitter_hashtag_ToyotaGB,https://twitter.com/ToyotaGB/status/839889075121360896,,9:22 AM - 9 Mar 2017,"['Originator:5', 'Five:1', 'Prius:5', 'Plug:5']",Originator and innovator Five firsts for the new #PriusPlugIn   pic twitter com TCU S Gwe ,,
twitter_hashtag_ToyotaGB,https://twitter.com/ToyotaGB/status/839858636071526400,,7:21 AM - 9 Mar 2017,"['Everything:6', 'Rally:0']",Everything you need to know about the heat  gravel and high altitudes of  RallyMexico   pic twitter com S zWLSsizq,,
twitter_hashtag_ToyotaGB,https://twitter.com/ToyotaGB/status/839824883941015552,,5:07 AM - 9 Mar 2017,"['More:7', 'Yaris:6']",More than a simple hot hatch  #YarisGRMN   pic twitter com wdNQQLW FK,,
twitter_hashtag_ToyotaGB,https://twitter.com/ToyotaGB/status/839794927458521088,,3:08 AM - 9 Mar 2017,['A:8'],A cut above  #ToyotaCHRpic twitter com FWQm bMJva,,
twitter_hashtag_ToyotaGB,https://twitter.com/ToyotaGB/status/839764710480207872,,1:08 AM - 9 Mar 2017,['Better:856849'],Better than ever The new #Yaris at #ToyotaGeneva   pic twitter com Uk      ss,,
twitter_hashtag_ToyotaGB,https://twitter.com/ToyotaGB/status/839554100379455490,,11:11 AM - 8 Mar 2017,['Toyota:7'],Toyota Gazoo Racing is out in force at #ToyotaGeneva pic twitter com QjHJ IJkTW,,
twitter_hashtag_ToyotaGB,https://twitter.com/ToyotaGB/status/839497710797373441,,7:27 AM - 8 Mar 2017,"['More:0', 'Yaris:2']",More than a simple hot hatch  #YarisGRMNpic twitter com T iRkD DpI,,
twitter_hashtag_ToyotaGB,https://twitter.com/ToyotaGB/status/839446616444715015,,4:04 AM - 8 Mar 2017,"['It:1', 'National:2017', 'Apprenticeship:5', 'Week:2']",It s National Apprenticeship Week  Want to join the #Toyota family  We have apprenticeships available here    #NAW    pic twitter com  OvxqpAOi ,,
twitter_hashtag_ToyotaGB,https://twitter.com/ToyotaGB/status/839402085166776320,,1:07 AM - 8 Mar 2017,['Better:2'],Better than ever The new #Yaris at #ToyotaGeneva   pic twitter com weSvv rYRp,,
twitter_hashtag_ToyotaGB,https://twitter.com/ToyotaGB/status/839190688570949633,,11:07 AM - 7 Mar 2017,"['Better:4', 'The:2']",Better than ever The new #Yaris at #ToyotaGeneva   pic twitter com b BK NTHik,,
twitter_hashtag_ToyotaGB,https://twitter.com/ToyotaGB/status/839167030947430400,,9:33 AM - 7 Mar 2017,['Take:1'],Take a closer look at the #YarisGRMN  Toyota s supercharged hot hatch  #ToyotaGenevapic twitter com  YxjLNMceJ,,
twitter_hashtag_ToyotaGB,https://twitter.com/ToyotaGB/status/839145435306524672,,8:07 AM - 7 Mar 2017,"['An:3', 'EV:1']",An EV unlike any other This is the #ToyotaiTril Concept   pic twitter com mohiQ kv h,,
twitter_hashtag_ToyotaGB,https://twitter.com/ToyotaGB/status/839087431517351936,,4:16 AM - 7 Mar 2017,['More:7'],More than a simple hot hatch  The #YarisGRMN breaks cover at #ToyotaGeneva   pic twitter com f HsTlnBRb,,
twitter_hashtag_ToyotaGB,https://twitter.com/ToyotaGB/status/839039442425905153,,1:06 AM - 7 Mar 2017,['Toyota:0'],#ToyotaGeneva has arrived pic twitter com oTUhhEbDB ,,
twitter_hashtag_ToyotaGB,https://twitter.com/ToyotaGB/status/838767128287272961,,7:04 AM - 6 Mar 2017,['The:58'],The next step in Toyota s EV journey  Tomorrow  #ToyotaiTril #ToyotaGenevapic twitter com   wFQsjsuH,,
twitter_hashtag_ToyotaGB,https://twitter.com/ToyotaGB/status/838721831330795520,,4:04 AM - 6 Mar 2017,"['What:1', 'Toyota:0']",What can you expect from #ToyotaGeneva  Here s our preview   pic twitter com  momaizmPF,,
twitter_hashtag_ToyotaGB,https://twitter.com/ToyotaGB/status/838676039551303680,,1:02 AM - 6 Mar 2017,"['It:1', 'National:2017']",It s National Apprenticeship Week  Want to join the #Toyota family  We have apprenticeships available here    #NAW    pic twitter com SvStzUwQoH,,
twitter_hashtag_ToyotaGB,https://twitter.com/ToyotaGB/status/838490020214423552,,12:42 PM - 5 Mar 2017,['A:86'],A first class effort from James McAvoy as the #GT   storms onto the #TopGear track  Perhaps some snow next time  James pic twitter com GvSfZrPEMj,,
twitter_hashtag_ToyotaGB,https://twitter.com/ToyotaGB/status/838404238371880960,,7:02 AM - 5 Mar 2017,[],Coming soon  The #Yaris hot hatch  Excited pic twitter com JbTPKAvqNh,,
twitter_hashtag_ToyotaGB,https://twitter.com/ToyotaGB/status/838374858258071552,,5:05 AM - 5 Mar 2017,['Smooth:6'],Smooth Quiet  And perfect for families  #Priuspic twitter com duhDYDz QG,,
twitter_hashtag_ToyotaGB,https://twitter.com/ToyotaGB/status/838042352962895873,,7:04 AM - 4 Mar 2017,"['Spotted:0', 'Speedworks:86']",Spotted   SpeedworksMS testing their new  DunlopBTCC#Avensis   pic twitter com G mi  TeFH,,
twitter_hashtag_ToyotaGB,https://twitter.com/ToyotaGB/status/838011464078209024,,5:01 AM - 4 Mar 2017,"['Rugged:4', 'RAV:526']",Rugged build and driver appeal  #RAV pic twitter com RtcqIbR   ,,
twitter_hashtag_ToyotaGB,https://twitter.com/ToyotaGB/status/837982458213777408,,3:06 AM - 4 Mar 2017,['Toyota:2'],#ToyotaCHR awarded  Euro NCAP safety rating   pic twitter com UVdIQ BJnj,,
twitter_hashtag_ToyotaGB,https://twitter.com/ToyotaGB/status/837771083994521600,,1:06 PM - 3 Mar 2017,"['New:2017', 'Dunlop:3', 'BTCC:36', 'Avensis:2']",New       DunlopBTCC #Avensis spied testing   pic twitter com iIW  s ZvJ,,
twitter_hashtag_ToyotaGB,https://twitter.com/ToyotaGB/status/837740887832690689,,11:06 AM - 3 Mar 2017,"['Unlimited:86', 'GT:6', 'L:9', 'Kci:8']",Unlimited smiles per gallon  #GT  pic twitter com  hL oaKci ,,
twitter_hashtag_ToyotaGB,https://twitter.com/ToyotaGB/status/837710676604903424,,9:06 AM - 3 Mar 2017,"['Watch:8', 'Toyota:8']",Watch as Toyota Japan takes #ToyotaCHR on a tour of the  StreetFighter universe   pic twitter com JPrA K uoW,,
twitter_hashtag_ToyotaGB,https://twitter.com/ToyotaGB/status/837655158142222339,,5:25 AM - 3 Mar 2017,[],Ready to tackle the harshest conditions  #Hiluxpic twitter com fUdwCYuHPt,,
twitter_hashtag_ToyotaGB,https://twitter.com/ToyotaGB/status/837630387610337280,,3:47 AM - 3 Mar 2017,['A:0'],A sneak peek at what s coming up at the Geneva Motor Show   pic twitter com GdOFWvM Ox,,
twitter_hashtag_ToyotaGB,https://twitter.com/ToyotaGB/status/837593771042811907,,1:21 AM - 3 Mar 2017,"['A:8', 'Toyota:12']",A cut above  #ToyotaCHRpic twitter com NNrD g  Ki,,
twitter_hashtag_ToyotaGB,https://twitter.com/ToyotaGB/status/837408693792739333,,1:06 PM - 2 Mar 2017,"['New:2017', 'Dunlop:5', 'BTCC:21', 'Avensis:6']",New       DunlopBTCC #Avensis spied testing   pic twitter com  h  D WFNr,,
twitter_hashtag_ToyotaGB,https://twitter.com/ToyotaGB/status/837378486327263237,,11:06 AM - 2 Mar 2017,[],A pioneering award winner  Let the #Prius surprise you   pic twitter com yKQMulwdGb,,
twitter_hashtag_ToyotaGB,https://twitter.com/ToyotaGB/status/837352315707396096,,9:22 AM - 2 Mar 2017,"['Watch:1', 'Toyota:9']",Watch as Toyota Japan takes #ToyotaCHR on a tour of the  StreetFighter universe   pic twitter com WoN wr rPY,,
twitter_hashtag_ToyotaGB,https://twitter.com/ToyotaGB/status/837298308007723009,,5:47 AM - 2 Mar 2017,[],Dynamic and beautifully designed  #Aurispic twitter com NMWPFhGwgr,,
twitter_hashtag_ToyotaGB,https://twitter.com/ToyotaGB/status/837263062348546048,,3:27 AM - 2 Mar 2017,"['Show:5', 'Aygo:5']",Show off your personality with #Aygo x press   pic twitter com jKLbR nbIW,,
twitter_hashtag_ToyotaGB,https://twitter.com/ToyotaGB/status/837231259143323649,,1:21 AM - 2 Mar 2017,['Five:1'],Five stars for #ToyotaCHR in Euro NCAP tests   pic twitter com YWqJiIfOzj,,
twitter_hashtag_ToyotaGB,https://twitter.com/ToyotaGB/status/837015103753052160,,11:02 AM - 1 Mar 2017,"['Hilux:3', 'Tiggywinkles:5', 'UK:5']",#Hilux to the rescue with  TiggywinklesUK wildlife hospital   pic twitter com hLE feaEz ,,
twitter_hashtag_ToyotaGB,https://twitter.com/ToyotaGB/status/836986714396766210,,9:09 AM - 1 Mar 2017,[],Eye catching  wallet friendly  #Aurispic twitter com TDJoHlqoym,,
twitter_hashtag_ToyotaGB,https://twitter.com/SnowsToyota/status/836980282200846336,,8:43 AM - 1 Mar 2017,"['Check:10', 'Simon:1', 'Pain:17', 'Toyota:7', 'Kevin:9']",Check out Simon Pain collecting his   th #Toyota from Kevin Hammond in #Exeter  The second picture was his  st  #NewCar #  Regpic twitter com M HX jdGfb,,
twitter_hashtag_ToyotaGB,https://twitter.com/ToyotaGB/status/836955693592760322,,7:06 AM - 1 Mar 2017,"['Introducing:4', 'St:8']",Introducing the #StDavidsDay Limited Edition #Aygo  Dydd Gŵyl Dewi Hapus pic twitter com Y N YjbSeo,,
twitter_hashtag_ToyotaGB,https://twitter.com/ToyotaGB/status/836935560195375110,,5:46 AM - 1 Mar 2017,['Safety:2'],Safety in style #ToyotaCHR awarded  Euro NCAP rating   pic twitter com bB RAPTcNz,,
twitter_hashtag_ToyotaGB,https://twitter.com/ToyotaGB/status/836897875946844161,,3:16 AM - 1 Mar 2017,['Want:0'],Want to join the #ToyotaTuesday club  Share a snap of your Toyota with us pic twitter com BUvzZVzdM ,,
twitter_hashtag_ToyotaGB,https://twitter.com/ToyotaGB/status/836873928773632000,,1:41 AM - 1 Mar 2017,"['Made:4', 'RAV:7', 'Alh:2']",Made for go anywhere adventures  #RAV pic twitter com  Alh szVjX,,
twitter_hashtag_ToyotaGB,https://twitter.com/ToyotaGB/status/836652957298896896,,11:03 AM - 28 Feb 2017,"['Fun:1', 'Pancake:8']",Fun and yum   our #PancakeDay Edition #Aygo is the perfect treat pic twitter com cro FDXss ,,
twitter_hashtag_ToyotaGB,https://twitter.com/ToyotaGB/status/836596072445181953,,7:17 AM - 28 Feb 2017,"['We:86', 'Pancake:4', 'Day:4', 'GT:0', 'EN:5']",We ve created the ultimate #PancakeDay race machine – the #GT   pic twitter com EN V cn E ,,
twitter_hashtag_ToyotaGB,https://twitter.com/ToyotaGB/status/836515551006568448,,1:57 AM - 28 Feb 2017,['The:3'],The famous Toyota logo gets the #PancakeDay treatment thanks to  drdancake pic twitter com dlqj wOpAW,,
twitter_hashtag_ToyotaGB,https://twitter.com/ToyotaGB/status/836233698903216128,,7:17 AM - 27 Feb 2017,"['Happy:1967', 'Anniversary:2017', 'GT:50', 'Im:2000', 'Vk:0', 'K:88']",           Happy   th Anniversary #    GT pic twitter com u ImVkK  V,,
twitter_hashtag_ToyotaGB,https://twitter.com/ToyotaGB/status/836202232030846977,,5:12 AM - 27 Feb 2017,['Hot:3'],Hot Yaris to debut at Geneva motor show More here   pic twitter com aSbd jDprj,,
twitter_hashtag_ToyotaGB,https://twitter.com/ToyotaGB/status/836170519225450496,,3:06 AM - 27 Feb 2017,"['Outstanding:2017', 'Toyota:84', 'Prius:80']",Outstanding ‘firsts’ of the      Toyota #PriusPlugin   pic twitter com zkt  wKv  ,,
twitter_hashtag_ToyotaGB,https://twitter.com/ToyotaGB/status/835880379752013824,,7:53 AM - 26 Feb 2017,"['What:2017', 'Toyota:7']",What does Toyota have in store for #GenevaMotorShow          pic twitter com OaVtoplWxn,,
twitter_hashtag_ToyotaGB,https://twitter.com/ToyotaGB/status/835839107188330496,,5:09 AM - 26 Feb 2017,"['Still:38', 'Land:6', 'Cruiserpic:9']",Still unrivalled  #LandCruiserpic twitter com   iyb sz H,,
twitter_hashtag_ToyotaGB,https://twitter.com/ToyotaGB/status/835801617073061888,,2:40 AM - 26 Feb 2017,"['The:0', 'Toyota:2000', 'QDj:9', 'GTpic:3', 'VYw:7']",The million dollar Toyota    #    GTpic twitter com VYw f pXU ,,
twitter_hashtag_ToyotaGB,https://twitter.com/ToyotaGB/status/835522036021747712,,8:09 AM - 25 Feb 2017,['A:786'], A technological tour de force  #PriusPlugin is making waves   pic twitter com OaDQEYGnIZ,,
twitter_hashtag_ToyotaGB,https://twitter.com/ToyotaGB/status/835476213334478849,,5:07 AM - 25 Feb 2017,"['Just:86', 'GT:8']",Just you and the open road  #GT  pic twitter com kB jQUpAjb,,
twitter_hashtag_ToyotaGB,https://twitter.com/ToyotaGB/status/835436974110552065,,2:31 AM - 25 Feb 2017,"['Built:1972', 'This:7']",Built in      and still going strong This is a stunning #BarnFind   pic twitter com KvgPBUSrtl,,
twitter_hashtag_ToyotaGB,https://twitter.com/ToyotaGB/status/835202960799956992,,11:01 AM - 24 Feb 2017,"['Sharp:86', 'GT:5']",Sharp handling and sharp looks  #GT  pic twitter com  TaaxZMBZt,,
twitter_hashtag_ToyotaGB,https://twitter.com/ToyotaGB/status/835185324561137664,,9:51 AM - 24 Feb 2017,"['Power:3', 'Prius:3']",Power your #PriusPlugin at home for free with Chargemaster   pic twitter com aQmuq W fy,,
