twitter_hashtag_maruti_corp,https://twitter.com/Maruti_Corp/status/879175330514087936,,8:11 PM - 25 Jun 2017,"['This:4', 'Eid:3']",This Eid  let all that is good within you shine bright    light up lives around you with kindness   compassion  Wishing you a magical Eid pic twitter com Tcwpm GL Y,,
twitter_hashtag_maruti_corp,https://twitter.com/Maruti_Corp/status/876343713026289664,,12:39 AM - 18 Jun 2017,[],They are strong   dependable They are our heroes without a cape This father’s day  lets take a minute to thank them with a #ThankYouDad pic twitter com ystRuBFfyL,,
twitter_hashtag_maruti_corp,https://twitter.com/Maruti_Corp/status/873066213475106816,,11:36 PM - 8 Jun 2017,"['The:6', 'Maruti:7', 'Suzuki:0', 'Colors:9']",The participants of Maruti Suzuki #ColorsOfYouth Season   have reached their final destination  Delhi  Tune in at   PM tonight on  MTVIndiapic twitter com  xGLLgq vg,,
twitter_hashtag_maruti_corp,https://twitter.com/Maruti_Corp/status/871691240944873472,,4:32 AM - 5 Jun 2017,"['Maruti:6', 'Suzuki:7', 'Colors:7', 'Of:0']",Maruti Suzuki #ColorsOfYouth Season  ’s final episode airs this Friday   PM  Watch  LaurenGottlieb    Benny Dayal prep up our participants pic twitter com Yh VR FhFw,,
twitter_hashtag_maruti_corp,https://twitter.com/Maruti_Corp/status/871297937757818880,,2:29 AM - 4 Jun 2017,"['Waste:7', 'Wealth:85']",‘Waste to Wealth’ is truly an opportunity for all of us  It is time we learn more about #WasteManagement    PMOIndia #WorldEnvironmentDay pic twitter com ZBQ taxB  ,,
twitter_hashtag_maruti_corp,https://twitter.com/Maruti_Corp/status/871238784725032960,,10:34 PM - 3 Jun 2017,"['Didyouknow:95', 'Maruti:7']",#Didyouknow     of electricity consumed at #MarutiSuzuki factory is from clean fuels like natural gas and solar #WorldEnvironmentDaypic twitter com n drnCKxKh,,
twitter_hashtag_maruti_corp,https://twitter.com/Maruti_Corp/status/870205511370592256,,2:08 AM - 1 Jun 2017,"['Maruti:6', 'Suzuki:7', 'Colors:4', 'Of:6']",Maruti Suzuki #ColorsOfYouth Season   has reached its last stretch  Watch our finalists battle it out for their #FirstChance on Friday   PM pic twitter com zvQHf Q ch,,
twitter_hashtag_maruti_corp,https://twitter.com/_vikramch/status/867969726625890305,,10:04 PM - 25 May 2017,['Maruti:686179'], Maruti Corp #NewDzire review  India s best compact sedan has turned even better #Dzire … via  FinancialXpress,,
twitter_hashtag_maruti_corp,https://twitter.com/ArvindKejriwal/status/867687091492106240,,3:21 AM - 25 May 2017,"['Many:2', 'Del:867680853983322113']",Arvind Kejriwal Retweeted AAP Express  🇮🇳,,
twitter_hashtag_maruti_corp,https://twitter.com/ShantonilNag/status/867729457984847872,,6:09 AM - 25 May 2017,['The:91'],The #NewDzire looks exceptionally well  More pics and review coming soon   Maruti Corppic twitter com vDQKEpug  ,,
twitter_hashtag_maruti_corp,https://twitter.com/Maruti_Corp/status/867722654202986496,,5:42 AM - 25 May 2017,"['Maruti:15', 'Suzuki:17', 'Automobile:2', 'Aug:03', 'Skill:7']",Maruti Suzuki to start    new Automobile skill enhancement centres by Aug’    #SkillIndia   ,,
twitter_hashtag_maruti_corp,https://twitter.com/Maruti_Corp/status/867716112770781185,,5:16 AM - 25 May 2017,"['Happy:7', 'ASEC:0']",Happy and enthusiastic faces at the new ASEC  ITI Nizamuddin  #Skillindiapic twitter com g hd pJcWn,,
twitter_hashtag_maruti_corp,https://twitter.com/Maruti_Corp/status/867712291034222593,,5:01 AM - 25 May 2017,"['By:30', 'ITIs:000', 'Mr:5', 'Ayukawa:58']", By partnering with ITIs we want to skill        youth  for workshop jobs in next   years” – Mr  Ayukawa  MD   CEO of #MarutiSuzukipic twitter com k  yCOQuqF,,
twitter_hashtag_maruti_corp,https://twitter.com/Maruti_Corp/status/867709798485065728,,4:51 AM - 25 May 2017,"['Students:9', 'ITI:6']",Students at #ITI Nizamuddin are all set to make a career in the growing automobile industry #SkillIndiapic twitter com pce GP LDf,,
twitter_hashtag_maruti_corp,https://twitter.com/Maruti_Corp/status/867707676385345537,,4:43 AM - 25 May 2017,['State:89'],State of the art workshop to ensure students get the best learning and exposure in car service  #SkillIndiapic twitter com KZPZdxjd  ,,
twitter_hashtag_maruti_corp,https://twitter.com/Maruti_Corp/status/867705661160800257,,4:35 AM - 25 May 2017,"['New:5', 'That:3']",New courses for bigger opportunities  That’s what #ITI Nizamuddin has to offer this year  #SkiIlIndiapic twitter com  sB iOxppX,,
twitter_hashtag_maruti_corp,https://twitter.com/Maruti_Corp/status/867703872864698369,,4:28 AM - 25 May 2017,['A:9'],A new beginning for many begins today at #ITI Nizamuddin  #SkillIndiapic twitter com XHS hYvphE,,
twitter_hashtag_maruti_corp,https://twitter.com/Maruti_Corp/status/867700260881088512,,4:13 AM - 25 May 2017,['Here:36'],Here’s a glimpse of the ASEC   #ITI Nizamuddin for India’s next generation  #SkillIndiapic twitter com YeUBQct  u,,
twitter_hashtag_maruti_corp,https://twitter.com/Maruti_Corp/status/867696657046962176,,3:59 AM - 25 May 2017,"['The:1', 'Mr:25', 'Ayukawa:5', 'MD:9', 'CEO:4']", The industry will be ready to employ      lakh skilled technicians in the next   yrs ” – Mr  Ayukawa  MD   CEO of #MarutiSuzukipic twitter com VYaBCp s a,,
twitter_hashtag_maruti_corp,https://twitter.com/Maruti_Corp/status/867690608902545408,,3:35 AM - 25 May 2017,['Mr:0'],  msisodia   Mr Ayukawa  MD   CEO #MarutiSuzuki inaugurate Automobile Skill Enhancement Centre   #ITI Nizamuddin #SkillIndiapic twitter com lOVsB CuVh,,
twitter_hashtag_maruti_corp,https://twitter.com/Maruti_Corp/status/867668362033221632,,2:07 AM - 25 May 2017,[],Excitement   curiosity sets in as students at #ITI Nizamuddin gear up for a new beginning  #SkillIndiapic twitter com WuykDMSzba,,
twitter_hashtag_maruti_corp,https://twitter.com/Maruti_Corp/status/867659188926791681,,1:30 AM - 25 May 2017,"['Students:0', 'ITIs:6']",Students get hands on experience with the latest technology   tools  at our tie up #ITIs  Stay tuned  #SkillIndiapic twitter com HZmzs mP y,,
twitter_hashtag_maruti_corp,https://twitter.com/VikramGour/status/867656311965708288,,1:19 AM - 25 May 2017,['How:9'],How stunning is that  #NewDzire looks good  drives   handles really well   takes the compact sedan game to a new level   Maruti Corppic twitter com ZylQwH vFr,,
twitter_hashtag_maruti_corp,https://twitter.com/Maruti_Corp/status/867654466534866945,,1:11 AM - 25 May 2017,[],Stay tuned  as we gear up to inaugurate a brand new skill centre in Delhi  And #Empowering youth through skill development  #SkillIndia,,
twitter_hashtag_maruti_corp,https://twitter.com/mishramugdha/status/867621047322857473,,10:59 PM - 24 May 2017,"['Maruti:1800', 'Corp:2', 'Dzire:0']", Maruti Corp  a new #Dzire has distinct looks and is definitely a crowd pleaser  Getting      bookings day  CNBC Awaazpic twitter com tK SIGDy Q,,
twitter_hashtag_maruti_corp,https://twitter.com/siddynagvekar/status/867621444267671552,,11:00 PM - 24 May 2017,['Maruti:2017'], Maruti Corp #NewDZire posing for a shot   riteshmadhok  motorworldindia  marutidzire Review     …pic twitter com vcSFzgMHVu,,
twitter_hashtag_maruti_corp,https://twitter.com/mishramugdha/status/867622080904257536,,11:03 PM - 24 May 2017,['Interiors:128'],Interiors of  Maruti Corp #Dzire are roomy  look premium   have a lot of features  catch the full review on  CNBC Awaaz Overdrive this Sat pic twitter com QOWXly   q,,
twitter_hashtag_maruti_corp,https://twitter.com/flywheelupdates/status/867624820569063424,,11:14 PM - 24 May 2017,"['Maruti:2', 'Corp:8', 'New:2']", Maruti Corp #NewDzire diesel review      marutidzirepic twitter com tGTDs qrHF,,
twitter_hashtag_maruti_corp,https://twitter.com/MotorOctane/status/867629647604875266,,11:33 PM - 24 May 2017,"['Maruti:2017', 'Corp:27195', 'DZire:2018', 'Review:6']", Maruti Corp DZire      Review   with Video  …pic twitter com DZ gqdQxtv,,
twitter_hashtag_maruti_corp,https://twitter.com/CarWale/status/867629976790618112,,11:34 PM - 24 May 2017,"['Here:2', 'First:1', 'Drive:7', 'Review:7']",Here is our #FirstDriveReview of the  Maruti Corp #Dzire Diesel   pic twitter com V PtAkk PS,,
twitter_hashtag_maruti_corp,https://twitter.com/Maruti_Corp/status/867619630436671488,,10:53 PM - 24 May 2017,"['Did:6000', 'You:82', 'Know:79']",#DidYouKnow Every year      students find gainful employment under our #SkillDevelopment initiative  #SkillIndiapic twitter com cx  Hno  w,,
twitter_hashtag_maruti_corp,https://twitter.com/SomChaterji/status/867609834295656448,,10:14 PM - 24 May 2017,"['Maruti:8', 'Corp:3']",overall there are no weaknesses and the most imp product from  Maruti Corp also turns out to be one of their best #NewDzirepic twitter com s qpB AUpJ,,
twitter_hashtag_maruti_corp,https://twitter.com/CyrusDhabhar/status/867609949198831617,,10:15 PM - 24 May 2017,"['The:5', 'New:98', 'Dzire:2']",The #NewDzire gets a   speed manual   AMT Automated Manual Transmission AGS  Auto Gear Shift  option   Maruti Corp  pic twitter com   av KRynP,,
twitter_hashtag_maruti_corp,https://twitter.com/riteshmadhok/status/867610129767596032,,10:15 PM - 24 May 2017,['New:2017'],#NewDzire extensive #roadtest #review  right here  …  Maruti Corp  marutidzire  Maruti suzuki  siddynagvekar,,
twitter_hashtag_maruti_corp,https://twitter.com/_vikramch/status/867614597913624576,,10:33 PM - 24 May 2017,['Maruti:43'], Maruti Corp #NewDzire looks spectacular  to say the least  It makes the  church look good  it makes the sea look good #Dzirepic twitter com roL  wmsLt,,
twitter_hashtag_maruti_corp,https://twitter.com/rev_ved/status/867617366028439552,,10:44 PM - 24 May 2017,"['Our:4', 'Maruti:9', 'Corp:1']",Our man  d arup has driven the new  Maruti Corp #DZire  Here s his take  pic twitter com L T r GCdJ,,
twitter_hashtag_maruti_corp,https://twitter.com/motorworldindia/status/867611225693200384,,10:20 PM - 24 May 2017,['New:2017'],#NewDzire extensive #roadtest #review right here  …  Maruti Corp  Maruti suzuki  marutidzire  maruti,,
twitter_hashtag_maruti_corp,https://twitter.com/SomChaterji/status/867608960810967041,,10:11 PM - 24 May 2017,"['Rear:552', 'Maruti:6']",Rear seat impressed me  more comfort  longer wheelbase afford more room  airy feeling cabin  rear ac vents too  #newdzire  Maruti Corppic twitter com VF   auo k,,
twitter_hashtag_maruti_corp,https://twitter.com/CyrusDhabhar/status/867608377777684481,,10:08 PM - 24 May 2017,[],Here are some detailed pictures of the interior on the new  Maruti Corp  marutidzire  For more  click here    pic twitter com NqPoVFMFbc,,
twitter_hashtag_maruti_corp,https://twitter.com/carblogindia/status/867606936937783296,,10:03 PM - 24 May 2017,"['Here:0', 'New:0']",Here s a quick look at the #NewDzire#VIDEO #Dzire  Maruti Corp …,,
twitter_hashtag_maruti_corp,https://twitter.com/ameyavroom/status/867603995258257408,,9:51 PM - 24 May 2017,"['We:29213', 'Maruti:5', 'Corp:0']",We have just driven the much awaited new  Maruti Corp #Dzire Click on the link below to read our review  CarWale …pic twitter com f wio veEH,,
twitter_hashtag_maruti_corp,https://twitter.com/CyrusDhabhar/status/867604592879710208,,9:53 PM - 24 May 2017,['Here:6'],Here is our detailed review on the new  Maruti Corp  marutidzire  Quite a power packed package this now is  #NewDzirepic twitter com xtphQBehR ,,
twitter_hashtag_maruti_corp,https://twitter.com/SomChaterji/status/867602613235208192,,9:45 PM - 24 May 2017,['Petrol:8'],Petrol is smooth and offers excellent refinement  diesel now much improved too  another area  Maruti Corp has worked is the ride #Dzirepic twitter com FEe bjtgqC,,
twitter_hashtag_maruti_corp,https://twitter.com/SomChaterji/status/867601471193219072,,9:41 PM - 24 May 2017,"['Interiors:0', 'Dzire:6']",Interiors hugely improved with a big jump in quality and design  rear more spacious #Dzire  Maruti Corp #Maruti #newdzirepic twitter com oi tDF eBQ,,
twitter_hashtag_maruti_corp,https://twitter.com/Maruti_Corp/status/865547968501301248,,5:41 AM - 19 May 2017,"['Maruti:6', 'Suzuki:7', 'Colors:0', 'Of:6']",Maruti Suzuki #ColorsOfYouth Season  ’s third episode airs tonight  Tune into  MTVIndia at   PM   watch us give them their #FirstChance pic twitter com cwqrz lAR ,,
twitter_hashtag_maruti_corp,https://twitter.com/CNBCTV18Live/status/865067789479837697,,9:53 PM - 17 May 2017,"['CNBCTV:18', 'Exclusive:4', 'Maruti:0', 'Corp:4', 'RC:0']",#CNBCTV  Exclusive   Maruti Corp s RC Bhargava Feels Sub   metre Cars Will Dominate The Indian Market Going Aheadpic twitter com lc dQu Ba ,,
twitter_hashtag_maruti_corp,https://twitter.com/sidpatankar/status/865091679702859777,,11:28 PM - 17 May 2017,['In:12'],In conversation with  Maruti Corp MD Kenichi Ayukawa  at   pm on  NDTVProfit  SVP #NowPlaying #Dzire #Maruti  carandbike,,
twitter_hashtag_maruti_corp,https://twitter.com/Maruti_Corp/status/864369712112705537,,11:39 PM - 15 May 2017,"['The:4', 'Tune:3', 'LIVE:7']",The stage is set  Tune in with us  marutidzire today  for a whole new world of elegance and class and witness the launch LIVE  #NewDzirepic twitter com k Q bWQ od,,
twitter_hashtag_maruti_corp,https://twitter.com/CarWale/status/862965494088736769,,2:39 AM - 12 May 2017,"['India:0', 'Dzirable:8']",India s most Dzirable #sedan taking shape  Enjoy the pictures from the #ManesarPlant  #NewDzire  Maruti Corppic twitter com wXQ m fLjP,,
twitter_hashtag_maruti_corp,https://twitter.com/Maruti_Corp/status/862607804074344448,,2:58 AM - 11 May 2017,"['New:6', 'Promo:7', 'Alert:2', 'Want:6', 'Maruti:2']",#NewPromoAlert Want to know who all made it to the final round of Maruti Suzuki #ColorsOfYouth Season    Tune into  MTVIndia tomorrow at  PMpic twitter com Ar o n Pku,,
twitter_hashtag_maruti_corp,https://twitter.com/Maruti_Corp/status/860476337294888961,,5:48 AM - 5 May 2017,"['Catch:6', 'Maruti:7', 'Suzuki:8']",Catch Maruti Suzuki #ColorsOfYouth Season   on  MTVIndia every Friday  PM  starting today   find out who made the most of their #FirstChancepic twitter com LEjHWBr yC,,
twitter_hashtag_maruti_corp,https://twitter.com/sidpatankar/status/860458224620720128,,4:36 AM - 5 May 2017,[],Talking safety with  Maruti Corp s R D boss C V Raman  Tonight on Motorheads  Very insightful conversation  Don t miss it    SVPpic twitter com YUOxGPTKkT,,
twitter_hashtag_maruti_corp,https://twitter.com/Maruti_Corp/status/857923616184381443,,4:45 AM - 28 Apr 2017,['Thank:6'],Thank you  UN  UNinIndia  Your visit to Bas Hariya Village Manesar  inspires us to strengthen our efforts in setting up more model villages pic twitter com LjOuy KQwK,,
twitter_hashtag_maruti_corp,https://twitter.com/sidpatankar/status/856523402735099904,,8:01 AM - 24 Apr 2017,[],The new Maruti Suzuki #Dzire will no doubt be a blockbuster  But is it also now the prettiest  Mirror mirror on the wall    SVP  carandbike,,
twitter_hashtag_maruti_corp,https://twitter.com/carandbike/status/857180514331111429,,3:32 AM - 26 Apr 2017,"['Here:9', 'India:1684839']",Here are some milestones in the popular  marutidzire s journey in India  …,,
twitter_hashtag_maruti_corp,https://twitter.com/autoXmag/status/857147880242655238,,1:22 AM - 26 Apr 2017,"['Here:3', 'Maruti:2']",Here is a detailed look at the new  rd gen  Maruti Corp  marutidzire in pictures       pic twitter com VxfcnPoyFQ,,
twitter_hashtag_maruti_corp,https://twitter.com/CarWale/status/856747237719678976,,10:50 PM - 24 Apr 2017,['Enjoy:2'],Enjoy the #PhotoGallery of the  Maruti Corp #Dzire   pic twitter com IoSmtqMKhI,,
twitter_hashtag_maruti_corp,https://twitter.com/AutoTechReview1/status/856749349812015104,,10:58 PM - 24 Apr 2017,"['Maruti:2017', 'Suzuki:57']",Maruti Suzuki previews upcoming #Dzire compact sedan  to be launched in May         Maruti Corp Read   pic twitter com hxWAVKWLjw,,
twitter_hashtag_maruti_corp,https://twitter.com/autoportalindia/status/856502202063437824,,6:36 AM - 24 Apr 2017,['Isn:8'],Isn t the all new  Maruti Corp #Dzire more dezirable  It is indeed  pic twitter com Z KPygvYYa,,
twitter_hashtag_maruti_corp,https://twitter.com/BhutaniChetan/status/856478985324122112,,5:04 AM - 24 Apr 2017,"['New:16', 'Maruti:9']",New  Maruti Corp Dzire to be launched on May      BTVIpic twitter com vf fjJMILC,,
twitter_hashtag_maruti_corp,https://twitter.com/ShantonilNag/status/856495013504495617,,6:08 AM - 24 Apr 2017,"['The:4', 'DZire:6']",The all new #DZire looks much more desirable   Maruti Corp  CarToqpic twitter com  lyQhgdb h,,
twitter_hashtag_maruti_corp,https://twitter.com/carblogindia/status/856495565613543425,,6:10 AM - 24 Apr 2017,"['Maruti:16', 'Corp:2017', 'Dzire:0']", Maruti Corp unveils all new #Dzire  Launch on May     More images coming your way so stay tuned …pic twitter com hld vFPCnu,,
twitter_hashtag_maruti_corp,https://twitter.com/sidpatankar/status/856478141371437056,,5:01 AM - 24 Apr 2017,"['First:5', 'Dzire:2', 'SVP:1']",First look at the new #Dzire on video  SVP  carandbike  marutidzire  Maruti Corppic twitter com Zf Ix oI i,,
twitter_hashtag_maruti_corp,https://twitter.com/htTweets/status/856476212004134912,,4:53 AM - 24 Apr 2017,"['PHOTOS:16', 'New:1']",#PHOTOS   New  Maruti Corp  marutidzire unveiled  launch on May      GulshanMWankar reportspic twitter com iTxvTTZVNY,,
twitter_hashtag_maruti_corp,https://twitter.com/Motoroids_India/status/856473800585519104,,4:44 AM - 24 Apr 2017,"['The:16', 'Maruti:2017', 'Corp:34']",The  Maruti Corp  marutidzire will be launched in India on May          #AllNewDzirepic twitter com frPJt  ErO,,
twitter_hashtag_maruti_corp,https://twitter.com/Motoroids_India/status/856474475176484864,,4:46 AM - 24 Apr 2017,['Here:2'],Here is the side profile of the  Maruti Corp  marutidzire #AllNewDzirepic twitter com sxFacFoHi ,,
twitter_hashtag_maruti_corp,https://twitter.com/MyMotoringWorld/status/856472835111489537,,4:40 AM - 24 Apr 2017,"['That:16', 'Dzire:3', 'To:9']",That s the new Dzire for you  To be launched on May      Maruti Corppic twitter com  rpYwBVS Q,,
twitter_hashtag_maruti_corp,https://twitter.com/odmag/status/856466317439664129,,4:14 AM - 24 Apr 2017,"['Here:2017', 'Image:7', 'Gallery:91']",Here s our #ImageGallery the all new      Maruti Suzuki #Dzire    pic twitter com kxYPancR  ,,
twitter_hashtag_maruti_corp,https://twitter.com/TopGearMagIndia/status/856462917021073408,,4:00 AM - 24 Apr 2017,"['Intention:1', 'DZire:0']",Intention with the new #DZire was to make it wider and more imposing  Added width has freed up more room on the inside  Maruti Corppic twitter com fXF fb ggp,,
twitter_hashtag_maruti_corp,https://twitter.com/carandbike/status/856464609108267008,,4:07 AM - 24 Apr 2017,['Presenting:3'],Presenting the all new  rd generation  Maruti Corp #Dzire  First impression  More upmarket  better proportioned and well kitted out pic twitter com mDcAhMmcjR,,
twitter_hashtag_maruti_corp,https://twitter.com/odmag/status/855670210132443136,,11:30 PM - 21 Apr 2017,"['New:2017', 'Maruti:2017', 'Corp:3']",New gen  Maruti Corp #Dzire to make global debut in India in May       Details here  …pic twitter com uzrFDVZtM ,,
twitter_hashtag_maruti_corp,https://twitter.com/Maruti_Corp/status/855639662198611969,,9:29 PM - 21 Apr 2017,['This:6'],This weekend  indulge your taste buds with ‘Indo Japanese’ grub at #MSBrakingPoint  Grub Fest Chandigarh pic twitter com kcamcFTa Q,,
twitter_hashtag_maruti_corp,https://twitter.com/adiljal/status/855373142293872645,,3:50 AM - 21 Apr 2017,['First:2'],First sketch of next gen  marutidzire released   hints of being easy n pleasureable to the eye   evoIndiapic twitter com sbxnxhu WL,,
twitter_hashtag_maruti_corp,https://twitter.com/sidpatankar/status/855369704663269377,,3:36 AM - 21 Apr 2017,"['Looks:2', 'Maruti:4']",Looks like Maruti has officially dropped the  Swift  name from  marutidzire  Has released this  sketch  and confirmed May launch  SVP #Dzirepic twitter com yNG tC jho,,
twitter_hashtag_maruti_corp,https://twitter.com/Alto_800/status/851378755822137344,,3:18 AM - 10 Apr 2017,['Maruti:13'],#MarutiSuzuki #Alto continues to dominate the bestselling car category for    years in a row  Read full story  …,,
twitter_hashtag_maruti_corp,https://twitter.com/BTVI/status/847765440663363584,,4:00 AM - 31 Mar 2017,"['Kenichi:697', 'Ayukawa:4']",Kenichi Ayukawa  MD   CEO of  Maruti Corp  promises to work towards a better environment for the people  #MissionNoEmission #BTVipic twitter com    wFm WIG,,
twitter_hashtag_maruti_corp,https://twitter.com/CNBCTV18News/status/847411953668562948,,4:35 AM - 30 Mar 2017,"['More:18', 'Power:847399133916807170']",CNBC TV   News Retweeted CNBC TV   News,,
twitter_hashtag_maruti_corp,https://twitter.com/MTVIndia/status/846970586077237249,,11:21 PM - 28 Mar 2017,"['Here:2017', 'Saarang:2']",Here’s a sneak peek into the college festival  Saarang       at Indian Institute of Technology  Madras  Maruti corppic twitter com mZTIrBQVE ,,
twitter_hashtag_maruti_corp,https://twitter.com/bsindia/status/845640897320620037,,7:17 AM - 25 Mar 2017,['Star:3'],Star MNC of the Year  Maruti Corp Kenichi Ayukawa#BSAwardspic twitter com EVaO FHfSj,,
twitter_hashtag_maruti_corp,https://twitter.com/Maruti_Corp/status/845318213655158784,,9:55 AM - 24 Mar 2017,[],It s a wrap for tonight  Tune in with us on our facebook handle  marutisuzukiwayoflife tomorrow  for all the pictures  Have a goodnight ,,
twitter_hashtag_maruti_corp,https://twitter.com/Maruti_Corp/status/845309371512844289,,9:20 AM - 24 Mar 2017,"['And:3', 'Congratulations:3']",And we ve a winner  Congratulations Sunmesh Waghmare  Mumbai  on the win  We re proud to have safe drivers like you in the country pic twitter com DXwzHZ zP ,,
twitter_hashtag_maruti_corp,https://twitter.com/Maruti_Corp/status/845300517110636544,,8:45 AM - 24 Mar 2017,['Not:2016'], Not only is the person who drives responsible but also the way infrastructure is created      milindrunning at Autocar #YoungDrivers    pic twitter com UbXgOvYZxH,,
twitter_hashtag_maruti_corp,https://twitter.com/Maruti_Corp/status/845294520719753216,,8:21 AM - 24 Mar 2017,"['Panel:98', 'Discussion:5']",Panel Discussion  The general view is that technology makes the world a safer place but is that true for road safety pic twitter com r  ejGh tB,,
twitter_hashtag_maruti_corp,https://twitter.com/Maruti_Corp/status/845282640223649792,,7:34 AM - 24 Mar 2017,"['Quite:1', 'RS:38', 'Kalsi:30', 'Executive:8', 'Director:3']",      crore licenses are issued every year   only    lakh are by driving schools  Quite appalling    RS Kalsi  Executive Director  M S  MSILpic twitter com  lZkQWmj h,,
twitter_hashtag_maruti_corp,https://twitter.com/Maruti_Corp/status/845278650769457152,,7:18 AM - 24 Mar 2017,['Guess:5'],Guess who decided to drop by  Our #ColorsOfYouth Season   Finalists  The After Acoustics  They re simply musical  Check them out pic twitter com kBjgQIiJjo,,
twitter_hashtag_maruti_corp,https://twitter.com/Maruti_Corp/status/845265567464505346,,6:26 AM - 24 Mar 2017,"['As:5', 'Tune:1']",As the final test comes to an end  the team gears up for the prize distribution ceremony  Tune in with us to find out who stole the trophy pic twitter com Hic G sCVu,,
twitter_hashtag_maruti_corp,https://twitter.com/Maruti_Corp/status/845230157161889792,,4:05 AM - 24 Mar 2017,"['Parking:2016', 'And:8', 'Suraj:9']",Parking done right  And safely  Suraj Motwani from Chennai  absolutely nails it  Watch how   autocarindiamag #YoungDrivers    pic twitter com tkX ZP pGe,,
twitter_hashtag_maruti_corp,https://twitter.com/Maruti_Corp/status/845191752822644737,,1:33 AM - 24 Mar 2017,"['Chandan:2016', 'Jumani:1', 'Pune:1']",Chandan Jumani from Pune  reversing down the track like a boss at  autocarindiamag #YoungDrivers       Here s a bite pic twitter com oUJkmH v O,,
twitter_hashtag_maruti_corp,https://twitter.com/autocarindiamag/status/845158945060601858,,11:22 PM - 23 Mar 2017,"['The:2016', 'Young:2016', 'Drivers:7', 'May:5', 'Young:3']",The final test for #YoungDrivers     has officially been flagged off  May the safest driver win  #YoungDrivers     #SafetyQuotientpic twitter com yV B hU vR,,
twitter_hashtag_maruti_corp,https://twitter.com/Renuks/status/845137485873135618,,9:57 PM - 23 Mar 2017,"['At:2016', 'IDTR:1']",At IDTR Delhi for the Autocar Young drivers programme presented by Maruti Suzuki for the finale  Contestants just arrived #youngdrivers    pic twitter com vWP YtoYFM,,
twitter_hashtag_maruti_corp,https://twitter.com/Renuks/status/845149616332976131,,10:45 PM - 23 Mar 2017,"['With:2016', 'Hope:3']",With the two female contestants at #youngdriver       Hope to see this number grow next year #safetyquotientpic twitter com NfYpu hEgG,,
twitter_hashtag_maruti_corp,https://twitter.com/Maruti_Corp/status/845151184528719873,,10:51 PM - 23 Mar 2017,"['Our:6', 'NZv:98', 'TFl:3', 'ZGpu:01', 'TGt:6', 'Bb:8', 'HFSUW:0']",Our young drivers are ready for the track walk  …,,
twitter_hashtag_maruti_corp,https://twitter.com/CNBCTV18Live/status/845132257132109824,,9:36 PM - 23 Mar 2017,"['Maruti:18', 'Corp:8']",   Maruti Corp Chairman RC Bhargava In An #Excl With CNBC TV    Says March Will See A High Level Of Retail Sales pic twitter com dnxaxHa HM,,
twitter_hashtag_maruti_corp,https://twitter.com/CNBCTV18Live/status/845132629749915648,,9:38 PM - 23 Mar 2017,"['Maruti:18', 'Corp:1']",   Maruti Corp s RC Bhargava To CNBC TV    Auto Industry To Benefit Hugely From #GST pic twitter com t VzhntUcv,,
twitter_hashtag_maruti_corp,https://twitter.com/CNBCTV18News/status/845132888899170305,,9:39 PM - 23 Mar 2017,['Consumers:1'],“Consumers trust Maruti as a brand”  says RC Bhargava  Chairman   Maruti Corp pic twitter com qxbIKRtS o,,
twitter_hashtag_maruti_corp,https://twitter.com/CNBCTV18Live/status/845133059141742592,,9:39 PM - 23 Mar 2017,"['RC:0', 'Bhargava:8']",RC Bhargava Of  Maruti Corp Tells   soniashenoy  Situation w r t Implementation Of BS IV May Vary From One Co To Another pic twitter com iz SApsB B,,
