twitter_hashtag_ToyotaGB,https://twitter.com/ToyotaGB/status/888115582716960771,,12:17 PM - 20 Jul 2017,"['Sophisticated:1', 'Toyota:9']",Sophisticated style  #ToyotaCHRpic twitter com  FpDINfL T,,
twitter_hashtag_ToyotaGB,https://twitter.com/ToyotaGB/status/888077836527054849,,9:47 AM - 20 Jul 2017,"['First:67', 'Toyota:0']",First Toyota commercial vehicle available in Europe The     Toyota Corona pick up   pic twitter com xXyq wTKZk,,
twitter_hashtag_ToyotaGB,https://twitter.com/ToyotaGB/status/888044847847755776,,7:36 AM - 20 Jul 2017,"['New:4', 'FT:2']",New age  new thinking  #FT Xpic twitter com jSdoI GhIW,,
twitter_hashtag_ToyotaGB,https://twitter.com/ToyotaGB/status/887946691239792640,,1:06 AM - 20 Jul 2017,['By:5'],By the time you ve watched this  our UK factory will have made a new #Toyota pic twitter com HxHKDouz b,,
twitter_hashtag_ToyotaGB,https://twitter.com/ToyotaGB/status/887721478774566916,,10:11 AM - 19 Jul 2017,"['Q:2', 'Why:3']",Q  Why hydrogen A   pic twitter com nbE SAIIcG,,
twitter_hashtag_ToyotaGB,https://twitter.com/ToyotaGB/status/887638675533815808,,4:42 AM - 19 Jul 2017,['A:6'],A work of art  #ToyotaCHRpic twitter com  pKdoyfmjU,,
twitter_hashtag_ToyotaGB,https://twitter.com/IAAFWorldChamps/status/887631592960790528,,4:13 AM - 19 Jul 2017,['Toyota:440086'],  ToyotaGB to provide transport services as official partner of the  IAAFWorldChamps ,,
twitter_hashtag_ToyotaGB,https://twitter.com/ToyotaGB/status/887585557559357442,,1:11 AM - 19 Jul 2017,"['Squad:86', 'GT:9', 'Tf:8']",Squad goals  #GT  pic twitter com o wTfYLB e,,
twitter_hashtag_ToyotaGB,https://twitter.com/ToyotaGB/status/887390775432028160,,12:17 PM - 18 Jul 2017,"['Find:7', 'Toyota:6', 'CHRpic:7']",Find your flow  #ToyotaCHRpic twitter com nl HXEz b ,,
twitter_hashtag_ToyotaGB,https://twitter.com/ToyotaGB/status/887359317984157697,,10:12 AM - 18 Jul 2017,"['How:8', 'U:7']",How to fly    in carspic twitter com hU ALTqs W,,
twitter_hashtag_ToyotaGB,https://twitter.com/ToyotaGB/status/887313289688035328,,7:09 AM - 18 Jul 2017,"['A:911', 'Prius:24']",A #Prius beating a Porsche     on the famous Nürburgring It happened   pic twitter com SGPidrGwMH,,
twitter_hashtag_ToyotaGB,https://twitter.com/ToyotaGB/status/887231996690169856,,1:46 AM - 18 Jul 2017,['Blink:3'],Blink and you ll miss it  #LandCruiserpic twitter com VZaD jcHNh,,
twitter_hashtag_ToyotaGB,https://twitter.com/ToyotaGB/status/886995724109582337,,10:07 AM - 17 Jul 2017,"['Podium:4', 'Toyota:1']",Podium finish for Toyota Gazoo Racing at the Nürburgring   pic twitter com NFU OcONMe,,
twitter_hashtag_ToyotaGB,https://twitter.com/ToyotaGB/status/886921439001010176,,5:12 AM - 17 Jul 2017,"['Q:15', 'Can:4', 'Tamiya:4']",Q  Can     TamiyaUK models pull a full size #Hilux A  Just watch   pic twitter com  NTig KqhZ,,
twitter_hashtag_ToyotaGB,https://twitter.com/ToyotaGB/status/886913896044515328,,4:42 AM - 17 Jul 2017,['A:93'],A work of art  #ToyotaCHRpic twitter com h  qtgnKLx,,
twitter_hashtag_ToyotaGB,https://twitter.com/ToyotaGB/status/886884948216565761,,2:47 AM - 17 Jul 2017,"['Squad:86', 'GT:2', 'Zn:0']",Squad goals  #GT  pic twitter com f szZn hHA,,
twitter_hashtag_ToyotaGB,https://twitter.com/ToyotaGB/status/886558300812267525,,5:09 AM - 16 Jul 2017,['Beautifully:6'],Beautifully sculpted  #ToyotaCHRpic twitter com IGGT aoGOg,,
twitter_hashtag_ToyotaGB,https://twitter.com/ToyotaGB/status/886526344045240321,,3:02 AM - 16 Jul 2017,['Adventure:4'],Adventure  anywhere  #RAV pic twitter com jetCLEwDKA,,
twitter_hashtag_ToyotaGB,https://twitter.com/ToyotaGB/status/886227121697435650,,7:13 AM - 15 Jul 2017,[],Trailblazer  #Miraipic twitter com QZJcloYRFi,,
twitter_hashtag_ToyotaGB,https://twitter.com/ToyotaGB/status/886197713641013248,,5:16 AM - 15 Jul 2017,"['Good:6', 'Toyota:0', 'Hybrid:40', 'Nurburgring:0']",Good luck to  Toyota Hybrid at the # hNurburgring  Qualifying today  race at midday Sunday pic twitter com J r  w Xcl,,
twitter_hashtag_ToyotaGB,https://twitter.com/ToyotaGB/status/886165482205847553,,3:08 AM - 15 Jul 2017,"['The:7', 'Aygopic:9']",The coolest place to be this summer  #Aygopic twitter com DACh dV Bj,,
twitter_hashtag_ToyotaGB,https://twitter.com/ToyotaGB/status/885907508522561537,,10:03 AM - 14 Jul 2017,"['Round:4', 'Time:6', 'Ring:050', 'Nurburgring:6']",Round    Time to step into the  Ring  # hNurburgring  #Toyota #TS    pic twitter com NH ebjrTqM,,
twitter_hashtag_ToyotaGB,https://twitter.com/ToyotaGB/status/885868451847438336,,7:27 AM - 14 Jul 2017,"['Toyota:48', 'GDUEX:4']",Toyota rally cars in retro video games   what was your favourite   pic twitter com   oGDUEX k,,
twitter_hashtag_ToyotaGB,https://twitter.com/ToyotaGB/status/885818432243077120,,4:09 AM - 14 Jul 2017,['Your:0'],Your wild adventure begins here    #LandCruiserpic twitter com V UlyUseDY,,
twitter_hashtag_ToyotaGB,https://twitter.com/ToyotaGB/status/885771857978425349,,1:04 AM - 14 Jul 2017,['This:1'],This is more than just a simple hot hatch  #YarisGRMNpic twitter com p SOHaiiCQ,,
twitter_hashtag_ToyotaGB,https://twitter.com/ToyotaGB/status/885551680133234688,,10:29 AM - 13 Jul 2017,[],Pioneer  #Miraipic twitter com tgyXBjrPJy,,
twitter_hashtag_ToyotaGB,https://twitter.com/ToyotaGB/status/885509383223783424,,7:41 AM - 13 Jul 2017,"['Go:26', 'UK:8']",Go behind the scenes of our UK factory   pic twitter com cYc  UNTe ,,
twitter_hashtag_ToyotaGB,https://twitter.com/ToyotaGB/status/885492979414294529,,6:35 AM - 13 Jul 2017,['Great:0'],Great runners for great runners  We re helping the World Para Athletics and IAAF World Championships  #GoBetterpic twitter com FLOaFjc Li,,
twitter_hashtag_ToyotaGB,https://twitter.com/ToyotaGB/status/885460827528204288,,4:28 AM - 13 Jul 2017,"['The:2015', 'S:8', 'FR:59']",The S FR was a concept with character from       #TBT  pic twitter com b  xwrMfNJ,,
twitter_hashtag_ToyotaGB,https://twitter.com/ToyotaGB/status/885409218903199744,,1:03 AM - 13 Jul 2017,['Always:0'],Always innovating  #PriusPlugInpic twitter com Ewck dqScl,,
twitter_hashtag_ToyotaGB,https://twitter.com/ToyotaGB/status/885191052453457920,,10:36 AM - 12 Jul 2017,[],Revolutionary  #Miraipic twitter com ZQCQuArsuX,,
twitter_hashtag_ToyotaGB,https://twitter.com/ToyotaGB/status/885139701358710786,,7:12 AM - 12 Jul 2017,"['Just:2', 'Jy:1']",Just one exciting vision of the future   pic twitter com Jy jNuH oT,,
twitter_hashtag_ToyotaGB,https://twitter.com/ToyotaGB/status/885096927003648000,,4:22 AM - 12 Jul 2017,"['We:25', 'Britain:25', 'Auris:2', 'GB:1', 'Full:2']",We re celebrating    years of building in Britain with this special edition #Auris GB   Full details   pic twitter com jhn PKtF J,,
twitter_hashtag_ToyotaGB,https://twitter.com/RalphHosier/status/885084267180675074,,3:31 AM - 12 Jul 2017,"['I:4', 'Toyota:7']",I was immediately struck by the styling on the  ToyotaGB C HR  so I borrowed one to see if it s any good  Yes  yes it is  Really good pic twitter com  mmdGM wRJ,,
twitter_hashtag_ToyotaGB,https://twitter.com/ToyotaGB/status/885048091711111168,,1:08 AM - 12 Jul 2017,['Power:3'],Power  tamed Precision  perfected Performance  under pressure  #YarisGRMNpic twitter com xaV eProNW,,
twitter_hashtag_ToyotaGB,https://twitter.com/ToyotaGB/status/884827900880355328,,10:33 AM - 11 Jul 2017,"['Clean:8', 'Toyota:1', 'Hydrogen:7', 'Fuel:4', 'Cell:3']",Clean and quick  Toyota s Hydrogen Fuel Cell truck takes on diesel   pic twitter com S H d P bk,,
twitter_hashtag_ToyotaGB,https://twitter.com/ToyotaGB/status/884803171264102401,,8:54 AM - 11 Jul 2017,"['A:100', 'British:8']",A British start up firm is at the heart of a     million tech Investment from Toyota  pic twitter com iW IKtKXQk,,
twitter_hashtag_ToyotaGB,https://twitter.com/ToyotaGB/status/884776575652200450,,7:09 AM - 11 Jul 2017,"['The:86', 'GT:8', 'FG:1']",The true driver s car  #GT  pic twitter com w FG buKtj,,
twitter_hashtag_ToyotaGB,https://twitter.com/ToyotaGB/status/884731023896039424,,4:08 AM - 11 Jul 2017,"['Feel:9', 'Yaris:3']",Feel the #Yaris effect pic twitter com HTo r gmNz,,
twitter_hashtag_ToyotaGB,https://twitter.com/ToyotaGB/status/884686996320522240,,1:13 AM - 11 Jul 2017,"['New:4', 'FT:8', 'Xpic:5']",New age  new thinking  #FT Xpic twitter com LXI tjEs o,,
twitter_hashtag_ToyotaGB,https://twitter.com/ToyotaGB/status/884435570956611584,,8:34 AM - 10 Jul 2017,"['Inspired:85', 'Crafted:87']",Inspired by rally  Crafted for the road  #YarisGRMNpic twitter com Wpv  xi  G,,
twitter_hashtag_ToyotaGB,https://twitter.com/ToyotaGB/status/884395894434664448,,5:56 AM - 10 Jul 2017,"['Toyota:1', 'Yaris:6']",Toyota #Yaris Yellow Edition launched   styled and equipped to please  pic twitter com yf ShEKBBL,,
twitter_hashtag_ToyotaGB,https://twitter.com/ToyotaGB/status/884384995917344768,,5:13 AM - 10 Jul 2017,['Want:3'],Want to show off your pride and joy Join the #ToyotaTuesday Club    pic twitter com gYaQ dNQww,,
twitter_hashtag_ToyotaGB,https://twitter.com/ToyotaGB/status/884352519736111104,,3:04 AM - 10 Jul 2017,"['A:2', 'Toyota:1']",A work of art  #ToyotaCHRpic twitter com AUH jXc Ms,,
twitter_hashtag_ToyotaGB,https://twitter.com/ToyotaGB/status/884052523627159555,,7:12 AM - 9 Jul 2017,"['The:86', 'GT:8', 'W:4']",The drift king  #GT  pic twitter com W he nYkLL,,
twitter_hashtag_ToyotaGB,https://twitter.com/ToyotaGB/status/884026628732579841,,5:29 AM - 9 Jul 2017,['A:01'],A fresh perspective  #Yarispic twitter com   NwrfHCAR,,
twitter_hashtag_ToyotaGB,https://twitter.com/ToyotaGB/status/883989625328500737,,3:02 AM - 9 Jul 2017,"['It:2', 'We:93']",It was the go anywhere  do anything sports car that broke new ground We look back on the Celica   pic twitter com hZTqfI  IQ,,
twitter_hashtag_ToyotaGB,https://twitter.com/ToyotaGB/status/883689420347625472,,7:09 AM - 8 Jul 2017,"['New:4', 'FT:6', 'Xpic:6']",New age  new thinking  #FT Xpic twitter com  UmF zppqi,,
twitter_hashtag_ToyotaGB,https://twitter.com/ToyotaGB/status/883663217775357952,,5:25 AM - 8 Jul 2017,['Power:8'],Power  Precision  Performance  #YarisGRMNpic twitter com TPB hasFwn,,
twitter_hashtag_ToyotaGB,https://twitter.com/ToyotaGB/status/883623978102923264,,2:49 AM - 8 Jul 2017,"['A:911', 'Prius:24', 'Porsche:0']",A #Prius beating a Porsche     on the famous Nürburgring It happened   pic twitter com bwUB vRcHF,,
twitter_hashtag_ToyotaGB,https://twitter.com/ToyotaGB/status/883370279937875968,,10:01 AM - 7 Jul 2017,['TGIF:692'],TGIF pic twitter com RoLsdc   a,,
twitter_hashtag_ToyotaGB,https://twitter.com/ToyotaGB/status/883354211366383616,,8:57 AM - 7 Jul 2017,['Thank:6'],Thank you to everyone who has joined the Toyota hybrid family this year Our hybrid sales have soared   pic twitter com m yJhFGBnx,,
twitter_hashtag_ToyotaGB,https://twitter.com/ToyotaGB/status/883327016401076224,,7:09 AM - 7 Jul 2017,"['Sun:3', 'Aygopic:4']",Sun s out  fun s out  #Aygopic twitter com  NMUkCrc C,,
twitter_hashtag_ToyotaGB,https://twitter.com/ToyotaGB/status/883282731299483648,,4:13 AM - 7 Jul 2017,"['Meet:911', 'Porsche:24']",Meet the man who took on a Porsche     at the famous  nuerburgring in his #Prius    and won   pic twitter com WPQgxJWWxQ,,
twitter_hashtag_ToyotaGB,https://twitter.com/ToyotaGB/status/883232141500325888,,12:52 AM - 7 Jul 2017,"['Who:0', 'England:86', 'We:1']",Who is England s fittest cricketer We ve teamed up with  englandcricket to find out    #AlwaysABetterWaypic twitter com s g  MDn y,,
twitter_hashtag_ToyotaGB,https://twitter.com/ToyotaGB/status/883010933311684608,,10:13 AM - 6 Jul 2017,['Who:76'],Who is England s fittest cricketer We ve teamed up with  englandcricket to find out    #AlwaysABetterWaypic twitter com ruxTyb  AH,,
twitter_hashtag_ToyotaGB,https://twitter.com/ToyotaGB/status/882965139112251394,,7:11 AM - 6 Jul 2017,"['Can:911', 'Prius:24', 'Porsche:2', 'N:1', 'X:6']",Can the #Prius beat a Porsche     around the Nürburgring   pic twitter com pX q qAgp ,,
twitter_hashtag_ToyotaGB,https://twitter.com/ToyotaGB/status/882927569884020737,,4:41 AM - 6 Jul 2017,"['Inspired:1', 'Crafted:2', 'Here:8', 'K:8']",Inspired by rally  Crafted for the road  Here s how    #YarisGRMNpic twitter com ygj X juJ ,,
twitter_hashtag_ToyotaGB,https://twitter.com/ToyotaGB/status/882874523007242240,,1:11 AM - 6 Jul 2017,"['Toyota:1', 'US:53']",Toyota robots are learning to help US war veterans rediscover their independence   pic twitter com kBOWj FP  ,,
twitter_hashtag_ToyotaGB,https://twitter.com/ToyotaGB/status/882648550127087616,,10:13 AM - 5 Jul 2017,[],Pioneer  #Miraipic twitter com IFIcnRlffy,,
twitter_hashtag_ToyotaGB,https://twitter.com/ToyotaGB/status/882606088138481664,,7:24 AM - 5 Jul 2017,"['Inspired:1', 'Crafted:8']",Inspired by rally  Crafted for the road  Here s how    #YarisGRMNpic twitter com KDCdvJSiy ,,
twitter_hashtag_ToyotaGB,https://twitter.com/ToyotaGB/status/882558437158080512,,4:15 AM - 5 Jul 2017,"['Who:2', 'England:1']",Who is England s fittest cricketer We ve teamed up with  englandcricket to find out    #AlwaysABetterWaypic twitter com dh L GFgyV,,
twitter_hashtag_ToyotaGB,https://twitter.com/ToyotaGB/status/882509887724556289,,1:02 AM - 5 Jul 2017,"['Take:34', 'Aygo:2']",Take a peek inside the latest red hot #Aygo x cite     pic twitter com   ZKSI nUA,,
twitter_hashtag_ToyotaGB,https://twitter.com/ToyotaGB/status/882290194891886592,,10:29 AM - 4 Jul 2017,"['A:6', 'Yarispic:9']",A fresh perspective  #Yarispic twitter com Z Avtj hAS,,
twitter_hashtag_ToyotaGB,https://twitter.com/ToyotaGB/status/882273064536469504,,9:21 AM - 4 Jul 2017,"['Toyota:36', 'US:5', 'Kl:8']",Toyota robots are learning to help US war veterans rediscover their independence    #IndependenceDaypic twitter com   h i fOJQ,,
twitter_hashtag_ToyotaGB,https://twitter.com/ToyotaGB/status/882243387663020032,,7:23 AM - 4 Jul 2017,['Big:1'],Big air #Yaris takes points at tough going #WRC Rally Poland   pic twitter com k GrelpqEx,,
twitter_hashtag_ToyotaGB,https://twitter.com/ToyotaGB/status/882197568758759424,,4:21 AM - 4 Jul 2017,"['Blink:601', 'Land:9', 'Cruiserpic:7']",Blink and you ll miss it    #LandCruiserpic twitter com    lnA n A,,
twitter_hashtag_ToyotaGB,https://twitter.com/ToyotaGB/status/882152524953915392,,1:22 AM - 4 Jul 2017,"['We:25', 'Britain:25', 'Auris:2']",We re celebrating    years of building in Britain with this special edition #Auris GB   Full details   pic twitter com CpJCoPZizg,,
twitter_hashtag_ToyotaGB,https://twitter.com/ToyotaGB/status/881889781034008577,,7:58 AM - 3 Jul 2017,"['Who:6', 'England:8', 'We:9', 'Ki:4']",Who is England s fittest cricketer We ve teamed up with  englandcricket to find out    #AlwaysABetterWaypic twitter com h yR CoT J,,
twitter_hashtag_ToyotaGB,https://twitter.com/ToyotaGB/status/881848708798836736,,5:14 AM - 3 Jul 2017,['Yaris:3'],#Yaris takes points at tough going #WRC Rally Poland  Our report   pic twitter com GhyWdofQU ,,
twitter_hashtag_ToyotaGB,https://twitter.com/ToyotaGB/status/881823862081572865,,3:36 AM - 3 Jul 2017,['Find:8'],Find your flow  #ToyotaCHRpic twitter com QwolHcPQs ,,
twitter_hashtag_ToyotaGB,https://twitter.com/ToyotaGB/status/881786597733093376,,1:08 AM - 3 Jul 2017,"['Power:8', 'Precision:2']",Power  Precision  Performance  #YarisGRMNpic twitter com jOy C Qmdo,,
twitter_hashtag_ToyotaGB,https://twitter.com/ToyotaGB/status/881517594909569024,,7:19 AM - 2 Jul 2017,['Inspired:2'],Inspired by rally  Crafted for the road  #YarisGRMNpic twitter com nbVrTfhZa ,,
twitter_hashtag_ToyotaGB,https://twitter.com/ToyotaGB/status/881462285448957953,,3:39 AM - 2 Jul 2017,['WRC:20'],#WRC Poland is coming to a close Here are the latest snaps from the rally pic twitter com ZXjRlSEB  ,,
twitter_hashtag_ToyotaGB,https://twitter.com/ToyotaGB/status/881431540646936577,,1:37 AM - 2 Jul 2017,"['Visiting:06', 'Cabot:1', 'Circus:8']",Visiting  CabotCircus Bristol this weekend  Don t miss out on your chance to explore the All New #ToyotaCHR   pic twitter com g  L vooo ,,
twitter_hashtag_ToyotaGB,https://twitter.com/ToyotaGB/status/881152683717136386,,7:09 AM - 1 Jul 2017,"['A:69', 'Toyota:1']",A work of art  #ToyotaCHRpic twitter com T  c IOrVT,,
twitter_hashtag_ToyotaGB,https://twitter.com/ToyotaGB/status/881122071245463552,,5:07 AM - 1 Jul 2017,"['WRC:5', 'Poland:6']",#WRC Poland is well underway Here s everything you need to know   pic twitter com rrfO R PQl,,
twitter_hashtag_ToyotaGB,https://twitter.com/ToyotaGB/status/881078466589937664,,2:14 AM - 1 Jul 2017,"['Visiting:4', 'Cabot:4']",Visiting  CabotCircus Bristol this weekend  Don t miss out on your chance to explore the All New #ToyotaCHR   pic twitter com Il CVn HFp,,
twitter_hashtag_ToyotaGB,https://twitter.com/ToyotaGB/status/880834337402441729,,10:04 AM - 30 Jun 2017,['Take:22'],Take a peek inside the latest red hot #Aygo x cite     pic twitter com rOqwV  OmN,,
twitter_hashtag_ToyotaGB,https://twitter.com/ToyotaGB/status/880818524700147712,,9:01 AM - 30 Jun 2017,['Visiting:3'],Visiting  CabotCircus Bristol this weekend  Don t miss out on your chance to explore the All New #ToyotaCHR   pic twitter com zYnmeYmg C,,
twitter_hashtag_ToyotaGB,https://twitter.com/ToyotaGB/status/880792807262232576,,7:19 AM - 30 Jun 2017,"['Record:86', 'GT:3', 'P:5']",Record breaker  #GT  pic twitter com oxP QQZ eP,,
twitter_hashtag_ToyotaGB,https://twitter.com/ToyotaGB/status/880746013195210754,,4:13 AM - 30 Jun 2017,['Trailblazer:0'],Trailblazer  #Miraipic twitter com  ihVJIGdlm,,
twitter_hashtag_ToyotaGB,https://twitter.com/ToyotaGB/status/880702218424520704,,1:19 AM - 30 Jun 2017,['WRC:3'],#WRC Rally Poland has begun Here s everything you need to know   pic twitter com J QSQHmeAm,,
twitter_hashtag_ToyotaGB,https://twitter.com/ToyotaGB/status/880494328644108288,,11:33 AM - 29 Jun 2017,"['Six:2050', 'This:0', 'Toyota:6']",Six aims to help create a better world This is the Toyota Environmental Challenge        pic twitter com scsJr A Ou,,
twitter_hashtag_ToyotaGB,https://twitter.com/ToyotaGB/status/880429185113755648,,7:14 AM - 29 Jun 2017,['The:8'],The  OfficialWRC is back Here s everything you need to know about Rally Poland   pic twitter com lyMuwdl bF,,
twitter_hashtag_ToyotaGB,https://twitter.com/ToyotaGB/status/880353659665739777,,2:14 AM - 29 Jun 2017,['The:6'],The #Aygo x cite has got a red hot new look for the summer     pic twitter com MQhbplxbS ,,
twitter_hashtag_ToyotaGB,https://twitter.com/ToyotaGB/status/880122637145579524,,10:56 AM - 28 Jun 2017,['More:4'],More than a simple hot hatch  #YarisGRMNpic twitter com HC FjBmYmz,,
twitter_hashtag_ToyotaGB,https://twitter.com/ToyotaGB/status/880072327647551489,,7:36 AM - 28 Jun 2017,"['WRC:92', 'Rally:7']",#WRC Rally Poland is nearly here Here s everything you need to know   pic twitter com w  EtWMQH ,,
twitter_hashtag_ToyotaGB,https://twitter.com/ToyotaGB/status/880037072433811456,,5:16 AM - 28 Jun 2017,"['New:8', 'Aygo:1']",New #Aygo x cite gets red hot this summer     pic twitter com Mmk xBIZ T,,
twitter_hashtag_ToyotaGB,https://twitter.com/ToyotaGB/status/879975704418553857,,1:12 AM - 28 Jun 2017,['Record:86'],Record breaker  #GT    pic twitter com BzhycuKOju,,
twitter_hashtag_ToyotaGB,https://twitter.com/ToyotaGB/status/879762272599629824,,11:04 AM - 27 Jun 2017,['A:63'],A work of art  #ToyotaCHRpic twitter com kQEFQ  UDE,,
twitter_hashtag_ToyotaGB,https://twitter.com/ToyotaGB/status/879733837588176896,,9:11 AM - 27 Jun 2017,"['Six:2050', 'This:1']",Six aims to help create a better world This is the Toyota Environmental Challenge        pic twitter com XAtPDl Xij,,
twitter_hashtag_ToyotaGB,https://twitter.com/ToyotaGB/status/879703879109292032,,7:12 AM - 27 Jun 2017,['The:8'],The latest member of the #ToyotaTuesday Club is Brian and his Yaris  snapped in Sunderland Join   pic twitter com ZbMZ wlAMS,,
twitter_hashtag_ToyotaGB,https://twitter.com/ToyotaGB/status/879673929761042433,,5:13 AM - 27 Jun 2017,"['Toyota:4', 'CHR:3']", #ToyotaCHR Made for #NationalSunglassesDay pic twitter com yDuOwM r y,,
twitter_hashtag_ToyotaGB,https://twitter.com/ToyotaGB/status/879628798953758720,,2:13 AM - 27 Jun 2017,"['Inspired:8', 'Crafted:1', 'Yaris:5']",Inspired by rally  Crafted for the road  #YarisGRMNpic twitter com uq zoI N G,,
twitter_hashtag_ToyotaGB,https://twitter.com/ToyotaGB/status/879342020531302400,,7:14 AM - 26 Jun 2017,['The:5'],The #Yaris effect pic twitter com uq sMDKZav,,
twitter_hashtag_ToyotaGB,https://twitter.com/ToyotaGB/status/879313820140875776,,5:22 AM - 26 Jun 2017,"['Celebrating:25', 'Britain:2', 'Full:5', 'T:7']",Celebrating    years building in Britain  Full details   pic twitter com  iZ vFjwus,,
twitter_hashtag_ToyotaGB,https://twitter.com/ToyotaGB/status/879278827653943300,,3:03 AM - 26 Jun 2017,['Record:86'],Record breaker  #GT  pic twitter com wWpKbIVDGz,,
twitter_hashtag_ToyotaGB,https://twitter.com/ToyotaGB/status/878982624529719296,,7:26 AM - 25 Jun 2017,"['More:7', 'Yaris:6', 'GRMNpic:4']",More than a simple hot hatch  #YarisGRMNpic twitter com dHI b Cy i,,
twitter_hashtag_ToyotaGB,https://twitter.com/ToyotaGB/status/878946410632269824,,5:02 AM - 25 Jun 2017,"['Want:9', 'Then:9']",Want to show off your pride and joy Then join the #ToyotaTuesday Club   pic twitter com W mTd Hrlp,,
twitter_hashtag_ToyotaGB,https://twitter.com/ToyotaGB/status/878894828398026756,,1:37 AM - 25 Jun 2017,"['Visiting:7', 'Bullring:5']",Visiting  Bullring Birmingham this weekend  Don t miss your chance to explore the All New #ToyotaCHR   pic twitter com yUGuri y C,,
twitter_hashtag_ToyotaGB,https://twitter.com/ToyotaGB/status/878617227536330752,,7:14 AM - 24 Jun 2017,"['We:25', 'Britain:25', 'Auris:2', 'Hybrid:2', 'GB:7']",We re celebrating    years of building cars in Britain with a limited edition #Auris Hybrid GB   Full details   pic twitter com HrHDB tB f,,
twitter_hashtag_ToyotaGB,https://twitter.com/ToyotaGB/status/878585782864424960,,5:09 AM - 24 Jun 2017,"['Inspired:1', 'Crafted:47']",Inspired by rally  Crafted for the road  #YarisGRMNpic twitter com zU RSDW  i,,
twitter_hashtag_ToyotaGB,https://twitter.com/ToyotaGB/status/878546785274408960,,2:34 AM - 24 Jun 2017,['Visiting:8'],Visiting  Bullring Birmingham this weekend  Don t miss your chance to explore the All New #ToyotaCHR   pic twitter com  JxIJXveON,,
twitter_hashtag_ToyotaGB,https://twitter.com/ToyotaGB/status/878285026927853568,,9:14 AM - 23 Jun 2017,"['TGIF:0', 'YRp:2']",#TGIF pic twitter com YRp qRn AI,,
twitter_hashtag_ToyotaGB,https://twitter.com/ToyotaGB/status/878254081034272769,,7:11 AM - 23 Jun 2017,['Go:1'],Go behind the scenes to see how The Dance came together  #YarisGRMNpic twitter com ZZVUQc HJd,,
twitter_hashtag_ToyotaGB,https://twitter.com/ToyotaGB/status/878194463201529856,,3:14 AM - 23 Jun 2017,['Visiting:1'],Visiting  Bullring Birmingham this weekend  Don t miss your chance to explore the All New #ToyotaCHR   pic twitter com MsxKxGtz Z,,
twitter_hashtag_ToyotaGB,https://twitter.com/ToyotaGB/status/878169289039257600,,1:34 AM - 23 Jun 2017,"['Want:3', 'Join:6']",Want to show off your pride and joy Join the #ToyotaTuesday Club   pic twitter com MBFZn bJ F,,
twitter_hashtag_ToyotaGB,https://twitter.com/ToyotaGB/status/877957383690919936,,11:32 AM - 22 Jun 2017,"['The:65', 'Yaris:83', 'GRMN:3']",The #YarisGRMN is more than a simple hot hatch pic twitter com K  G  n xZ,,
twitter_hashtag_ToyotaGB,https://twitter.com/ToyotaGB/status/877921142719119361,,9:08 AM - 22 Jun 2017,['Performance:0'],Performance under pressure  Sign up for more about #YarisGRMN   pic twitter com bcBrPXBPAF,,
twitter_hashtag_ToyotaGB,https://twitter.com/ToyotaGB/status/877899517789704193,,7:42 AM - 22 Jun 2017,"['We:25', 'Britain:25', 'Auris:2', 'Hybrid:4']",We re celebrating    years of building cars in Britain with the #Auris Hybrid GB   Full details   pic twitter com xpzgdDLmI ,,
twitter_hashtag_ToyotaGB,https://twitter.com/ToyotaGB/status/877859228509020160,,5:02 AM - 22 Jun 2017,"['Precision:0', 'Sign:7', 'Yaris:9']",Precision  perfected  Sign up for more about #YarisGRMN   pic twitter com UIZxGp D P,,
twitter_hashtag_ToyotaGB,https://twitter.com/ToyotaGB/status/877806887047122944,,1:34 AM - 22 Jun 2017,['Power:0'],Power  tamed  Sign up for more about #YarisGRMN   pic twitter com HBDXRxegsg,,
twitter_hashtag_ToyotaGB,https://twitter.com/ToyotaGB/status/877590232895336448,,11:13 AM - 21 Jun 2017,['Want:8'],Want to show off your pride and joy Join the #ToyotaTuesday Club   pic twitter com JD ouLLTTZ,,
twitter_hashtag_ToyotaGB,https://twitter.com/ToyotaGB/status/877580142020894720,,10:33 AM - 21 Jun 2017,"['Find:6', 'Toyota:5']",Find your flow  #ToyotaCHRpic twitter com  fV FMdmEm,,
twitter_hashtag_ToyotaGB,https://twitter.com/ToyotaGB/status/877529803166892032,,7:13 AM - 21 Jun 2017,"['Power:4', 'Precision:3']",Power  Precision  Performance  #YarisGRMNpic twitter com PQ B LdJmH,,
twitter_hashtag_ToyotaGB,https://twitter.com/ToyotaGB/status/877471663461466112,,3:22 AM - 21 Jun 2017,['We:8'],We re looking for the next generation of automotive writers Apply here    #NationalWritingDaypic twitter com lNqbhFrnK ,,
twitter_hashtag_ToyotaGB,https://twitter.com/ToyotaGB/status/877444994675556352,,1:36 AM - 21 Jun 2017,"['Toyota:6', 'THUMS:8']",Toyota is bringing its groundbreaking THUMS technology to motorsport   pic twitter com XURtu ViY ,,
twitter_hashtag_ToyotaGB,https://twitter.com/ToyotaGB/status/877219011745861632,,10:38 AM - 20 Jun 2017,"['Six:2050', 'This:51']",Six aims to help create a better world This is the Toyota Environmental Challenge        pic twitter com zXoL  mcQs,,
twitter_hashtag_ToyotaGB,https://twitter.com/ToyotaGB/status/877164909477339137,,7:03 AM - 20 Jun 2017,"['Power:3', 'Precision:8', 'Performance:8']",Power  Precision  Performance  #YarisGRMNpic twitter com qk xS CAS ,,
twitter_hashtag_ToyotaGB,https://twitter.com/ToyotaGB/status/877096971865030661,,2:33 AM - 20 Jun 2017,"['Stay:7', 'Aygopic:9']",Stay cool this summer  #Aygopic twitter com Bnr ujSH d,,
